'একদিন কান্নার রোল উঠবে';'একদিন কান্নার রোল উঠবে আমার বাড়িতে।
 আর আমি জানি তোমার জন্যেই
 এই পৃথিবীতে আসা
 আমার সোনা যাদু
 তোমায় ভাবি শুধু ।।
 তুমি অবুঝ ভালবাসা
 তোমার জন্য এই পৃথিবীতে আসা

ওহো হো হ হো …
 রাত্রি যেমন নিজেকে সাজায়
 জোছনার আদরে আদরে
 তেমনি তোমায় বুকে রেখে তো
 রেখেছি যতন করে ।।
 আমার সোনা যাদু
 তোমায় ভাবি শুধু ।।
 তুমি অবুঝ ভালবাসা
 তোমার জন্য এই পৃথিবীতে আসা

কতনা খবর শুনি সদাই
 তুমি তবু আছো শিরোনামে
 তোমার তরে দিতে পারি এ জীবন
 শুধু এই জীবনের দামে ।।
 তুমি আমার সোনা যাদু
 তোমায় ভাবি শুধু ।।
 তুমি অবুঝ ভালবাসা
 তোমার জন্য এই পৃথিবীতে আসা';'শফিক তুহিন ও লাবন্য';'পবিত্র প্রেম';'0'
'একটি দুষ্টু ছেলে আর একটি মিষ্টি মেয়ে';'(মিতু, একটা গান শোনাও না
 না তুমি শোনাও, অনেকদিন তোমার গান শুনি না
 আচ্ছা মিতু, তোমার মনে পড়ে-
 সেই ছোট্টবেলায় লুকোচুরি খেলতে খেলতে
 হটাৎ তুমি আমাকে বললে-
 কিছু পেয়ারা পেরে দিতে।
 আমি গাছে উঠলাম, কিছু পেয়ারা পেরে তোমায় দিলাম
 এমনি হটাৎ রুমির মা এসে আমায় ধরে ফেললো
 আর তুমি, তুমি পালিয়ে গেলে…)

একটি দুষ্টু ছেলে আর একটি মিষ্টি মেয়ে।
 ওরা ধরা পড়েছিল সেই পেয়ারা চুরি করে।।

হো… হো… হে হে…ও…ও… হুম…হু…ও…
 (এই চুপ করে কেন? তুমিও গাও
 কথাটা তো সত্যি, আর এরই নাম তো স্মৃতি

একটি দুষ্টু ছেলে আর একটি মিষ্টি মেয়ে।
 ওরা ধরা পড়েছিল সেই পেয়ারা চুরি করে।।

হো… হো… হে হে…ও…ও… হুম…হু…ও…
 (এই বন্ধ করো তো এসব, গান গাও
 এটা কী গান নয়
 জীবনের কিছু কথাই তো গান)

একদিন সেই ছেলে পৃথিবীটাকে
 অন্য চোখে অন্য ভাবে দেখে।

সেই মেয়ে স্বপ্নে স্বর্গ থেকে
 হটাৎ পালিয়ে গেলে।';'লাকী আখন্দ ও রোকেয়া';'লাকী আখন্দ';'0'
'বাংলা আমার সরসে ইলিশ';'বাংলা আমার সরসে ইলিশ চিংড়ি কচি লাউ
 বাংলা পারশে মাছ কে ধুয়ে জিরের বাটায় দাও
 বাংলা ভুলি কি করে, বাংলা বুকের ভিতরে।।
 বাংলা কাতলা মাছ এর মুড়য় মুগের ভাঁজা ডাল
 বাংলা পাবদা মাছ চেরা কাঁচা লঙ্কার ঝাল
 কেউ খেলে আর দু’মুঠো চাল দাও হাড়িতে দাও
 বাংলা ভুলি কি করে, বাংলা বুকের ভিতরে।।
 শীতের ভোরে বেওরা পুকুর টুসু গান এর সারি
 নতুন চাল এর ভাপা পিঠে সুরু ছাঁকলি আহামরি
 বাংলা ভুলি কি করে, বাংলা বুকের ভিতরে।।
 বাংলা ঈদের লাড্ডু বানায় আবছা ভরে ওঠা
 বাংলা কিশোর ভাই এর মাথায় ছোট্ট বোন এর ফোঁটা
 বাংলা বলা সমস্ত মুখ নাও গো সাথে নাও
 বাংলা ভুলি কি করে, বাংলা বুকের ভিতরে।।';'লোপামুদ্রা মিত্র';'২০১০';'0'
'তুমি সন্ধাকাশের তাঁরার মত';'তুমি সন্ধাকাশের তাঁরার মত আমার মনে জ্বলবে
 তুমি ঘুমের ঘোরে স্বপন মাঝে মনের কথা বলবে।।

শীতের সাজে রজনীগন্ধা ফুটবে যবে বনে
 হয়ত তুমি আসবে নাকো আমার শূন্য মনে
 ভোরের ঝরা মেঘকে শিশির তোমার কথা বলবে।

মৌ বনে আজ মৌমাছিদের মধু গুঞ্জরণে
 হারিয়ে যাব আমি আবার তোমার আলাপনে
 তোমার মুখের মিষ্টি হাসি আমার কথা বলবে।।';'সাইফুল ইসলাম';'আজমল হুদা মিঠু';'0'
'তুমি ছাড়া';'তোমাকে পেয়েছি আমার এই জীবনে
 ভালোবেসে নেবো তাই বুকে জড়িয়ে
 তুমি মিশে আছ আমারই মনেপ্রাণে
 এস না হৃদয়ের গহীনে
 ও ও ও ও ও
 তুমি ছাড়া নেই তো আমার সুখের আর কেউ
 তোমারই মত এমন ও করে ভালবাসবে কে বলো
 তুমি ছাড়া নেই তো আমার সুখের আর কেউ
 তোমারই মত এমন ও করে ভালবাসবে কে বলো

ভিজে যাব দুজনাই ভালবাসারই জলে
 জলধারা কোনো শ্রাবণ ও দিনে
 ভিজে যাব দুজনাই ভালবাসারই জলে
 জলধারা কোনো শ্রাবণ ও দিনে
 এত সুখ এত দিনে তুমি দিলেগো আমায়
 বাচঁবনা কখনো ছেড়ে থাকতে তোমায়
 তুমি ছাড়া নেই তো আমার সুখের আর কেউ
 তোমারই মত এমন ও করে ভালবাসবে কে বলো
 তুমি ছাড়া নেই তো আমার সুখের আর কেউ
 তোমারই মত এমন ও করে ভালবাসবে কে বলো

দুটি হৃদয় মিশে গেল ভালবাসার মিলনে
 চায়না কিছু তুমি হিনা জীবনে
 এত সুখ এত দিনে তুমি দিলেগো আমায়
 বাচঁবনা কখনো ছেড়ে থাকতে তোমায়
 তুমি ছাড়া নেই তো আমার সুখের আর কেউ
 তোমারই মত এমন ও করে ভালবাসবে কে বলো
 তুমি ছাড়া নেই তো আমার সুখের আর কেউ
 তোমারই মত এমন ও করে ভালবাসবে কে বলো';'মিলন এবং পূজা';'তুমি';'0'
'ঘুরে ঘুরে বারে বারে';'ঘুরে ঘুরে (ও….) বারে বারে
 হৃদয় খুজে ফেরে যে মধুর সুর
 সে তোমার মুখ।।

চোখেরই ভাষা মনে আশা
 তোমায় শুধু চায় গো
 আর তো চাওয়া নাই

জীবনে তোমার মরণে তোমার
 আদর যেন পাই গো
 আর তো চাওয়া নাই

আমি ভয় করি না দুঃখ ব্যাথা
 আসে *** ***
 যে মধুর সুর
 সে তোমার মুখ।।

হাজার পাওয়া প্রানের হাওয়া
 আমায় ভরে দাও গো
 আমারই হয়ে যাও

আমারই কাছে আমারই মাঝে
 তোমায় খুজে নাও গো
 আমারই হয়ে যাও

তুমি রইলে কাছে
 লক্ষ আঘাত সইতে পারে বুক
 যে মধুর সুর
 সে তোমার মুখ।।';'মিতালী মুখার্জী ও তপন চৌধুরী';'আলাউদ্দিন আলী';'0'
'আমি অনেক ব্যাথার শ্রাবন পেড়িয়ে';'আমি অনেক ব্যাথার শ্রাবন পেড়িয়ে
 এসেছি তোমার কাছে
 গানের ফাগুন এখনো আছে
 দিও না আমায় ফিরিয়ে।।

কতবার আমি ফিরে চলে গেছি
 হাসি মুখে কত ব্যাথা ভুলে গেছি।
 রয়েছি তোমার জীবনে মরণে
 তোমারই স্বপ্ন নিয়ে
 গানের ফাগুন এখনো আছে
 দিও না আমায় ফিরিয়ে।।

কতবার কত গান থেমে গেছে
 কত না আশার ফুল ঝরে গেছে।
 ভেসে গাছি আমি ব্যাথার শ্রাবনে
 মনটা তোমাকে দিয়ে
 গানের ফাগুন এখনো আছে
 দিও না আমায় ফিরিয়ে।।';'তপন চৌধুরী';'আধুনিক';'0'
'আলো ভেবে যারে আমি';'আলো ভেবে যারে আমি জীবনে জড়াতে চাই
 সে তো আলো নয় যেন আলেয়া।।

নিরজনে আমি শুধু আধারে হারিয়ে যাই
 সে তো আলো নয় যেন আলেয়া।।

শপথের মালা সে তো খুলে ফেলেছে
 ভালবাসা স্মৃতিটুকু মুছে ফেলেছে।।

সুখের বাগানে সেতো আগুন জ্বেলেছে
 না ফোঁটা গোলাপ কলি ঝরে পড়েছে।';'তপন চৌধুরী';'আধুনিক';'0'
'ফুলের মত আমার এ প্রেম';'ফুলের মত আমার এ প্রেম
 দুপায়ে যে মাড়িয়ে গেছে
 জানি না এ অবুঝ স্মৃতি কেন বারে বার
 ফিরে যায় তারই কাছে।।

কতবার বললাম পোড়া মনটাকে
 হৃদয় মরেছে যার ভেলে যাও তাকে।
 মন বলে প্রেম কী মরে কোনদিন
 সে তো নেই তবু তার স্মৃতিরা আছে
 ফিরে যায় তারই কাছে।।

একবার হারলাম প্রেমের কাছে
 বারবার হারি আজ মনের কাছে।
 মনও আমার চেয়ে বেশী জানে
 পৃথিবীতে কী আমার মূল্য আছে
 ফিরে যায় তারই কাছে।।';'তপন চৌধুরী';'আধুনিক';'0'
'প্রেমে পড়বে কার';'আমি ছাড়া তুমি আর
 প্রেমে পড়বে কার
 জালা যন্ত্রণা সব আমার
 আর ভালবাসা শুধু তোমার।।

তুমি হলে মন
 আমি মনের অনুভূতি
 তুমি হলে প্রাণ
 আমি প্রানের আকুতি
 এ জীবনে মিলেমিশে হবো একাকার

তুমি হলে রাত সপ্ন হব আমি,
 তুমি হলে উতল মাতাল হব আমি।
 চারিপাশে যত কিছু শুধু দুজনার।';'আসিফ আকবর';'এক্স প্রেম';'0'
'তুমি না থাকলে';'তুমি না থাকলে জীবনে আমার
 বসন্ত আসার প্রশ্নই উঠে না
 রোদের আকাশে চাঁদ থাকলেও
 জোছনার স্নিগ্ধতা ফুটে না
 প্রশ্নই উঠে না।।

তুমি আছ তাই খোজ নিতে যাই
 কখন ফাগুন এসে কখন যাবে
 তুমি আছ তাই খোজ নিতে যাই
 কখন শ্রাবন এসে কখন যাবে
 কখন কোকিল গানে প্রান পাবে
 নদীর ধারা সাগরে ছাড়া
 অন্য কোথাও জানি ছুটে না
 প্রশ্নই উঠে না।।

আমি যাহা চাই তাই তুমি তাই
 শ্রাবন দিনেও মনে ফাগুন লাগে।
 হৃদয় নদীর বুকে বান জাগে
 এমন প্রেমে বিরহ নেমে
 সেই সে বাধন জানি টুটে না
 প্রশ্নই উঠে না।।';'সৈয়দ আব্দুল হাদী';'আধুনিক';'0'
'আমি সাম্পানে বাধিব ঘর';'আমি সাম্পানে বাধিব ঘর
 তুমি সাথী হলে (হায়)
 জোয়ার ভাটায় দুলবো দুজন
 ঢেউয়ের তালে তালে (হায়)।।

দুচোখ ভরে দেখবো কত মনোহর শোভা
 হার মানিবো তোমার কাছে তুমি অপরূপা
 বলবো তোমায় নদীর কথা
 বলবো আমার মনের কথা
 স্বাদের পিদীম জ্বেলে।।

নদীর বাঁকে ভয় করো না যাব মোহনায়
 সাগর সে তো আপন সখা রবো দুজনায়
 দেখবো সেথায় জলের খেলা
 তোমার আমার সুখের ভেলা
 কেমনে ভেসে চলে (হায়)।।';'কুমার বিশ্বজিত';'আধুনিক';'0'
'নোটন নোটন পায়রাগুলো';'নোটন নোটন পায়রাগুলো
 কোথায় উড়ে যায়
 স্বপ্ন ভরা জীবনে তার
 ছন্দ খুজে পায়।

পাখা মেলে হাওয়ার বুকে
 ঘুরে বেড়ায় মনের সুখে
 কোন মায়াবীর কাজল চোখে
 বারেক ফিরে চায়।।

পায়রাগুলো নিয়ে যাবে
 মনের কথা যত
 চঞ্চলতায় আঁখির কোনে
 ভাবনা শত শত।

কি যেন কোন সুরের সাথী
 জ্বালিয়ে দেবে মনের বাতি
 ছন্দমুখর জীবন জুড়ে
 মিষ্টি সুরে গায়।।';'রুনা লায়লা';'আধুনিক';'0'
'কে তুমি এলে মোর এই জীবনে';'কে তুমি এলে মোর এই জীবনে
 ফাগুন এসেছে তাই বনে বনে।
 আশার স্বপন জাগে দুই নয়নে

আকাশে আমার তুমি সোনালী আলো
 লেগেছে তোমারে তাই এতো যে ভাল।

লাজেতে মুখ ঢাকো নতুন কোনে
 কে তুমি….

আকুল পাপিয়া মনে ডাকে যে পিয়া পিয়া
 সেই সুরেতে জাগে হায় আমার ব্যাকুল হিয়া

রঙিন জীবন পথে তুমি আশারই ***
 দোসর প্রিয়া গো আমার রাতের রজনীগন্ধা

ঐ লগনে আলপনা নীল গগনে।।

চতুর হাওয়ার পরশে তোমার ছোয়া যে লাগে
 ভোরের আলোর ইশারায় ফুলের মেয়ে কী জাগে
 দুয়ারে *** করে কেউ করে কানাকানি
 বলে ওরা গোপনে ভালবাসার কাহিনী

ঐ তোমার আমার কথা সাগরও জানে।।';'মোহাম্মদ আলী সিদ্দিকী ও জিনাত রেহেনা';'আধুনিক';'0'
'পদ্মা নদীর তীরটি ঘেসে';'পদ্মা নদীর তীরটি ঘেসে ফুলেশ্বরী গাঁ
 সেই গায়েতে ছিল আমার বাপ দাদার ভিটা।
 পিতার ধন পায় পুত্রে
 পেয়েছিলাম সেই সূত্রে কিছু জমি জমা
 সংসারেতে ছিল আমার
 ছোট দুটি ভাই বোন আর স্নেহময়ী মা

নিজের হাতে লাঙ্গল কোষে
 কাটছিল দিন মনের সুখে
 (হ…র…র…র… হট… হট…হট….)।
 সেই সুখ বেশী দিনে ভাগ্যটাতে সইলো না
 ও পদ্মা….. হায়রে পদ্মা…..

(একদিন ভর সন্ধ্যায় মা আমার গেল পদ্মার ঘাটে কলসি ভরতে…
 সর্বনাশী পদ্মার হিংস্র স্রোত….. বাঁচাও…. বাঁচাও….. রানু… মনু…..
 ওঠান ঝাড়ু দিচ্ছিল রানু, মার চিৎকার তার কানে গেল। মার চিৎকার
 তার কানে গেল, মা…. মা….মনু……।
 মনু দাওয়ায় বসে পোষা ময়নাটাকে আধার খাওয়াচ্ছিল, মার আর্তনাদ ও
 বোনের চিৎকার তার কানেও গেল, মা… রানু….দাঁড়াও আমি আইতাছি
 মা …. রানু…..
 আমার কাছে যখন খবর গেল, তখন সবই শেষ। পদ্মা সর্বনাশী আমার
 মা, ভাই, বোন সবাইকে গ্রাস করে ফেলেছে। বেঁচে আছি শুধু আমি।
 মোন পিচু টান আর রইলো না। অবশেষে, একদিন গ্রাম ছেড়ে পা বাড়ালাম
 শহরের দিকে….)

গ্রাম ছেড়ে আমি শহরে
 জীবনে প্রথমেই এসেছি
 মনে হয় যেন এক
 নতুন জগতে এসে পড়েছি।

রাজপথে নেমে দেখি সারি সারি
 চলেছে ডাইনে বায়ে কলের গাড়ি
 সামনে পিছনে দেখি ইটের দালান
 দাঁড়িয়ে রয়েছে যেন পাহাড় সমান

লাল সাদা বাতিগুলো নিভে আর জ্বলে
 তাদের মতই যেন শূন্যে ঝুলে
 এই ভাবে বেশি দিন যাবে না থাকা
 ফুরায়ে এসেছে মোর কাধের টাকা
 পৃথিবীতে টাকা ছাড়া বাঁচা বড় দায়
 বাঁচারই কারণে আমি কোন কাজ চাই

কেউ যদি দয়া করে দিতে পারে
 একটা কাজ মোরে দিয়ে দেবেন
 সৎ পথে থেকে আমি বাঁচতে যে চাই
 এইটুকু বলে আজ.. নিলাম বিদায়';'ফেরদৌস ওয়াহিদ';'আলম খান';'0'
'ভবের নাট্যশালায়';'মনরে………
 ভবের নাট্যশালায় মানুষ চেনা দায়।

কেউবা পেল ফুলের মালা
 কেউবা পেল কাঁটার জ্বালা।
 মুখ দেখে দুখে যায় না বোঝা
 জানিসরে ভাই দুনিয়ায়।।

আজ যে দুঃখ দিল তোরে
 কাল সে ভালবাসবে ওরে।
 আজ যারে তুই পর ভেবেছিস
 কাল হবে সে তোর সহায়।।';'মোঃ আব্দুল জব্বার';'ধীর আলী মিয়া';'0'
'অপরাজিতা';'অপরাজিতা…..
 হৃদয়ের সব কথা কবিতা করে
 লিখেছ কাজল চোখে
 তুমি হারিয়ে দিয়েছ বনলতাকে।।

ময়ূরপঙ্খী রাতের এই
 পালক ঢাকা নীড়ে
 ছায়া ছায়া ভাবনা জাগায়
 হাজার কথার ভিড়ে।
 চোখের পাতায় পড়ি আমি
 ভুলের কবিতা।।

উদাস করা বাঁশির সুরে
 রূপসা নদীর পাড়ে
 ফাগুন রাঙা সাঁজের বালায়
 কাশবনের ধারে।
 কোন সে আশা প্রহর গুনি
 বুঝেও বুঝি না।।';'তপন চৌধুরী';'আধুনিক';'0'
'তুই যদি চিনতি আমায় পরানের পাখি';'তুই যদি চিনতি আমায় পরানের পাখি
 তোর লিখে দিতাম আমার এ দুটি আঁখি ।।

ভাল যদি বাসতি আমায় দেখতিস কি আদরে রাখি ।।

তুই যদি চিনতি আমায় পরানের পাখি
 তোর লিখে দিতাম আমার এ দুটি আঁখি।

তুই ছাড়া ত্রিভূবনে আর কেউ নাই।।
 আমি তোকে আমার সাড়া জনম দিতে চাই
 তুই যদি পরান আমার রাখতিস বাধী
 তোর লিখে দিতাম আমার এ দুটি আঁখি
 ভাল যদি বাসতি আমায় দেখতিস কি আদরে রাখি ।।

আমি ডাকি তুই পাখি থাকিস না দুরে ।।
 আমার এ জীবনটা চলে তোর অনুসারে
 তুই যদি বলিশ প্রেম অপরাধী
 তোর লিখে দিতাম আমার এ দুটি আঁখি
 ভাল যদি বাসতি আমায় দেখতিস কি আদরে রাখি ।।

তুই যদি চিনতি আমায় পরানের পাখি
 তোর লিখে দিতাম আমার এ দুটি আঁখি ।।
 ভাল যদি বাসতি আমায় দেখতিস কি আদরে রাখি ।।';'এস আই টুটুল';'অমিত';'0'
'চোঁখের জলের হয়না কোন রং';'চোঁখের জলের হয়না কোন রং
 তবু কতো রঙের ছবি আছে আঁকা
 দেখতে গিয়ে হারিয়ে গেলাম
 গহীন আঁধার পথে আঁকা বাঁকা।

স্বপ্ন দিয়ে মনকে আমি ভূলিয়ে গেলাম রেখে
 তবু কেমন করে কান্না এতো এলো কোথা থেকে
 ভূলে ভরা সবুজ মনের আকাশ ধোঁয়ায় ঢাকা। 

ভাংগা মনের দেওয়ালেতে স্বপ্ন আঁকা ছিল
 পথের ধুলায় কেমন করে ছড়িয়ে পড়ে গেল ।।
 কুড়িয়ে তোমার আচঁলেতে বেঁধে দিতে চাই
