'একদিন কান্নার রোল উঠবে';'একদিন কান্নার রোল উঠবে আমার বাড়িতে।
 তুমি আমাকে…

জানি আজ তুমি ব্যাস্ত অনেক,
 ব্যাস্ত পৃিথবীেত
 সময় গুলু কাটছে না যে
 তুমায় ভেবে ভেবে……২

তোমার মাঝেই স্বপ্ন দেখি
 তোমার মাঝেই স্বপ্ন আঁকি
 তুমই আমার সব……
 তুমি আমার ভালবাসার
 প্রথম অনুভব…।

জানি আজ তুমি ব্যাস্ত অনেক,
 ব্যাস্ত পৃিথবীেত
 সময় গুলু কাটছে না যে
 তুমায় ভেবে ভেবে……২

তুমায় ছাড়া থাকতে মানা
 মন যে আমার বাধ মানে না
 কেন জানি না।
 তুমি আমার ভালবাসার
 শেষ ঠিকানা…।

জানি আজ তুমি ব্যাস্ত অনেক,
 ব্যাস্ত পৃিথবীেত
 সময় গুলু কাটছে না যে
 তুমায় ভেবে ভেবে……২';'সায়েম হুসাইন';'বৃষ্টি ও তুমি';'0'
'আঙুল';'ও অভিমানী রুপলী জলে প্রভায় হৃদয় আমার ভিতরে রাখতে
 দুপুর গড়িয়েও সন্ধ্যা হলে ও আমায় ছূয়ে থাকতে
 সেখানে হঠাৎ মেঘের প্রপাত করল আঁধার উল্লাস
 কারণ টা কি জানা হয়নি সেই থেকে একা বসবাস
 ও অভিমানী…….

এত পিছুটান এত অভিমান এখনো ও চোখের ভাষায়
 এত অভিমান এত পিছুটান তবুও থাকছি আশায়।
 আমি আবারো তোমার ঐ আঙুলে আমার আঙুল রাখবো
 ফিরে এসে বলবে ও পাগল বলে আছি, তোমার তোমারী থাকবো।
 ও ও ও ও ও ও ও ও

দশমীর ভাঙ্গা চাঁদ আবারো একসাথে দেখবো
 শ্রাবনের ধারাতে আবারো একসাথে ভিজবো
 এত অভিমান এত পিছুটান তবু থাকছি আশায়।
 আমি আবারো তোমার ঐ আঙুলে আমার আঙুল রাখবো
 ফিরে এসে বলবে ও পাগল বলে আছি তোমার তোমারী থাকবো। 

রুপলী সে জলের প্রভা এখনো আমার এই মন
 তুলনা করনা তুমি আগেও করতে যেমন
 এত অভিমান এত পিছুটান তবু থাকছি আশায়।
 আমি আবারো তোমার ঐ আঙুলে আমার আঙুল রাখবো
 ফিরে এসে বলবে ও পাগল বলে আছি তোমার তোমারী থাকবো।';'তাহসান';'অপরাজিতা';'0'
'এক তাজমহল গড়ো';'এক তাজমহল গড়ো
 হৃদয়ে তোমার আমি হারিয়ে গেলে ।
 না থাক যমুনা কাছাকাছি, ক্ষতি নেই
 দুটি চোখে যমুনাকে ধরো… ।।

না থাকুক গায়ে তার চুনি পান্না
 তোমার প্রেমের ছোঁয়া রেখে
 প্রীতির অলঙ্কারে ঢেকে
 তাকে আরো অপরূপা করো

না উঠুক তার পাশে পূর্ণিমা চাঁদ
 তোমার প্রাণের আলো জ্বেলে
 মনের জ্যোছনা টুকু ঢেলে
 তাকে আরো অপরূপা করো

এক তাজমহল গড়ো
 হৃদয়ে তোমার আমি হারিয়ে গেলে ।
 না থাক যমুনা কাছাকাছি, ক্ষতি নেই
 দুটি চোখে যমুনাকে ধরো… ।।';'পিন্টু ভট্টাচার্য্য';'নচিকেতা ঘোষ';'0'
'ভুল ভেঙ্গে গেলে কাছে আসবে';'ভুল ভেঙ্গে গেলে কাছে আসবে আমি জানতাম
 সব সয়ে যে তোমায় এতো ভালো বেসেছে
 একদিন তাকে ভালো বাসবে- আমি জানতাম
 আমি জানতাম ।

এ চোখে যতোই জল আসুক নেমে
 তুমি তা মুছিয়ে দেবে তোমার প্রেমে
 আমায় নতুন করে চিনতে পেরে
 তোমারও দুচোখ জলে ভাসবে- জানতাম…
 আমি জানতাম ।।

বুক ভরা অনুরাগ আছে যার
 অভিমানটুকু করা সাজে তার
 সে শুধু পারে দিতে বিরহের দাম
 আমি জানতাম… 

যে প্রদীপ নিভে গিয়ে তোমায় খুঁজে
 তুমি ছাড়া তার ব্যথা কে আর বোঝে ?
 এ আঁধারে আগুনের পরশে তোমার
 আবার সে জ্বলে উঠে হাসবে- জানতাম…
 আমি জানতাম ।।';'পিন্টু ভট্টাচার্য্য';'১৯৭৪';'0'
'তুমি অনেক যত্ন করে আমায় দুঃখ দিতে চেয়েছো';'তুমি অনেক যত্ন করে আমায় দুঃখ দিতে চেয়েছো
 দিতে পারনি
 কি তার জবাব দেবে যদি বলি আমি কি হেরেছি !?
 তুমিও কি একটুও হারোনি ।

 সবুজ পাতাকে ছিড়ে ফেলেছো – ফুলেতে আগুন তুমি জ্বেলেছো
 ফাগুনের সব কেড়ে নিয়েছো – স্মৃতিটুকু তার কেন কাড়নি।
 কি তার জবাব দেবে যদি বলি আমি কি হেরেছি !?
 তুমিও কি একটুও হারোনি ।

 অন্তরে আলো জ্বেলে রেখে – দৃষ্টিকে গেছ শুধু আঁধারেতে ঢেকে
 নিজেকে প্রশ্ন করে দেখনা
 যার নাম তুমি আর লিখনা
 কেন তাকে ধরে আছো হৃদয়ে
 কণাটুকু তার কেন কাড়োনি
 তুমিও কি একটুও হারনি।।';'মান্না দে';'ঋতু মুখার্জি';'0'
'প্রত্যাবর্তন';'হঠাৎ মনে পড়ল তোমায়,
 মনে পড়ে গেলো সেই ছেলেমানুষী হারিয়ে গেছে কোথায়
 হঠাৎ আজ মনে পড়ল তোমায়
 এই আমি কতবার সেই তোমার প্রেমে পড়েছি
 মনে আছে কি তোমার?
 আর ঠিক ততবার, বৃষ্টির গান লিখেছি, পিয়ানোতে সুর তুলেছি
 হৃদয় জুড়ে গেয়েছি,
 তাই আবার ফিরে যাই
 তাই আবার ফিরে যাই

আমি আবার আরেকটা বার তোমার প্রেমে পড়তে চাই
 আমি আবার আরেকটা বার তোমার প্রেমে পড়তে চাই
 আমি আবার আরেকটা বার তোমার প্রেমে পড়তে চাই
 আমি আবার আরেকটা বার তোমার প্রেমে পড়তে চাই

হঠাৎ মনে পড়ল তোমায়,
 মনে পড়ে গেলো সেই ছেলেমানুষী হারিয়ে গেছে কোথায়
 হঠাৎ আজ মনে পড়ল তোমায়
 এই আমি কতবার সেই তোমার প্রেমে পড়েছি
 মনে আছে কি তোমার?
 আর ঠিক ততবার, বৃষ্টির গান লিখেছি, পিয়ানোতে সুর তুলেছি
 হৃদয় জুড়ে গেয়েছি,
 তাই আবার ফিরে যাই
 তাই আবার ফিরে যাই

আমি আবার আরেকটা বার তোমার প্রেমে পড়তে চাই';'তাহসান';'প্রত্যাবর্তন';'0'
'তোমার ঘরে বাস করে কারা';'তোমার ঘরে বাস করে কারা
 ও মন জান না,
 তোমার ঘরে বসত করে কয় জনা,
 মন জান না
 তোমার ঘরে বসত করে কয় জনা
 এক জনায় ছবি আঁকে এক মনে,
 ও রে মন
 আরেক জনায় বসে বসে র ংমাখে
 ও আবার সেই ছবিখান নষ্ট করে
 কোন জনা,কোন জনা
 তোমার ঘরে বসত করে কয় জনা
 এক জনায় সুর তোলে এক তারে,
 ও মন, আরেক জন মন্দিরাতে তাল তোলে
 ও আবার বেসুরো সুর ধরে দেখো
 কোন জনা, কোন জনা
 তোমর ঘরে বসত করে কয় জনা
 রস খাইয়া হইয়া মাত, ঐ দেখো
 হাত ফসকে যায় ঘোড়ার লাগাম
 সেই লাগাম খানা ধরে দেখো
 কোন জনা, কোন জনা
 তোমার ঘরে বসত করে কয় জনা';'নিশিতা';'আধুনিক';'0'
'দেখা হবে বন্ধু কারণে আর অকারণে';'দেখা হবে বন্ধু কারণে আর অকারণে
 দেখা হবে বন্ধু চাপা কোনো অভিমানে
 দেখা হবে বন্ধু সাময়িক বৈরিতায় অস্থির অপাগরতায়
 দেখা হবে বন্ধু নাটকীয় কোনো বিনয়ী ভঙ্গিতে
 ভালোবাসার শুভ্র ইঙ্গিতে
 দেখা হবে বন্ধু নিয়ত প্রতিদিন পাশ কেটে যাওয়া
 সন্ধ্যার হিমেল হাওয়ায়
 দেখা হবে বন্ধু
 শ্লোগান মুখর কোনো এক মিছিলে
 ব্যস্ততা থেকে ধার দিলে
 দেখা হবে বন্ধু
 ভীষণ খেয়ালী মনের আতিথেয়তায়
 উচ্ছাসে প্রনয় প্রাক্কালে';'পার্থ বড়ুয়া';'সোলস';'0'
'দুঃখ আমাকে দুঃখী করেনি,করেছে রাজার রাজা';'দুঃখ আমাকে দুঃখী করেনি,করেছে রাজার রাজা
 ও রানী সাহেবা বিদায় এবার
 তোমার সাঁজ ঘরে রাজা সাজবো না আর
 তুমি নকল পোশাক পরিয়ে আমাকে অনেক দিয়েছ সাজা।

তোমার নাঠ মন্দিরে যাত্রা আসরে
 তুমি চিকের আরালে ছিলে
 সেদিন রাজার ভুমিকা ছিলো যে আমার
 সত্যি ভেবে তা নিলে
 তাই মখমলে ঢাকা রুপোর থালায়
 আসরের মাঝে পাঠালে আমায় একটি গোলাপ তাজা
 ও রানী সাহেবা বিদায় এবার
 তোমার সাঁজ ঘরে রাজা সাজবো না
 তুমি নকল পোশাক পরিয়ে আমাকে অনেক দিয়েছ সাজা।

আহা সেই দিন থেকে এ ফকির রোজ
 শুধু গেয়েছে রাজার পালা
 তুমি জুড়িয়ে নিয়েছো সে গানে তোমার
 রাজার বিরহ জালা
 আসোল রাজার বিরহ জালা
 আর অভিনয় শেষে ভাঙ্গা আয়নায় আমি দেখে গেছি করুন ব্যাথায়
 ফকিরের রাজা সাজা।
 ও রানী সাহেবা বিদায় এবার
 তোমার সাঁজ ঘরে রাজা সাজবো না আর
 তুমি নকল পোশাক পরিয়ে আমাকে অনেক দিয়েছ সাজা।';'মান্না দে';'আধুনিক';'0'
'তুই মেঘলা মেয়ে';'তপ্তখরা শেষে মেঘ হলি তুই
 চঞ্চল পবনে তোকে ছুঁই
 এখনো ধরণী হয়নি শীতল
 এখনই চলে যাবি কিরে বল?
 ও মেঘলা মেয়ে যাস‌নে উঠে
 এখনো দেখা শেষ হয়নি তোকে

কম্পিত হাত রাখি তোর শান্ত মনের পরে
 তোর মেঘ কালো মায়া চোখে
 ভাবরে আপন করে(২)
 তোর ঝাঁপটা ভেজা জল মেখে
 চোখটা আমি বুজি কি সুখে

ও মেঘলা মেয়ে যাস্‌নে উঠে
 এখনো দেখা শেষ হয়নি তোকে

হাহাকার মনকুঁড়ি, যাসনে ও মেঘলামেয়ে,
 হাত জড়ো মনে পুড়ি,বহু কাল তোকে চেয়ে
 তুই ভাসতে ভালো ঝরে চল
 এখনই চলে যাবি কিরে বল?

ও মেঘলা মেয়ে যাস্‌নে উঠে
 এখনো দেখা শেষ হয়নি তোকে
 তপ্তখরা শেষে মেঘ হলি তুই
 চঞ্চল পবনে তোকে ছুঁইে';'পাভেল';'আধুনিক';'0'
'তুমি আমার না হও';'আমি তোমায় না দেখি
 তুমি আমার না হও
 আমি যত দূরে যাই চলে
 তুমি কাছে রও

আমি স্বপ্নে তোমায় দেখি
 ঘুমিয়ে যখন রই
 স্মৃতিতে এসো তুমি
 যদি দিশেহারা হই (২)
 একা হয়ে যাই আমি
 স্বপ্ন স্মৃতি ছাড়া
 তুমি ছাড়া মনে হয়
 আমি তো আমি নই

তুমি যদি ভালো থাকো
 কষ্টে আমি রই
 স্বার্থপর এই আমি
 তোমার সুখে সুখি নই (২)
 ভেবেছি অনেক আগে
 দু’জনে হাঁটবো পাশে
 একা আমি হাঁটি, ভাবি
 তোমাকে পাবো কই।';'সন্ধি';'তোমাকে ভালোবাসি';'0'
'এই মন ব্যাকুল যখন';'এই মন ব্যাকুল যখন তখন
 ডেকে যাই বারে বারে
 তবু স্তব্ধতাই এসে ধরা
 দেই আমার বীণার তারে
 জানি না জানি না জানি না কি কারণ
 এই মন কেন দেয় নাকো সারা মানে না বারণ মন
 জানি না জানি না কি কারণ
 মন কেনো দেয় নাকো সারা,মানে না বারন মন
 জানি না জানি না জানি না কি কারণ
 শুধু ভাবনারা মেলে ডানা

কে জানে আজ কেন মন
 দূর আকাশ ছুতে চাই
 তবু দুপায়ে কিসের বাঁধা
 যেনো থমকে দাড়াঁয়
 জানি না জানি না জানি না কি কারণ
 এই মন কেনো দেয় নাকো সারা
 মানে না বারন মন
 জানি না জানি না জানি না কি কারণ';'নচিকেতা';'আধুনিক';'0'
'বৃত্তালপনা';'জীবনের আলাপন, কত যে মায়া
 শত মানুষের ভিড়ে তোমায় পাওয়া
 বলেছিলাম ভালোবাসা চাই

ভালোবাসিনা আমি তোমাকে, বলেছিলাম…
 ভালোবাসিনা আমি তোমাকে, কখনো না,
 ভালোবাসিনা আমি তোমাকে, স্বপ্ন দেখে যাও
 ভালোবাসিনা আমি তোমাকে, একদমই না,
 তুমি আমার কে?

ভালোবাসোনা তুমি আমাকে কেন?
 ভালোবাসোনা তুমি আমাকে, হয়তো একটু
 ভালোবেসোনা তুমি আমাকে, আর কখনো চাইবোনা
 ভালোবেসোনা তুমি আমাকে, একদমই না,
 আমি তোমার কে?

আজ তুমি বড়ই আমার আপন
 আমার পৃথিবী আজ তোমার হাতে
 তোমার চোখের ভাষায় বুঝে নেব

ভালোবাসি শুধু তোমাকে আমি,
 ভালোবাসি শুধু তোমাকে, তবু কখনো বলবো না
 ভালোবাসি শুধু তোমাকে, শুধু যে তোমায়
 ভালোবাসি শুধু তোমাকে, কখনো বুঝবে না
 আমি তোমার যে…';'তাহসান';'ইচ্ছে';'0'
'স্বপ্নগুলো তোমার মতো';'তুমি মানে তোমার চলে যাওয়া
 তোমার জন্য সব ভুলে থাকা
 জীবন মানে বাঁচার অভিনয়
 মৃত্যু মানে তোমায় না পাবার ভয়

তোমার আশা কতটা কাছে টানে
 আমার ছায়া যতটা আঁধার আনে
 কাঁচের দেয়াল ভাঙার মত
 তোমায় ভাঙি ইচ্ছে মত
 আমার কেন ভালো লাগে না
 কোন কিছু তোমার মত

যখন তুমি একা থাকো
 আগুন জ্বলে আলোর মতন
 নিজের কাছেই লুকিয়ে রাখি
 স্বপ্নগুলো তোমার মত

আমার শরীর জুড়ে বৃষ্টি নামে
 অভিমানের নদীর তীরে
 শুধু তোমায় বলতে ভালবাসি
 আমি বারেবার আসবো ফিরে

আমার শরীর জুড়ে বৃষ্টি নামে
 অভিমানের নদীর তীরে
 শুধু তোমায় বলতে ভালবাসি
 আমি বারেবার আসবো ফিরে';'সুমন / আনিলা';'এখন আমি';'0'
'গনতন্ত্র';'গনতন্ত্র!
 চির অধিকার, অধিকার সচেতন জনতার
 জনতা বিভেদ ভুলে যাচাই বাছাই করে গড়বে আপন সরকার।

Government by the people
 For the people, of the people।

অধিকার!
 নয় কোন পণ্য।
 ভোটের বাজারে বেচা হবে সের দরে ক্ষণিকের প্রাপ্তির জন্য

অধিকার আজ জনতার, জনতা আধার ক্ষমতার
 নিজের ভাগ্য নিজেই গড়বে, প্রয়োগে ভোটের অধিকার

Government by the people
 For the people, of the people।

গনতন্ত্রে অঙ্গিকার
 বিরোধী বিরোধ ছেড়ে সরকারী ভুল ধরে
 উন্নয়নের হবে অংশীদার, গনতন্ত্র দেয়নি সে অধিকার

অধিকার ক্ষমতার অপব্যবহার
 ছলে বলে কৌশলে আসনে আসীন হবে বারবার

Government by the people
 For the people, of the people।।';'হায়দার হোসেন';'না বলা কথা';'0'
'টিভি দেখ না';'বাপি আর মা গেছে সিনেমায় তুমি একা
 ভয় যদি হয় আছে টিভি টাকে খুলে ভুলে থাকা
 মা গেছে বলে ঐ টিভি টাকে খুলে তুমি দেখ না
 আমি বলি কী একটা চালাকি করে দেখ না
 জানলা দিয়ে ঐ আকাশটাকে দেখ টিভি দেখ না

রান্না আছে ঢাকা তবু কান্না চেপে রাখা যাচ্ছে না
 বাপিরা হোটেলে রোল তোমার কপালে ঝোল ক্ষিদে পাচ্ছে না
 রেগে গিয়ে টিভি খুলে জোড় করে সব ভুলে তুমি থেকো না
 দেখ ডাকছে তোমায় বন্ধুরা আকাশ থেকে টিভি দেখ না
 দেখ ডাকছে তোমায় সব্বাই আকাশ থেকে টিভি দেখ না

মেঘ দেখে ভাল্লুক মনে হয় নাকি তুমি দেখ নি
 তোমার হাতের ছায়া দিয়ে দেয়ালে একটা হরিণ নিয়ে খেল নি
 খাটটাকে মাঠ ভেবে একটু উপুর হয়ে থাকো না
 দেখ ডাকছে তোমায় আকাশটা টিভি দেখ না
 দেখ ডাকছে তোমায় জানলার বাইরেটা টিভি দেখ না।।';'অঞ্জন দত্ত';'শুনতে কী চায়';'0'
'বাঁশরিয়া বাজাও বাঁশি দেখিনা তোমায়';'বাঁশরিয়া বাজাও বাঁশি দেখিনা তোমায়
 গেঁয়ো সুর ভেসে বেড়ায় শহুরে হাওয়ায়।

এ শহরে এসছো তুমি কবে কোন রাজ্য থেকে।
 তোমাদের দেশে বুঝি সব মানুষই বাঁশি শেখে

আমাদের স্কুল-কলেজে শেখে লোকে লেখা-পড়া।
 প্রাণে গান নাই মিছে তাই – রবিঠাকুর মুর্তি গড়া 

তোমার ঐ দেহাতী গান দোলে যখন বাঁশির মুখে
 আমাদের নকল-ভন্ড কৃষ্টি চালায় করাত বুকে
 বুকে আর গলায় আমার শহর কলকাতায়
 গেঁয়ো সুর ভেসে বেড়ায় শহুরে হাওয়ায়।

ঠেলা ভ্যান চালাও তুমি কিংবা ভাড়া গাড়ির ক্লিনার
 ক’বছরে একবার যাও তোমার দেশের নদীর কিনার

আগে পেলে বাঁশি বাজাও ফেলে আসা ঘরের ডাকে
 হেসে গিয়া এমন সুরে হয়ত ডাকো কোলকাতাকে

ফিরে এসে উদাম খাটো গায় গতরে ব্যস্ত হাতে
 মজুরিতে ভাগ বসাচ্ছে কারা তোমার কোলকাতাতে

তাদেরই গাইয়ে আমি সাজানো জলসায়
