'একদিন কান্নার রোল উঠবে';'একদিন কান্নার রোল উঠবে আমার বাড়িতে।
 আমায় নতুন করে দেখতে সবাই,আসবে সারি সারিতে।

বন্ধু-বান্ধব আসবে যারা, নানা প্রশ্ন করবে তারা।
 বন্ধু-বান্ধব আসবে যারা, কত প্রশ্ন করবে তারা।
 আমি থাকব শুয়ে বালিশ ছাড়া, পারব না ঠোঁট নাড়িতে।

আপন যারা তারা এসে, সাজাবেরে নতুন বেশে।
 আমি টিকিট ছাড়া উঠবো শেষে, ইঞ্জিন ছাড়া গাড়িতে।';'কুমার বিশ্বজিৎ';'প্রেমের আবেশ';'0'
'যদি চোখের দৃষ্টি দিয়ে চোখ বাধা যায়';'যদি চোখের দৃষ্টি দিয়ে চোখ বাধা যায়
 যদি মনের আঁচল দিয়ে মন বাধা যায়
 তবে যারে এত দেখলাম, যারে এত ভাবলাম
 সে কেন আমার হলো না।।

হলো অনেক স্বপ্নের আজ চন্দ্রাবলী
 ফোঁটে অনেক গন্ধ নিয়ে ছোট্ট কলি। 

তবু অনেক কথার ভীড় *** জমেছে
 সে কথা শুনতে সে তো কাছে এলো না।।

কাঁকন দিয়ে যারে কত ডাকলাম
 নূপুর দিয়ে গান শুনিয়ে গেলাম

গেল অনেক নগ্ন ধরে ছন্দহীনা
 হলো অনেক নিঝুম রাত গানের বীণা।

তবু অনেক অদেখা ছবি যার তরে দিয়েছি
 সে ছবি দেখতে সে তো কাছে এল না।।';'শাহনাজ রহমতুল্লাহ';'আধুনিক';'0'
'ধিমতানা, দে রে না…';'নি সা রে মা পা গা মা – পা গা মা রে নি সা..
 নি সা রে মা পা গা মা পা…………

যাও বলো তারে,
 মেঘের ওপারে,
 বৃষ্টি বন্দনা জুড়ে ধরণীতল,
 যাও বলো, শ্রাবণ আষাঢ়ে,
 মেঘের শতদলে ছুঁয়েছ ভেজাজ । 

মাতাল হাওয়ার ধ্বণী বৃষ্টি কি শোনে না,
 ময়ূর পেখম তোলে ধিমতানা দেরে না,
 ধিমতানা বাজে ধিমতানা…
 বাজে ধিমতানা, দে রে না 

ভেজাজল টলমল, অপেক্ষার জানালা ছুঁয়ে,
 দু’হাতে নিয়ে জল, ভেজাবো সুখের কপল,
 সন্ধ্যে এলো, ঝলোমলো বৃষ্টি তবু এলো না । 

মাতাল হাওয়ার ধ্বণী বৃষ্টি কি শোনে না
 ময়ূর পেখম তোলে ধিমতানা দেরে না…

স্বাগতম সম্ভাষণ অপেক্ষার হলো অবসান,
 প্রকৃতির আভরণে মন্ত্র তালের উচ্চারণ,
 রাত্রি এলো জলছল বৃষ্টি সুরের মূর্ছনা,

মাতাল হাওয়ার ধ্বণী বৃষ্টি কি শোনে না
 ময়ূর পেখম তোলে ধিমতানা দেরে না
 ধিমতানা বাজে ধিমতানা…বাজে ধিমতানা, দে রে না..';'কনা';'সিম্পলি কনা';'0'
'ওরে মন বাজাসনে আর';'ওরে মন বাজাসনে আর';'সৈয়দ আব্দুল হাদী';'আধুনিক';'0'
'যদি তুমি…';'যদি তুমি কাছে এসে দাও আমায় ছুঁয়ে,
 সব কিছু লাগে মধুময়..
 মন চায় সারাক্ষণ রাখি তোমায় জড়িয়ে,
 হৃদয়ে রাখি এ হৃদয়…
 ভাবনার দরজা দাও খুলে দাও,
 গভীরে আরও গভীরে আমাকে জড়াও…

তোমাকে নিয়ে সাজাই আমি,
 এ মনের যত ভাবনা.
 তুমি যে আমার পৃথিবীতে,
 শুরু থেকে শেষ ঠিকানা..
 কখনও ছেড়ে যেও না,
 জীবনও দিতে পারি যদি তুমি চাও.. 

তোমারি চোখে দেখি আমি
 নতুন সুখের’ই বারতা।
 তোমাকে নিয়ে যাই লিখে যাই হাজার গল্প-কবিতা ।
 কখনও ছেড়ে যেও না,
 জীবনও দিতে পারি যদি তুমি চাও..';'রিজভী ওয়াহিদ এবং শুভমিতা';'প্রথম স্বপ্ন (২০১২)';'0'
'তোমার বন্ধু হয়ে মরিলাম আমি';'[চাতক মরে জলে ভাসে
 মেঘ ভেসে যায় অন্য দেশে
 কেউ না চাহিতে সব কিছু পায়
 কেউ পেয়ে হারায় ভাগ্য দোষে]

তোমার বন্ধু হয়ে মরিলাম আমি।
 শত্রু হলো সারা জগৎ।
 আপন পর সব ছাড়িলাম আমি।।

আগে যারা বলতো ভাল
 এখন তারাই বলে কালো।

ভাল থেকে কালো এ রূপ।
 ধরিলাম আমি।।

কথা আমার সুরেই ছিল
 এখন সবই বেসুর হলো।

নতুন সুর কোথায় এখন
 নতুন সুর কোথা বলো
 খুজে পাই আমি।।';'আজাদ রহমান';'আধুনিক';'0'
'আমি আজ আকাশের মত একেলা';'আমি আজ আকাশের মত একেলা
 কাজল মেঘের ভাবনায় ,
 বাদলের এই রাত ঘিরেছে ব্যাথায়।

সজল উদাস বায়ে বুকের কাছে,
 স্বরণের তারাগুলি ঘুমায়ে আছে।
 বিলাপের ভাঙ্গা সুর থেমে গেছে আঁধার বীণায়।
 কাজল মেঘের ভাবনায়,
 বাদলের এই রাত ঘিরেছে ব্যাথায়।। 

দু’টি গান দু’টি প্রাণ দু’টি মন,
 এই নিয়ে দু’জনার এ ভুবন।
 এ জীবন দেখেছিলো শরতের সোনার স্বপন।
 সে সাধ অতীত আজ কাঁদে নিরালা
 নিয়ে শুধু বিরহের দহন জ্বালা
 চকিত আলোয় তাঁর আঁখি মোর দিশা যে হারায়।
 কাজল মেঘের ভাবনায়,
 বাদলের এই রাত ঘিরেছে ব্যাথায়।।';'মান্না দে';'প্রভাস দে';'0'
'অন্তর যার অথৈ সাগর';'অন্তর যার অথৈ সাগর
 সেই সাগরে বলো ডুববে নাকি।
 কুল ছেড়ে তাই অকুলে এলাম
 বন্ধু ওগো তোমারি ডাকি ।। 

এক রাশ জোসনার চন্দন ফুল
 এই মন উপবনে ফোঁটায় মুকুল।
 স্বপন ভ্রমর কোথায় ছিলো
 মুগ্ধ হয়ে কথা হারিয়ে অপলকে তাকিয়ে থাকে ।। 

অনুরাগ কাকে বলে বুঝি না তো হায়
 সুখে কেন দু’নয়নে জল ভরে যায়।
 শুধু জানি গো ধন্য আমি
 যা কিছু চাওয়া যা কিছু পাওয়ার সবটুকু দিয়ে তোমাকে ।।';'মান্না দে';'অজয় দাস';'0'
'তুমি চলে গেলে';'তুমি চলে গেলে ফেলে গেলে তোমার রাস্তাঘাট
 অজস্র চাপা ব্যাথা চোখের জল
 অজস্র ধোয়া ছেড়ে পাড়ি দিল যে স্টিমার
 ফিরে এল ঘাটে ছলাত ছল
 তুমি চলে গেলে গেল না হারিয়ে রাস্তাটা আমার
 ভাঙা চোরা মানুষের কথা
 তুমি চলে গেলে ফেলে গেলে চেনা দুঃখ সুখ
 তাই চলে গেলে কিন্তু গেলে না
 তাই চলে গেলে ফেলে গেলে তোমার কোলকাতা
 তাই চলে গেলে কিন্তু গেলে না
 চলছি আমি বুকে নিয়ে ফেলে যাওয়া ফেলে যাওয়া ভাঙ্গাচোরা তোমারই শহর
 স্টিমার ঘাটে দাড়িয়ে আমি তোমার অপেক্ষায়
 কখন জানি হয়ে গেল ভুল
 জানি দেখা হবে ঠিক আবার এখানে কোথাও
 অজস্র ভালবাসা অভিমান
 তাই তোমার ফেলে যাওয়া কথা কুড়িয়ে নিয়ে আজ
 লিখে গেলাম তোমার জন্য গান
 আমি থাকি না থাকি সেদিন থাকবে তোমার জন্য
 থাকবে তোমার জন্য আমার গান।।।।';'শান';'শেষ বলে কিছু নেই';'0'
'মায়া নাই';'মায়া নাই মায়া নাই মায়া নাই গো
 সখী তোমার কায়ার ভিতর মায়া নাই গো
 সখী মায়া নাই মায়া নাই মায়া নাই গো
 সখী তোমার কায়ার ভিতর মায়া নাই গো
 সখী তোমার কায়ার ভিতর মায়া নাই গো।। 

তুমি আমার কায়ার ভিতর করো বসতি
 তোমায় আমি ভালো চিনি কত যে সতি
 (তুমি কত যে সতি ৩)
 সবার চোখে ফাঁকি দিয়া জুড়েছ হিয়া
 কেমনে বুঝাই তোমার কোন ছায়া নাই গো।। 

আমি ঘোমাইলে ঘোমাও আমি চাইলে চাও
 আমার মাঝে থাকো তুমি আমারে লোকাও
 (তুমি আমারে লোকাও ৩)
 (তুমি আমায় পরদা না ২) করো হেয়ালী
 তুমি কি বুঝ তোমার হায়া নাই গো ।। 

সখী তোমার কায়ার ভিতর মায়া নাই গো
 সখী মায়া নাই মায়া নাই মায়া নাই গো
 সখী তোমার কায়ার ভিতর মায়া নাই গো
 সখী তোমার কায়ার …';'আলাউর রহমান';'মায়া নাই';'0'
'মা';'শহর ছেড়ে অনেক দুরে
 অজানা এক গাঁয়ের পথে
 মা নামের এক ছোট্ট কথা
 হারিয়ে গেছে কুটির ঘরে
 আজো কেন খুঁজি তাঁরে
 সেই কুটিরের অন্ধকারে ।
 পথ চেয়ে হায় থাকতো সে যে
 সেই সে ভিক্ষারিনীর বেশে
 দেইনি দেখা কইনি কথা
 ডাকি নি মা ভালবেসে
 কিসের মায়ায় কোন ছলনায়
 দিলাম পাড়ি কোন বিদেশে ।
 আজ সে মায়ার জাল কেটেছে
 নি:শ্ব আমি সব হারিয়ে
 তাইতো এলাম তাঁরি খোঁজে
 তাঁর সে ভাঙা কুটির দ্বারে
 আজ কেন কেউ জেগে নেই
 তাঁরি মতন পথটি চেয়ে ।';'সুমন হাফিজ';'এলোমেলো';'0'
'বাবা';'বছর বছর ধরে বাবা তুমি ক্ষয়ে ক্ষয়ে
 কত আশা নিয়ে বুকে গড় তুমি তিলে তিলে
 পেরিয়ে সময় যখন কর্মজীবন হলো শুরু
 জীবনের যতটুকু পাওয়া এ অবদান তোমারি শুধু ।
 তোমার চোখে ছিল শাসন-বারন ছিল পথচলা
 হৃদয়েতে ছিল মায়ের স্মৃতির দুয়ার খোলা
 তোমার নয়ন জুড়ে রাগ অনুরাগ কত ভালবাসা
 হাজার ভাষায় ছিল অনেক না বলা কথা
 দিন যায় রাত যায় তোমাকে ভাবি ।
 আমি শিশু থেকে কিশোর ছেড়ে হারিয়ে তোমার স্নেহ
 সেই যে আমি রয়ে গেলাম ব্যাস্ত শহরজীবন
 বাবা তোমার দ্বারে খবর নিতে তাইতো ছুটি ঘরে
 শৈশবের সেই ছোট্ট দুর গ্রাম পথে
 দিন যায় রাত যায় তোমাকে ভাবি ।';'সুমন হাফিজ';'এলোমেলো';'0'
'বন্ধু';'বন্ধু মানে গল্প-কথায় সুখ-দুখের আদান-প্রদান
 বন্ধু মানে পরাজিত হৃদয়ে মান-অভিমান
 বন্ধু মানে স্মৃতির জালে নিজেকে খুঁজে পাওয়া
 স্বর্গীয় মাধুরীতে এ জীবন ছেয়ে রাখা
 ওরে বন্ধু আমি ধন্য হোলাম জীবনের সঙ্গী পেলাম
 ভেসে যাই একই ভেলাতে ।
 মধ্যরাতে সকাল-দুপুর-সাঁঝে
 তোরাই আমার রয়েছিস পাশে
 মধুর কথায় হাসাহাসি
 হাতের খাবার হয় ভাগাভাগি
 সবই যেন স্বর্গ-ছায়া ধরণীর বুকে ।
 আমার দুখে কিবা সুখোচ্ছাসে
 বন্ধু ছিলি আজো আছিস পাশে
 আশার আলো তোরাই দেখাস
 পৃথিবীকে আপন যত্নে সাজাস
 সবই যেন স্বর্গ-ছায়া ধরণীর বুকে ।';'সুমন হাফিজ';'এলোমেলো';'0'
'সীমাহীন সাগরে ভাসিয়ে ভেলা';'সীমাহীন সাগরে ভাসিয়ে ভেলা
 চলেছি একেলা, চলেছি একেলা।

আধারের মাঝ হায়
 কতবার পথ আমি ভুলেছি
 ঘুর্ণিপাকে পড়ে কত পথ অকারণে ঘুরেছি।

কেউ তো আসেনি পথ দেখাতে।
 সবাই করেছে অবহেলা
 চলেছি একেলা, চলেছি একেলা।।

সমুখে ভয়াল পথ
 পিছনে ফেরার আর পথ নাই
 পথটুকু হলে পাড়
 বিধাতা দেবেন তার পায়ে ঠাই

শান্তি সাগরে তরী ডুবে যায়।
 জুড়াবে মনের সব জ্বালা
 চলেছি একেলা, চলেছি একেলা।';'মোঃ আব্দুল জব্বার';'আধুনিক';'0'
'আমি মুক্ত বলাকা';'আমি মুক্ত বলাকা
 মেলে দেই পাখা';'মোঃ আব্দুল জব্বার';'আধুনিক';'0'
'বন্ধুর প্রেমে হইলাম পাগল';'বন্ধুর প্রেমে হইলাম পাগল
 বন্ধু আমার কোথায় রইলো হায়।

আমি আঁখির জলে করলাম নদী।
 বন্ধু আমার এলো না তাই
 বন্ধু আমার কোথায় রইলো হায়

আমি পেতাম যদি বন্ধুর দেখা।
 কইতাম তারে মনের কথা গো।

আহা দেখা পেলে বলে কেহ
 তোমার বন্ধুর পরাণ রাখা দায়।।

না জানা প্রেম করলাম সখী বন্ধুর সনে
 দূরে দূরেই রইলে বন্ধু আগুন জ্বলে মনে
 করলাম বন্ধুর সনে

আমি মনের দুঃখে হইলাম দুঃখী।
 কেন্দে কেন্দে নিরবধি গো।

তাহার দেখা পেলে বলো কেহ
 তোমার বন্ধুর পরাণ রাখা দায়।।';'মোঃ আব্দুল জব্বার';'ধীর আলী মনসুর';'0'
'আজ কোন কাজ নেই হাতে আমার';'আজ কোন কাজ নেই হাতে আমার
 আজ সারাদিন শুধু ভাবতাম আজ রোববার';'নির্মলা মিশ্র';'আধুনিক';'0'
'এই রিমঝিম ঝিম বরষা';'এই রিমঝিম ঝিম বরষা
 হাওয়া হিম হিম বরষা
 তুমি এলে আজ মনে সহসা
 পথ চলিতে যে তাই ভরসা

চেয়েছে তোমার কত সাথে যে
 হাতখানি রাখি ঐ হাতে যে
 মনে এলে ওগো মন হরষা
 পথ চলিতে যে তাই ভরসা

হৃদয় আমার আজ বলে তাই
 চোখের দেখাতে যদি নাই পাই
 বাঁশি শুনেছে যে মন মনষা
 পথ চলিতে যে তাই ভরসা

ঝরো ঝরো বরষার ধারাতে
 স্বপ্ন যদি গো হয় হারাতে
 হৃদয়ের ভরা ক্ষেত সরসা
 পথ চলিতে যে তাই ভরসা';'তালাত মাহমুদ';'১৯৫৮';'0'
'কাছে আয় তুই';'কাছে আয় তুই
 ফিরে আয়
 ভালো যে বাসবো তরে।।';'মোঃ তুষার খান';'তুমি চলে যাও';'0'
'হৃদয় চিড়ে দেখাতে যদি';'হৃদয় চিড়ে দেখাতে যদি';'নিয়াজ মোহাম্মদ চৌধুরী';'আধুনিক';'0'
'অনেক আশার খেলাঘর';'অনেক আশার খেলাঘর';'নিয়াজ মোহাম্মদ চৌধুরী';'আধুনিক';'0'
'নদীরে তোর বুকে কত';'নদীরে তোর বুকে কত';'নিয়াজ মোহাম্মদ চৌধুরী';'আধুনিক';'0'
'নদী মিশে সাগরে';'নদী মিশে সাগরে';'নিয়াজ মোহাম্মদ চৌধুরী';'আধুনিক';'0'
'কিছু লোক কিছু কথা বলবেই';'কিছু লোক কিছু কথা বলবেই';'নিয়াজ মোহাম্মদ চৌধুরী';'আধুনিক';'0'
'চল না পথ ভেঙে পায়ে পায়ে';'চল না পথ ভেঙে পায়ে পায়ে';'নিয়াজ মোহাম্মদ চৌধুরী';'আধুনিক';'0'
'ভালবাসার সুখ সে তো';'ভালবাসার সুখ সে তো';'নিয়াজ মোহাম্মদ চৌধুরী';'আধুনিক';'0'
'কারার ঐ লৌহ-কপাট';'কারার ঐ লৌহ-কপাট

ভেঙ্গে ফেল কর রে লোপাট

রক্ত-জমাট শিকল পুজার পাষাণ-বেদী

ওরে ও তরুণ ঈশান

বাজা তোর প্রলয় বিষাণ

ধ্বংস নিশান উড়ুক প্রাচী-র প্রাচীর ভেদি।

গাজনের বাজনা বাজা

কে মালিক, কে সে রাজা?

কে দেয় সাজা মুক্ত-স্বাধীন সত্যকে রে?

হা হা হা পায় যে হাসি

ভগবান পরবে ফাঁসি?

সর্বনাশী, শিখায় এ হীন তথ্য কে রে?

ওরে ও পাগলা ভোলা

দে রে দে প্রলয় দোলা

গারদগুলা জোরসে ধরে হেঁচকা টানে

মার হাঁক হৈদরী হাঁক

কাঁধে নে দুন্দুভি ঢাক

ডাক ওরে ডাক, মৃত্যুকে ডাক জীবন পানে।

নাচে ঐ কাল-বোশেখী

কাটাবি কাল বসে কি?

দে রে দেখি ভীম-কারার ঐ ভিত্তি নাড়ি

লাথি মার ভাঙ রে তালা

যত সব বন্দী-শালায়

আগুন জ্বালা, আগুন জ্বালা, ফেল উপাড়ি।।';'গৌরীকেদার ভট্টাচার্য';'আধুনিক';'0'
'চিকিচিতা';'চিকিচিতা শেষটা বলো
 দুটি চোখ কেন ছলছল
 কি ব্যাথায় হৃদয় ভেজা বর্ষা এলো

আমার ভাবতেও লাগছে যে ভয়
 হারানো প্রেম কেউ কি ফিরে পায়
 চায় সবাই আজীবন প্রেম থাক না অক্ষয়

চিকিচিতা করেছ কি ভুল
 এ ভুলের নাই কোন মাসুল
 মন জানে তুমি পার গড়তে আবার
 কেউ ভুল করে ফুল যদি চায়
 কাঁটা না সয়ে কেউ কি কভু পায়
 এ কেমন করে হয়
 মন তখন যায় ভেঙ্গে যায়

চিকিচিতা মন ভেঙ্গো না
 মনে করো ভালবাসা সদ্য ফোঁটা পদ্মফুল
 গানে গানে হোক ছন্দময়
 নাচো গাও ভুলে যাও
 ব্যাথাময় জীবনের সব সংশয়

চিকিচিতা মন ভেঙ্গো না
 মনে করো জীবনের সূর্য উদয় হলো
 শক্ত করে হাল ধরো যতদিন না হয়
 এ প্রেমের জয় শুধুই জয়
 যা কিছু হোক এ জীবন করো ভোগ
 প্রেমের জয় হোক চিকিচিতা।। 

চিকিচিতা করো না কো ভুল
 কাঁটা না সয়ে কেউ কি কভু পায়
 এ কেমন করে হয়
 মন তখন যায় ভেঙ্গে যায়

চিকিচিতা মন ভেঙ্গো না
 মনে করো ভালবাসা সদ্য ফোঁটা পদ্মফুল
 গানে গানে হোক ছন্দময়
 নাচো গাও ভুলে যাও
 ব্যাথাময় জীবনের সব সংশয়।

চিকিচিতা মন ভেঙ্গো না
 মনে করো জীবনের সূর্য উদয় হলো
 শক্ত করে হাল ধরো যতদিন না হয়
 এ প্রেমের জয় শুধুই জয়
 যা কিছু হোক এ জীবন করো ভোগ
 প্রেমের জয় হোক চিকিচিতা।।';'সামিনা চৌধুরী ও ফাহমিদা নবী';'আধুনিক';'0'
'চলে যেতে যেতে';'চলে যেতে যেতে যদি কিছু মনে পড়ে
