'একদিন কান্নার রোল উঠবে';'একদিন কান্নার রোল উঠবে আমার বাড়িতে।
নীল নেই আকাশে নেই কোন নীল
 ভাসে না চোখে আর আলো ঝিলমিল
 শুভ্র মেঘগুলি কালো শাড়ি পড়ে
 উড়ায় বিষাদের আচল।

সূর্যটা যেন আজ আড়ালে লুকিয়ে
 থেকে থেকে দেয় উকি।
 একদিন ঘুম…….।।

কূল নেই জীবনের ভেঙ্গে দুকূল
 অকালে ঝরে গেছে প্রেমের মুকুল
 স্তব্ধ হয়ে আছে পাখিগুলি ভোরে
 কান্নার ঢেউ চেপে বুকে।

শেষ হয়ে গেছে আজ আশা যত জীবনে
 মরণ যেন শুধু বাকি।
 একদিন ঘুম…….।।';'শেখ ইশতিয়াক';'নন্দিতা';'0'
'রানার';'(রানার গ্রামের ডাক হরকরা
 রাতের পর রাত ক্লান্তিহীন মানুষের সুখ দুঃখের
 খবরের বোঝা বয়ে সে পৌছে দেয় দোরে দোরে
 কিন্তু তার খবর কে রাখে)

রানার ছুটেছে তাই ঝুম ঝুম ঘন্টা বাজছে রাতে
 রানার চলেছে খবরের বোঝা হাতে,
 রানার রানার চলেছে,রানার!
 রাত্রির পথে পথে চলে কোন নিষেধ জানে না মানার।
 দিগন্ত থেকে দিগন্তে ছোটে রানার, রানার
 কাজ নিয়েছে সে নতুন খবর আনার।।

রানার! রানার!
 জানা-অজানার
 বোঝা আজ তার কাঁধে,
 বোঝাই জাহাজ রানার চলেছে চিঠি আর সংবাদে।

রানার চলেছে, বুঝি ভোর হয় হয়।

আরো জোরে, আরো জোরে, হে রানার দুর্বার দুর্জয়
 তার জীবনের স্বপ্নের মত পিছে সরে যায় বন,
 আরো পথ,আরো পথ-বুঝি হয় লাল ও-পূর্ব কোণ

অবাক রাতের তারারা আকাশে মিট্ মিট্ করে চায়;
 কেমন করে এ রানার সবেগে হরিণের মত যায়। 

কত গ্রাম, কত পথ যায় সরে সরে
 শহরে রানার যাবেই পৌঁছে ভোরে।

হাতে লন্ঠন করে ঠন্ ঠন্, জোনাকিরা দেয় আলো
 মাভৈঃ; রানার! এখনো রাতের কালো। 

এমনি করেই জীবনের বহু বছরকে পিছু ফেলে,
 পৃথিবীর বোঝা ক্ষুধিত রানার পৌঁছে দিয়েছে মেলে
 ক্লান্তশ্বাস ছুঁয়েছে আকাশ, মাটি ভিজে গেছে ঘামে
 জীবনের সব রাত্রিকে ওরা কিনেছে অল্প দামে
 অনেক দুঃখে, বহু বেদনায়, অভিমানে, অনুরাগে,
 ঘরে তার প্রিয়া একা শয্যায় বিনিদ্র রাত জাগে

রানার! রানার!
 এ বোঝা টানার দিন কবে শেষ হবে?
 রাত শেষ হয়ে সূর্য উঠবে কবে?
 ঘরেতে অভাব, পৃথিবীটা তাই মনে হয় কালো ধোঁয়া,
 পিঠেতে টাকার বোঝা তবু এই টাকাকে যাবে না ছোঁয়া, 

রাত নির্জন, পথে কত ভয়, তবুও রানার ছোটে,
 দস্যুর ভয়, তার চেয়ে ভয় কখন সূর্য ওঠে।

কত চিঠি লেখে লোকে-
 কত সুখে, প্রেমে, আবেগে, স্মৃতিতে, কত দুঃখে ও শোকে।

এর দুঃখের চিঠি পড়বেনা জানি কেউ কোন দিনও
 এর জীবনের দুঃখ কেবল জানবে পথের তৃণ।

এর দুঃখের কথা জানবে না কেউ শহরে ও গ্রামে
 এর কথা ঢাকা পড়ে থাকবেই কালো রাত্রির খামে

দরদে তারার চোখ কাঁপে মিটিমিটি-
 এ-কে যে ভোরের আকাশ পাঠাবে সহানুভূতির চিঠি।

রানার! রানার! কি হবে এ বোঝা বয়ে?
 কি হবে ক্ষুধার ক্লান্তিতে ক্ষয়ে ক্ষয়ে? ।।

রানার! রানার! ভোর তো হয়েছে-আকাশ হয়েছে লাল
 আলোর স্পর্শে কবে কেটে যাবে এই দুঃখের কাল? ।।

রানার! গ্রামের রানার!
 সময় হয়েছে নতুন খবর আনার
 রানার, রানার……।।';'হেমন্ত মুখোপাধ্যায়';'সলিল চৌধুরী';'0'
'বেশি কিছু আশা করা ভুল';'বেশি কিছু আশা করা ভুল
 বুঝলাম আমি এতদিনে ।।
 মুক্তি মেলে না সহজে
 জড়ালে হৃদয় কোনো ঋণে
 বেশি কিছু আশা করা ভুল বুঝলাম আমি এতদিনে ।

এই জগতে এমনও লোক থাকে
 স্বপ্ন দেখতে নেই যাদের ।।
 দুঃখের মূল্যতে গেয়ে
 কঠিন সত্য নেয় কিনে

বেশি কিছু আশা করা ভুল বুঝলাম আমি এতদিনে ।
 মুক্তি মেলে না সহজে জড়ালে হৃদয় কোনো ঋণে
 বেশি কিছু আশা করা ভুল বুঝলাম আমি এতদিনে ।

আমি সেই সে দলের একজনা
 বুকে যার শুধু বঞ্চনা ।।
 যে বর্ষার মেঘ পেরিয়ে
 আসে না আলোরা আশ্বিনে

বেশি কিছু আশা করা ভুল বুঝলাম আমি এতদিনে ।
 মুক্তি মেলে না সহজে জড়ালে হৃদয় কোনো ঋণে
 বেশি কিছু আশা করা ভুল বুঝলাম আমি এতদিনে ।';'জগজিৎ সিং';'আধুনিক';'0'
'মায়াবী এ রাতে';'মায়াবী এ রাতে
 দু’জনে বিজনে
 মুখোমুখি বসে রবো 

নীরবে নিভৃতে নয়নে নয়নে
 চুপি চুপি কথা কবো ।
 দখিনা যেনো শুধু বলে যায়
 তোমারই আসার কথা বলে যায় 

মায়াবী এ রাতে দু’জনে বিজনে মুখোমুখি বসে রবো
 নীরবে নিভৃতে নয়নে নয়নে চুপি চুপি কথা কবো ।

জড়িয়ে আছো তুমি
 হৃদয়ে আমার
 মাধবী লতার মতো
 স্বপ্ন সুখে
 আমি যে মিশে আছি
 জীবনে তোমার
 পাহাড়ী নদী হয়ে সাগর বুকে 

মায়াবী এ রাতে দু’জনে বিজনে মুখোমুখি বসে রবো
 নীরবে নিভৃতে নয়নে নয়নে চুপি চুপি কথা কবো ।

একাকী পথ চলা
 হলো সারা
 তুমি যে দিলে ধরা
 কাছে এসে
 কত না অনুরাগে
 এ ভীরু হৃদয়
 তোমারই মোহনাতে
 গেছে মিশে 

মায়াবী এ রাতে দু’জনে বিজনে মুখোমুখি বসে রবো
 নীরবে নিভৃতে নয়নে নয়নে চুপি চুপি কথা কবো ।
 দখিনা যেনো শুধু বলে যায়
 তোমারই আসার কথা বলে যায়
 মায়াবী এ রাতে দু’জনে বিজনে মুখোমুখি বসে রবো
 নীরবে নিভৃতে নয়নে নয়নে চুপি চুপি কথা কবো ।';'সুমনা হক';'ফুয়াদ নাসের বাবু';'0'
'আমার মনের ফুলদানীতে রাখো তোমার মন';'আমার মনের ফুলদানীতে
 রাখো তোমার মন
 সাজিয়ে দেব যতন করে
 ফুলেরও মতন

তুমি যেন ভুল বুঝনা আমায় উদাস দেখে
 মনের মাঝে মন দিলে হায় অনেক বাঁধাই আসে ।।
 মনেরও সেই ফুলদানীতে ফোটে যদি ফুল
 বেলি-গোপাল-গন্ধরাজ আর সুবাসী বকুল

আমার মনের ফুলদানীতে রাখো তোমার মন
 সাজিয়ে দেব যতন করে মনেরও মতন

কত মধুর স্বপ্ন দেখি আমি তোমায় নিয়ে
 যাও না আমার স্বপ্নগুলো সত্যি করে দিয়ে ।।
 তোমার মাঝে আমি যেনো ডুবেছি এমন
 ডুবে যায় সাগরেতে তরণী যেমন

আমার মনের ফুলদানীতে রাখো তোমার মন
 সাজিয়ে দেব যতন করে মনেরও মতন ।।';'শেখ ইশতিয়াক';'নীলাঞ্জনা';'0'
'সুখ তুমি কি বড় জানতে ইচ্ছে করে';'সুখ তুমি কি বড় জানতে ইচ্ছে করে
 আমার জানতে ইচ্ছে করে 

কিশোরীর মিষ্টি আশা
 নাকি ষোড়শীর ভালবাসা 

কেউ বলে সবার মনে তোমার বাসা ।।
 কারো মনে তুমি আবার চৈতি তৃষা
 তুমি বধুর মধুর হাসি
 নাকি বিষের বাশী
 আমার জানতে ইচ্ছে করে
 সুখ তুমি কি বড় জানতে ইচ্ছে করে
 আমার জানতে ইচ্ছে করে
 সুখ তুমি কি

কেউ বলে ভোরের মতো তোমার হাসি ।।
 বুকের কাছে তুমি আবার সর্বনাশী
 তুমি মায়ের স্নেহের কোল
 নাকি নারীর আচঁল
 আমার জানতে ইচ্ছে করে
 সুখ তুমি কি বড় জানতে ইচ্ছে করে
 আমার জানতে ইচ্ছে করে
 সুখ তুমি কি';'রুনা লায়লা';'অজিত রায়';'0'
'আমার স্বপন কিনতে পারে এমন আমীর কই';'আমার স্বপন কিনতে পারে এমন আমীর কই ?
 আমার জলছবিতে রঙ মিলাবে এমন আবীর কই ?

আমি দুখের সিংহাসনে বসে সুখের বিচার করি
 আমি ভাবের ঘরের অভাবটুকু আখর দিয়ে ভরি ।।
 আমার পরম বন্ধু হবে
 এমন অধীর কই
 আমার জলছবিতে রঙ মিলাবে এমন আবীর কই

আমার স্বপন কিনতে পারে এমন আমীর কই ?
 আমার জলছবিতে রঙ মিলাবে এমন আবীর কই ?

অসীম ধনে ধনী
 দরিদ্র কে বলে আমায়
 জাগরনের ঘুমে আছি
 বিনিদ্র কে বলে আমায় ।।
 আমি পথের দিশা ভুলে গিয়ে পথেই ফিরেই আসি
 আমি ভালোবাসার যন্ত্রণাকে অধিক ভালবাসি

আমার ধরে বেঁধে রাখে এমন সে নীড় কই
 আমার জলছবিতে রঙ মিলাবে এমন আবীর কই ।।

আমার স্বপন কিনতে পারে এমন আমীর কই ?
 আমার জলছবিতে রঙ মিলাবে এমন আবীর কই ?';'জটিলেশ্বর মুখোপাধ্যায়';'জটিলেশ্বর মুখোপাধ্যায়';'0'
'তন্দ্রাহারা নয়ন আমার';'তন্দ্রাহারা নয়ন আমার
 এই মাধবী রাতে।

তাঁরার কুসুম হয়ে চায় স্বপ্ন ছড়াতে ।।

বাতাসেরই ফাল্গুনী গান
 দেয় মুছে সব অভিমান।
 সুরের কাকলী তাই চায় কন্ঠে জড়াতে।।

তনু মন এই রাত কেন মুখর এত জানি না
 এই গান এই সুর কেন যে মধুর এত জানি না।

হৃদয়ের এই কলতান
 নেই কভু এর অবসান
 বনের পাখিরা তাই চায় ছন্দ ঝরাতে।।';'হাসিনা মমতাজ';'সমর দাস';'0'
'কতদিন পরে এলে';'কতদিন পরে এলে
 একটু বসো।
 তোমায় অনেক কথা বলার ছিল যদি শোন।।

আকাশে বৃষ্টি আসুক
 গাছেরা উঠুক কেঁপে ঝড়ে।

সেই ঝড় একটু উঠূক তোমার মনের ঘরে

বহুদিন এমন কথা বলার ছুটি
 পায়নি যেন।।

জীবনের যে পথ আমার
 ছিল গো তোমার ছায়ায় আঁকা।

সেই পথ তেমনি আছে
 সবুজ ঘাসে ঢাকা

চেনা গান বাজলো যদি
 বেজেই আবার থামবে কেন।।';'হেমন্ত মুখোপাধ্যায়';'পুলক বন্দ্যোপাধ্যায়';'0'
'যদি কিছু আমারে শুধাও';'যদি কিছু আমারে শুধাও
 কি যে তোমারে কবো
 নীরবে চাহিয়া রবো
 না বলা কথা বুঝিয়া নাও।।

ঐ আকাশ নত যুগে যুগে সংযত
 নীরবতা অবিরত
 কথা বলে গেছে কত।

তেমনই আমার বাণী
 সৌরভে কানাকানি।
 হয় যদি ভ্রমরা গো
 সে ব্যাথা বুঝিয়া নাও।।

অন্তরে অন্তরে যদি কোন মন্তরে
 বোবা এ প্রানের ব্যাথা
 বোঝানো যেতো গো তারে।

কবির কবিতা সবই
 তুলি দিয়ে আঁকা ছবি।

কিছু নয় তার কাছে
 এ টুকু বিঝিয়া নাও।।';'দেবব্রত বিশ্বাস';'শ্যামল মিত্র';'0'
'বধুয়া আমার চোখে জল এনেছে';'বধুয়া আমার চোখে জল এনেছে
 হায় বিনা কারণে।।

নীলাকাশ থেকে একি
 বাজ হেনেছে
 হায় বিনা কারণে।।

দিনে দিনে মুল্য বিনে
 সে যে মার নিলো কিনে।

এ মনে যতন করে
 বিফল প্রেমের জীজ বুনেছে
 হায় বিনা কারণে।

নীলাকাশ থেকে একি
 বাজ হেনেছে
 হায় বিনা কারণে।।

আমি তো খুজি কারণ
 মন আমায় করে বারণ
 বলে কেন এমন মরণ
 বিনা কারণে।

আমি বাদী আমি বিবাদী
 কোথা উধাও অপরাধী।

কেন সেই রূপের আগুন
 বুকে জ্বেলে আছি বেঁচে হায়।
 বিনা কারণে।।';'শ্রীকান্ত আচার্য্য';'আধুনিক';'0'
'রূপের ঐ প্রদীপ জ্বেলে কী হবে তোমার';'রূপের ঐ প্রদীপ জ্বেলে কী হবে তোমার
 কাছে কেউ না এলে আর
 মনের ঐ এত মধু কেন জমেছে
 যদি কেউ না থাকে নেবার।।

ও নূপুর না বাজালে কারো বাঁশিতে
 ও হাসি না মেশালে কারো হাসিতে।

তোমার ঐ সোনার ফাগুন কী দাম পাবে।
 যদি কেউ না থাকে দেবার।।

এ জীবন না জড়ালে কারো জীবনে
 এ স্বপন না ছড়ালে কারো স্বপনে।

রঙিন ঐ দিনগুলি কী এমন রবে।
 সাড়া কেউ দিবে না যে আর। ।';'শ্রীকান্ত আচার্য্য';'কানু ঘোষ';'0'
'সেই কবে তোমায় ভেবে';'সেই কবে তোমায় ভেবে
 ছোট্ট কিছু কথা দিয়ে
 নকশী কাঁথা বুনে ছিলাম
 কবিতায় রাঙিয়ে
 বিবর্ণ হয়ে গেছে

আবর্তিত ব্যথা
 কি যে দুঃসহ
 এ মন পুড়িয়ে দিয়ে
 ফিরে ফিরে আসে
 ভাবে নির্মোহ
 ভেঙে ভেঙে যায় এ প্রান্তে
 বিবর্ণ হয়ে গেছে

অনুভবে রয়েছ
 ভাঙা এই হৃদয়ে
 ফিরিয়ে নিতে চাই নিজেকে
 নিজস্ব আঙিনায়
 একান্তে নিরবে
 জানি এ সময় ফুরাবে';'পার্থ বড়ুয়া';'আধুনিক';'0'
'সে আমার ছোট বোন';'মার স্নেহ কাকে বলে জানিনা
 বাবার মমতা কি বুঝতে না বুঝতেই
 এ বিরাট পৃথিবীতে দেখলাম
 সে ছাড়া আমার আর কেউ নেই
 সে আমার ছোট বোন…
 বড় আদরের ছোট বোন।।

ভালো করে যখন সে কথা শেখেনি
 তখন থেকেই সে গেয়ে যেত গান
 বাজনার হাত ছিল ভালই আমার
 তার সাথে বাজাতাম দিয়ে মন-প্রাণ
 রাস্তায় ভিড় করে শুনত সবাই
 অবাক হতো যে কত জ্ঞানী-গুণীজন।।

ভোর বেলা তার গানে ঘুম ভাঙত
 রাতে তাকে বাজনায় ঘুম পাড়াতাম
 ভাইয়ের বাজনা আর বোনের গানে
 সহজ সরল সেই দিন কাটাতাম
 ছোট্ট একটি ঘর এ দু’টি মানুষ
 এই ছিল আমাদের সুখের জীবন।।

একদিন যখন সে একটু বড়
 প্রথম সুযোগ এলো এক জলসায়
 মুগ্ধ শ্রোতারা তার কন্ঠ শুনে
 দু’হাত ভরালো তার ফুলের তোড়ায়
 ঘরে এসে আমায় সে করল প্রণাম
 প্রথম ভরলো জলে আমার নয়ন।।

তারপর কি যে হলো গান শুধু গান
 ছড়িয়ে পড়লো তার আরো বেশী নাম
 শ্রোতারা উজার করে দিলো উপহার
 দিল না সময় শুধু নিতে বিশ্রাম
 ক্লান্তির ক্ষমা নেই ওদের কাছে
 আরো বেশী দিতে হবে বুঝে নিলো মন।।

একদিন শহরের সেরা জলসা
 সেদিনই গলায় তার দারুণ জ্বালা
 তবুও শ্রোতারা তাকে দিল না ছুটি
 শেষ গান গাইলো সে পড়ে শেষ মালা
 শিল্পের জন্য শিল্পী শুধু
 এছাড়া নেই যে তার অন্য জীবন
 নীরব হলো ছোট বোন
 বড় আদরের ছোট বোন।।

তার গান থেমে গেছে নেই শ্রোতা আর
 আমি একা বসে আছি স্মৃতি নিয়ে তার
 আনন্দ নিয়ে গেছে ওরা সকলে
 দুঃখটা হোক আজ শুধুই আমার
 অনুযোগ এতো নয় এই শিল্পীর
 ভাই বোন সকলেরই ভাগ্য লিখন।।';'মান্না দে';'সুপর্ণকান্তি ঘোষ';'0'
'আয় খুকু আয়';'কাটেনা সময় যখন আর কিছুতে
 বন্ধুর টেলিফোনে মন বসে না
 জানালার গ্রীলটাতে ঠেকাই মাথা
 মনে হয় বাবর মত কেউ বলে না
 আয় খুকু আয় খুকু আয়
 আয়রে আমার সাথে গান গেয়ে যা
 নতুন নতুন সুর নে শিখে নে
 কিছুই যখন ভাল লাগবে না তোর
 পিয়ানোয় বসে তুই বাজাবিরে
 আয় খুকু আয় খুকু আয় ।

সিনেমা যখন চোখে জ্বালা ধরায়
 গরম কফির মজা জুড়িয়ে যায়
 কবিতার বইগুলো ছুঁড়ে ফেলি
 মনে হয় বাব যদি বলতো আমায়
 আয় খুকু আয় খুকু আয়……

আয়রে আমার সাথে আয় এখনি
 কোথাও ঘুরে আসি শহর ছেড়ে
 ছেলেবেলার মত বায়না করে
 কাছ থেকে নেনা তুই আমায় কেড়ে
 আয় খুকু আয় খুকু আয় …..

দোকানে যখন আসি সাজবো বলে
 খোঁপাটা বেঁধে নেই ঠাণ্ডা হাওয়ায়
 আরশিতে যখনই চোখ পড়ে যায়
 মনে হয় বাবা যেন বলছে আমায়
 আয় খুকু আয় খুকু আয়…..

আয়রে আমার কাছে আয় মামনি
 সবার আগে আমি দেখি তোকে
 দেখি কেমন খোঁপা বেঁধেছিস তুই
 কেমন কাজল দিলি কালো চোখে
 আয় খুকু আয় খুকু আ……

ছেলেবেলার দিন ফেলে এসে
 সবাই আমার মত বড় হয়ে যায়
 জানিনা কজনে আমার মতন
 মিষ্টি সে পিছু ডাক শুনতে যে পায়
 আয় খুকু আয় খুকু আয়…।।

আয়রে আমার পাশে আয় মামনি
 এ হাতটা ভাল করে ধর এখনি
 হারানো সেদিনে চল চলে যাই
 ছোট্টবেলা তোর ফিরিয়ে আনি
