'এক হারিয়ে যাওয়া বন্ধু';'“এক হারিয়ে যাওয়া বন্ধু”— সায়ান_____.
 নেই কোন বাঁধা

শত আশা শত আশা
 শত আশা শত আশা
 শত আশা শত আশা';'শূন্য';'শত আশা';'0'
'সবার হৃদয়ে রবীন্দ্র নাথ চেতনাতে নজরুল';'সবার হৃদয়ে রবীন্দ্র নাথ চেতনাতে নজরুল
 যতই আসুক বিঘ্ন বিপদ হাওয়া হোক প্রতিকূল
 একহাতে বাজে অগ্নিবীনা কন্ঠে গীতাঞ্জলী
 হাজার সূর্য চোখের তাঁরায় আমরা যে পথ চলি।।

এই সেই দেশ একদা যেখানে উপনিশদের ঋষি
 সমতার গান গেয়েছিল আর শুনেছিল দশদিশি
 প্রোপিতামহের ভাষাতেই আমরা যে কথা বলি
 হাজার সূর্য চোখের তাঁরায় আমরা যে পথ চলি।।

এই সেই দেশ এখনও এখানে উঠে আজানের ধ্বনি
 গীতা বাইবেন ত্রিপিটক আর শোনা যায় রামায়নি
 কবি কালিদাস ইকবাল আর গালিবের পদাবলি
 হাজার সূর্য চোখের তাঁরায় আমরা যে পথ চলি।।';'ভূপেন হাজারিকা';'জীবনমুখী গান';'0'
'ভগবান বড় ভালো';'ভগবান কতো ভালো
 ভগবান কতো ভালো
 অপরের চোখ অন্ধ করেও আমাকে দিলেন আলো,
 ভগবান কতো মিষ্টি
 ভগবান কতো মিষ্টি
 অন্য খামারে আগুন জ্বেলেও আমাকে দিলেন বৃষ্টি।

ভগবান কতো ফর্সা
 কালো মানুষকে মাড়বেন বলে সাদাকে দিলেন বর্শা,
 ভগবান কতো কালো
 ভগবান কতো কালো
 কালো মানুষের ছুরিটা কালোরি তলপেটে চমকাল।

ভগবান কতো লক্ষ্মী
 ভগবান কতো লক্ষ্মী
 মরছে মানুষ এ খবর টের পেলনা তো কাক পক্ষী,

ভগবান কতো সুন্দর
 ভগবান কতো সুন্দর
 জঙ্গি বিমান ধ্বংস করল শান্ত বিমান বন্দর।

ভগবান আশাবাদী
 লাশ কাটা ঘরে তানপুরা নিয়ে অতএব গলা সাধি।
 স র গ ম প';'কবির সুমন';'কবির সুমন';'0'
'আমি চাই';'আমি চাই সাঁওতাল তার ভাষায় বলবে রাষ্ট্রপুঞ্জে
 আমি চাই মহল ফুটবে সৌখিনতার গোলাপ কুঞ্জে।

আমি চাই নেপালি ছেলেটা গিটার হাতে
 আমি চাই তার ভাষাতেই গাইতে আসবে কলকাতাতে।

আমি চাই ঝাড়খণ্ডের তীর ধনুকে
 আমি চাই ঝুমুর বাজবে ঝুমুর বাজবে তোমার বুকে।

আমি চাই কাশ্মীরে আর শুনবে না কেউ গুলির শব্দ
 আমি চাই মানুষের হাতে রাজনিতি হবে ভীষণ জব্দ।

আমি চাই হিন্দু নেতার সালমা খাতুন পুত্র বধূ
 আমি চাই ধর্ম বলতে মানুষ বুঝবে মানুষ শুধু,
 আমি চাই বিজেপি নেতার সালমা খাতুন পুত্র বধূ
 আমি চাই ধর্ম বলতে মানুষ বুঝবে মানুষ শুধু।

আমি চাই গাছ কাটা হলে শোক সভা হবে বিধান সভায়
 আমি চাই প্রতিবাদ হবে রক্ত পলাশে রক্ত জবায়।
 আমি চাই পুকুর বুঝালে আকাশ ভাসবে চোখের জ্বলে
 আমি চাই সব্বাই যেন দিন বদলের পদ্য বলে।

আমি চাই মন্ত্রীরা প্রেম করুন সকলে নিয়ম করে
 আমি চাই বক্তৃতা নয় কবিতা বলুন কণ্ঠ ভরে।
 যদি বল চাইছি নেহাত…যদি বল চাইছি নেহাত চাইছি নেহাত স্বর্গ রাজ্য
 আমি চাই একদিন হবে একদিন হবে এটা এক রাজ্য।।';'কবির সুমন';'কবীর সুমন';'0'
'কাঞ্চনজঙ্ঘা';'একটু ভালোকরে বাঁচবো বলে আর
 একটু বেশি রোজগার
 ছাড়লাম ঘর আমি
 ছাড়লাম ভালোবাসা আমার নীলচে পাহাড় ।

পারলোনা কিছুতেই তোমার কলকাতা
 আমাকে ভুলিয়ে দিতে
 পাহাড়ী রাস্তার ধারের বস্তির
 আমার কাঞ্চনকে…..
 কাঞ্চন জানা, কাঞ্চন ঘর
 কাঞ্চনজঙ্ঘা , কাঞ্চন মন ।
 তো পাইলে সোনা ……..
 হনু হইয়্যো… ম উল্লা
 ভাংচু কাঞ্চন ।

সোনার খোঁজে কেউ
 কত দূর দেশে যায়
 আমি কলকাতায়,
 সোনার স্বপ্ন খুঁজে ফিরি একা একা
 তোমাদের ধর্মতলায়।
 রাত্তির নেমে এলে তিন’শ বছরের
 সিমেন্টের জঙ্গলে
 ফিরে চলে যাই সেই
 পাহাড়ী বস্তির কাঞ্চনের কোলে ।
 জং ধরা রং চটা পার্কের বেঞ্চিটা
 আমার বিছানা ।
 কখন যে তুলে নিয়ে গিয়েছিল আমাকে
 তোমাদের থানা ।
 তিন মাস জেল খেটে
 এখন আমি সেই থানার দারোয়ান
 পারবোনা ফিরে পেতে হয়তো কোনদিন
 আমার সেই কাঞ্চন…….
 কাঞ্চন জানা, কাঞ্চন ঘর
 কাঞ্চনজঙ্ঘা,কাঞ্চন মন ।
 তো পাইলে সোনা ……..
 হনু হইয়্যো… ম উল্লা
 ভাংচু কাঞ্চন ।

বেড়াতে যদি তুমি যাও কোনদিন
 আমার ক্যালিম্পং
 মনেরেখ শংকর হোটেলের ভাড়া
 ট্যুরিস্ট লজের চেয়ে কম
 রাত্তির নেমে এলে আসবে
 তোমার ঘরে চুল্লিটা জ্বালিয়ে দিতে
 আর কেউ নয় সে যে আমার ফেলে আসা
 নীলচে পাহাড়ের মেয়ে,
 বলোনা তাকে আমি দারোয়ান
 শুধু বলো করছি ভালোই রোজগার
 ঐ বস্তির ড্রাইভার চীগমীর সাথে
 যেন বেঁধে না ফেলে সংসার
 আর কিছু টাকা আমি জমাতে পারলে যাব যাব ফিরে
 পাহাড়ী রাস্তার ধারের বস্তির আমার নিজের ঘরে ।

আর যদি দেখ তার কপালে সিঁদুর
 বলোনা কিছুই তাকে আর
 শুধু এই সত্তর টাকা
 তুমি যদি পার গুঁজে দিও হাতে তার ।
 ট্রেনের টিকিটের ভাড়াটা সে দিয়েছিল
 কানের মাঁকড়ি বেচে
 ভালোবাসার সেই দাম তুমি দিয়ে দিও
 আমার কাঞ্চনকে ……
 কাঞ্চন জানা, কাঞ্চন ঘর
 কাঞ্চনজঙ্ঘা, কাঞ্চন মন ।
 তুমি যাকে বল সোনা
 আমি তাকে বলি কাঞ্চন……
 কাঞ্চন জানা, কাঞ্চন ঘর
 কাঞ্চনজঙ্ঘা, কাঞ্চন মন ।
 তো পাইলে সোনা ……..
 হনু হইয়্যো… ম উল্লা
 ভাংচু কাঞ্চন ।';'অঞ্জন দত্ত';'অঞ্জন দত্ত';'0'
'চোখের জল কিংবা পানি';'বেইলী রোডের ধারে, আমি দেখেছি তোমায়
 রাতের অন্ধকারে, আমি দেখেছি তোমায়
 আমার বউ বাজারে,আমি দেখেছি তোমায়
 দু’দিকের কাঁটা তারে আমি দেখেছি তোমায়

এখানে তুমি হাসি মল্লিক,ওখানে হাসিনা
 এখানে তোমার দাম পঞ্চাশ, ওখানে কত জানিনা
 নিয়ন আলোয় ঝলসে যাওয়া দুটো শহরের রাত
 বেঁচে থাকার জন্য কেনা বেচার দুটো হাত
 ডলারের হার কমলে, তাদের দর বদলায়
 চোখের জল কিংবা পানি, সেতো নোনতাই থেকে যায়।

কারো খদ্দের টয়োটা চড়ে, কারোর মারুতি জেন
 কারো চোখে দিশি নেশা, কারোর ফরেন
 তবু চাহিদা সেতো একটাই, একটুখানি সুখ
 তাই একই ভাবে লাঞ্ছিত হয় দুটি দেশের মুখ
 তবু আবার সকাল আসে, ওরা স্নান করে যায়
 দুজনেই মনে মনে, বাংলায় গান গায়।

ডলারের হার কমলে, তাদের দর বদলায়
 চোখের জল কিংবা পানি, সেতো নোনতাই থেকে যায়।

এখানে ঘোলাটে গঙ্গার জল, ওখানে ইছামতি
 নোংরা নষ্ট, হাজার কষ্ট তবু বয়ে চলে ঠিকই
 চেপে রাখা ক্ষত,যত যত হাহাকার
 বিশ্বের কাছে দেনার দায়ে লাঞ্ছিত বারবার
 তবু আবার রঙ চাপিয়ে,দাঁড়াতেই হয়
 বেঁচে থাকার জন্য, বিশ্বের রাস্তায়।

ডলারের হার কমলে, দেশের দর বদলায়
 চোখের জল কিংবা পানি, সেতো নোনতাই থেকে যায়';'অঞ্জন দত্ত';'অঞ্জন দত্ত';'0'
'প্রচারণা';'এতে নেই কোনো বিস্ময়
 যার যত বেশী প্রচারণা
 তারই এখন জয়।।

সততা, নিষ্টা, কিসের দেশপ্রীতি
 তিলকে যদি তাল না দেখাই
 চলে না রাজনীতি

একবার এসো গো সখা মনের দুয়ার খুলি।
 রাজনীতির এই কলা-কৌশল
 কেমন করে মুখে বলি।

ব্যানারে, ব্যানারে, ফেস্টুনে আকাশ গেছে টুটি
 চাটুকার আর সুবিধাবাদীর বেড়ে গেছে ছোটাছুটি।

মিনিটে মিনিটে চোখ ধাঁধা লাগে
 ফ্ল্যাশের ঝলকানি
 শ্লোগানে শ্লোগানে মুখরিত ধ্বনি-প্রতিধ্বনি।

খিচুরী আর শুকনো রুটি চলছে বিতরণ
 টিভি ক্যামেরায় বন্দী হলো সকল আয়োজন

এ কোন উৎসবও নয়, পার্টিও নয়, নয় কোনো সম্ভাষণ

এ যে দুর্গতদের পাশে মোরা আছি
 তারই করুণ নিদর্শন (হ্যাঁ, হ্যাঁ)।।

ছোটখাট কোনো ছুঁত পেলে তুলি প্রতিবাদের ঝড়,
 সব আক্রোশ যেন সেই জনতার উপর।

বিনে কারণে রাস্তার ধারে
 ভাঙছি দোকান-গাড়ি
 রোড ডিভাইডারের রড তুলে নিয়ে
 দেখাচ্ছি বাহাদুরি

কাটা রাইফেল, ককটেলের চলছে প্রদর্শন
 দিশাহারা হয়ে ছোটাছুটি করে নিরীহ জনগণ

এ কোনো যুদ্ধও নয়,
 সন্ত্রাসও নয়, নয় কোনো আন্দোলন।

এ যে কার কত ক্ষমতা আছে
 তারই করুণ নিদর্শন

একবার এসো গো সখা মনের দুয়ার খুলি।
 রাজনীতির এই কলা-কৌশল
 কেমন করে মুখে বলি।';'হায়দার হোসেন';'হায়দার হোসেন';'0'
'আমি সরকারী অফিসার';'আমি সরকারী অফিসার
 আমি সরকারী অফিসার
 আছে মোর আগে পিছে কতশত তাবেদার।

আমি কত না সাধন করে মামার খুঁটির জোরে
 অবশেষে হয়েছি একালের জমিদার।।

আমাকে ছাড়া চালাবে এ দেশ সাধ্য কার বাবার
 আমি আপন মনে চলি মনে মনে বলি
 কিসের নেতা, কিসের নেত্রী, আমিই তো সরকার।।

নেতাদের কথা ভেবে আমার বড্ড হাসি পায়
 ক্ষমতা চলে গেলেই তারা বড়ই নিরুপায়
 কাল যারা আসনে বসে করতো হুকুমদারি
 আজ তারা রাজপথে গড়েছে ঘরবাড়ি

জনতার ধাওয়া খায় কখনো পুলিশে দাবড়ায়
 জায়গা মত ফেসে গেলে জেলের ভাতও খায়

এরা ক’দিনের মেহমান, এদের কিসের সম্মান।
 আমি আছি, আমি থাকব, আমি চির অম্লান।।

বেতন কত পাই তার খোঁজ কে রাখে ভাই
 বেতন গুণে চলতে গেলে বাঁচার উপায় নাই
 কলম খোঁচা দিলাম আমার লক্ষ টাকা চাই
 দেশ যায় যাক রসাতলে ভাবনা আমার নাই

অবসর নেওয়ার পরে আমি আসব নতুন দেশে
 শিল্পপতি সমাজসেবক লাগবে নামের শেষে।
 আমি দেশের কর্ণধার, আমি সেবক জনতার
 নির্ঝঞ্ঝাট আয়েশী আমার জীবন করব পার।।';'হায়দার হোসেন';'ফাইসা গেছি';'0'
'কতটুকু অশ্রু গড়ালে হৃদয় জলে সিক্ত';'(পিলখানা হত্যাকান্ড স্বরণে)

কতটুকু অশ্রু গড়ালে হৃদয় জলে সিক্ত
 কত প্রদীপ শিখা জ্বালালেই জীবন আলোয় উদ্দীপ্ত
 কত ব্যথা বুকে চাপালেই তাকে বলি আমি ধৈর্য
 নির্মমতা কতদূর হলে জাতি হবে নির্লজ্জ

আমি চিৎকার করে কাঁদিতে চাহিয়া
 করিতে পারিনি চিৎকার।
 বুকের ব্যথা বুকে চাপায়ে নিজেকে দিয়েছি ধিক্কার।।

আজও কানে বাজে সেই কথাগুলো
 কে জানে যে হবে শেষ কথা।

নিয়তির ডাকে দিলি যে সাড়া
 ফেলে গেলি শুধু নীরবতা
 যার চলে যায় সেই বোঝে যে হায়
 বিচ্ছেদে কি যন্ত্রণা।
 অবুঝ শিশুর অবুঝ প্রশ্ন
 কি দিয়ে দেব সান্ত্বনা

আমি চিৎকার করে কাঁদিতে চাহিয়া
 করিতে পারিনি চিৎকার।
 বুকের ব্যথা বুকে চাপায়ে নিজেকে দিয়েছি ধিক্কার।।

বিধাতা তোমারে ডাকি বারেবারে
 কর তুমি মোরে মার্জনা।

দুঃখ সইতে দাও গো শক্তি
 তোমারি সকাশে প্রার্থনা

চাহিনা সহিতে আমার মাটিতে
 মজলুমেরই আর্তনাদ।

বিষাদ অনলে পুড়ে বারেবারে
 লুণ্ঠিত হবে স্বপ্নসাধ

আমি চিৎকার করে কাঁদিতে চাহিয়া
 করিতে পারিনি চিৎকার।
 বুকের ব্যথা বুকে চাপায়ে নিজেকে দিয়েছি ধিক্কার।।';'হায়দার হোসেন';'হায়দার হোসেন';'0'
'জীবনের প্রয়োজনে';'জীবনের প্রয়োজনে একটি জীবন পাশে দাড়াবেকি…?
 অনেক নিরাশা ভেঙ্গে একটু আশা প্রানে জাগাবেকি…?
 ও… একটি একটু করে পথ, সবুজ আঙ্গিনায় যেতে চাই
 ও… একটু একটু করে বেশ, মানুষ হয়ে বাঁচতে চাই…
 দেখ অপার ভালবাসা প্রাণেরি মেলা
 চোখ বাঁধা সময়ের অন্ধ খেলা…
 ও একটু একটু করে বেশ
 অনেকটা পথ হেটে যেতে চাই
 ও একটু একটু করে বেশ
 অনেক ভালবাসা পেতে চাই…।

সবুজের হাতছানি দিয়ে যায় বারবার দেখেছকি?
 সততার মুখোমুখি প্রানের মিছিল আজ দাড়াবেকি?
 ও দিন বদলের পালা বেশ,সময়ের ঘাটে নৌকা বেড়াই
 অসময় থাকে শেষ মেষ,তোমায় সাথে নিয়ে যেতে চাই…
 দেখ সবুজ প্রানের মেলা জেগেছে আবার
 নিয়মের কারাগার বন্ধ দুয়ার…
 ও দিন বদলের পালা বেশ,সময়ের ঘাটে নৌকা বেড়াই
 অসময় থাকে শেষ মেষ,তোমায় সাথে নিয়ে যেতে চাই…';'মিলন মাহমুদ';'জীবনমুখী গান';'0'
'বয়স হয়েছে তাই';'বয়স হয়েছে তাই
 এবার ঘোচাতে চাই
 দুঃস্বপ্নের ভোর
 এশহর থেকে দূরে
 মানুষ দাড়াল ঘুরে
 আনলো নতুন ভোর 

বাড়ছে বয়েস সখা
 ভালবাসা একরোখা
 বাঁচবেই দুনিয়ায়
 গ্রামে গ্রামে দুর্বার
 মানুষ রা এইবার
 পরিবর্তন চায়

বয়েস বাড়লো সখি
 সুর ক্ষ্যাপা চখা চখি
 আরো গান গাই চলো
 জানলাম দেখলাম
 শিমুর নন্দী গ্রাম
 বেঁচে থেকে লাভ হলো 

বয়স হয়েছে তাই
 এবার ঘোচাতে চাই
 দুঃস্বপ্নের ভোর
 এশহর থেকে দূরে
 মানুষ দাড়াল ঘুরে
 আনলো নতুন ভোর ।';'সাবিনা ইয়াসমিন ও কবির সুমন';'নতুন ভোর';'0'
'একদিন বৃষ্টিতে বিকেলে';'একদিন বৃষ্টিতে বিকেলে
 থাকবেনা সাথে কোন ছাতা
 শুধু দেখা হয়ে যাবে মাঝ রাস্তায়
 ভিজে যাবে চটি, জামা মাথা
 থাকবেনা রাস্তায় গাড়িঘোড়া
 দোকানপাট সব বন্ধ
 শুধু তোমার আমার হৃদয়ে
 ভিজে মাটির সোঁদা গন্ধ
 একদিন বৃষ্টিতে বিকেলে
 মনে পড়ে যাবে সব কথা
 কথা দিয়ে কথাটা না রাখা
 ফেলে আসা চেনা চেনা ব্যথা

অদূরে কোথাও কোন রেডিওতে
 এই পথ যদি না শেষ হয়
 আর বৃষ্টির রং হয়ে যাবে নীল
 আর আকাশের রংটা ছাই

একদিন, বৃষ্টিতে একদিন …

ভাঙ্গা দেয়ালের গায়ে সাত পাকে বাঁধা কবে-
 কার নুন শো তে কোথাও
 আর বৃষ্টির ছাঁটে যাবে না দেখা দুজনের চোখের জল
 ছমছম
 ছমছম
 চোখের জল

একদিন বৃষ্টিতে বিকেলে
 আমরা ধরা পড়ে যাব জেনো ঠিক
 ধুয়ে যাবে যত আছে অভিমান
 ধুয়ে যাবে সিঁদুরের টিপ
 আর চটিটাও ছিঁড়ে যাবে তক্ষুনি
 তাই পালানো যাবেনা যে কোথাও
 রাস্তা যেমন তেমনি
 শুধু লোকজন সব উধাও

একদিন বৃষ্টিতে ……';'অঞ্জন দত্ত';'জীবনমুখী গান';'0'
'যদি হঠাৎ আবার দেখা হয় দুজনার';'যদি হঠাৎ আবার দেখা হয় দুজনার
 কোন পথের বাঁকে, বহু কাজের ফাঁকে ।।
 শুধু জানতে চাইবো আজও মনে আছে কি
 মনে আছে কি স্মৃতি, নাকি দিয়েছে ফাঁকি
 সেই চেনা সুর যা গাইতাম একই সাথে-
 চালো সাজনা যাহা তাক ঘাটা চালে…

সেদিনের রাজপথ, পথভোলা জেনে বুঝে,
 অবিরাম হেঁটে যাওয়া নির্জনতার খোঁজে-
 সেই ধর্মতলা, ধূলো আর ধোঁয়ামাখা,
 ভাল না লাগার মাঝে তবু কত ভাল লাগা
