'এক হারিয়ে যাওয়া বন্ধু';'“এক হারিয়ে যাওয়া বন্ধু”— সায়ান_____.
 আজ কোন নির্জনে, বলো কি আপনমনে
 ভাল ছিল দিনগুলো কোলাহল আঁকা
 শুধু জানতে চাইবো চোখ জলে ভরে কি
 শুনে আকুল হয় কি ঐ মনপাখি
 সেই চেনা সুর যা গাইতাম একই সাথে
 চালো সাজনা যাহাতাক ঘাটা চালে…

আজ কত নীতিকথা, শাসনের বেড়াজাল,
 ভুলিয়ে দিয়েছে আজ সেই স্মৃতি উত্তাল
 একদিন যে হৃদয় আকাশকে ছুঁতে চায়
 আজ মুখ ঢাকে সম্বল চার দেয়াল-
 আজ কি নোঙর তুলে স্রোতের অনুকূলে
 ভাসিয়ে দিয়েছো নাও ছেঁড়া যার পাল
 শুধু জানতে চাইবো মন আজও আঁকে কি
 স্বপ্নের রঙে রাঙা স্বরলিপি
 সেই চেনা সুর যা গাইতাম একই সাথে-
 চালো সাজনা যাহাতাক ঘাটা চালে…';'নচিকেতা';'নচিকেতা';'0'
'নীলাঞ্জনা';'দুলছে হাওয়ায় , না না না ফুল নয়
 দখিনা বাতাসে নাগপাশে সময় নয়।
 খোলা বারান্দায়, এই নির্জনতায়
 সিলিংয়ের বন্ধনে, মাটির ব্যাবধানে
 দুলছে স্খলিত বসনা
 নীলাঞ্জনা নীলাঞ্জনা ।।

প্রেমিকের স্পর্শ
 আনবেনা শিহরন আর ঐ মনে,
 কেয়ার অফ ফুটপাত নচিকেতা দুটি হাত
 শূণ্যে ছুড়বে ফাঁকা আস্ফালনে,
 উড়ছে মাছি , না না না অবুঝ নয়
 সে আজো একা তাই ঘিরে মাছিরাই রয় ।
 খোলা বারান্দায়, এই নির্জনতায়
 সিলিংয়ের বন্ধনে, মাটির ব্যাবধানে
 দুলছে স্খলিত বসনা
 নীলাঞ্জনা নীলাঞ্জনা ।।

লাশকাটা ঘরে যদি
 চেরা হয় তার বুক সঙ্গোপনে,
 দেখবে সেখানে রাখা বিবর্ণ
 একমুঠো স্বপ্ন যতনে ।
 যে স্বপ্ন কোন কিশোরের দেয়া উপহার গানের ভাষায় ,
 যে স্বপ্ন প্রথাগত মিথ্যে কপট সংসারের আশায়।
 এখন সময় না না না রাত্রি নয়
 সে আজ জীবনরাত্রি পেরিয়ে গেছে হায় ।।
 খোলা বারান্দায়, এই নির্জনতায়
 সিলিংয়ের বন্ধনে, মাটির ব্যাবধানে
 দুলছে স্খলিত বসনা
 নীলাঞ্জনা নীলাঞ্জনা ।।';'নচিকেতা';'নচিকেতা';'0'
'পেটকাটি চাঁদিয়াল';'পেটকাটি চাঁদিয়াল মোমবাতি বগ্গা
 আকাশে ঘুড়ির ঝাঁক, মাটিতে অবজ্ঞা।।

বয়স বারো কি তেরো ।।
 রিকশা চালাচ্ছে,
 আকাশে ঘুড়ির ঝাঁক ছেলেটাকে ডাকছে।
 বয়স বারো কি তেরো, বড়জোর চোদ্দ,
 রিক্শা চালাতে শিখে নিয়েছে সে সদ্য।

ছেলেটার মন নেই প্যাডেলে বা চাক্কায়।।
 ঐ তো লেগেছে প্যাঁচ চাঁদিয়াল বগ্গায়।
 শান্ দেওয়া মানজায়, বগ্গা ভো কাট্টা।
 ছেলেটা চেঁচিয়ে ওঠে “এই নিয়ে আটটা”।

সওয়ার বাবুটি ভাবে, দেরি হয়ে যাচ্ছে।
 বিচ্ছু ছোঁড়াটা বড় আস্তে চালাচ্ছে।
 “ওই ছোঁড়া, আরে ওই ছোঁড়া ম’ল যা
 আট্টা তো তোর কি ?”
 সওয়ার বাবুটি দেন রেগে মেগে হুমকি।

বাবুর খ্যাঁকানি শুনে সম্বিত্ ফিরে পায়
 ছেলেটা যে করে হোক রিক্শা চালিয়ে যায়।

এ কিশোর পারবে কি এই বোঝা টানতে ?
 এই বাবু কোনো দিন পারবে কি জানতে ?

যে ছেলেটা প্রাণপণে রিক্শা চালাচ্ছে,
 মুক্তির ঘুড়ি তাকে খবর পাঠাচ্ছে।
 পেটকাটি চাঁদিয়াল মোমবাতি বগ্গা
 আকাশে ঘুড়ির ঝাঁক, মাটিতে অবজ্ঞা।
 পেটকাটি চাঁদিয়াল…';'কবির সুমন';'কবীর সুমন';'0'
'দুচোখ বুজে যাও কিছু চেয়ে দেখোনা';'দুচোখ বুজে যাও কিছু চেয়ে দেখোনা
 দুচোখ বুজে যাও কিছু চেয়ে দেখোনা৷
 দুকান বুজে যাও কিছু শুনে দেখোনা৷
 কত কী করছে লোকে, কত কী বলছে লোকে –
 যাও ভুলে যাও কিছু মনে রেখোনা৷

মনে রাখা বড় বিপদ– কথায় কথায় মনে পড়ে৷
 সেদিন ঐ ওপাড়াতে কে যেন গেছে মরে৷ ।।
 কিভাবে মরে গেছে চেয়ে যদি দেখেই থাক
 অথবা পথের ধারে আচমকা শুনেই থাক –
 সে ছিল তোমার আমার মতই একটা দিব্যি মানুষ
 ছিল তার ছেলেমেয়ে, বিছানায় মেয়েমানুষ৷
 ছিল তার একটা মাথা, দুটো হাত আর দুখানি পা
 ময়লা জামাকাপড় কেচে দিত পাড়ার ধোপা৷
 খিদে পেলে খিদে পেত তোমার আমার মতই তারও
 মিল ছিল আরো অনেক – গোঁজামিলও বলতে পারো৷
 এরই মাঝে একটা অমিল – ভীষণ রকম অমিল ছিল৷
 মাস দুই আগে হঠাত্ লোকটার চাকরি গেল৷
 ফলে কি হল জান?

না জেন না, না জেন না,
 জানলে লোকে বলবে কি?
 ‘লোকে খাচ্ছে না’ ভাবলে গরম ভাতে ঘি
 কি করে চটকাবে আর –
 কে খাবে আমার খাবার!
 না জেননা জানলে লোকে বলবে কি?';'কবির সুমন';'কবির সুমন';'0'
'সারারাত জ্বলেছে নিবিড়';'সারারাত জ্বলেছে নিবিড়
 ধুসর নীলাভ এক তারা
 তারই কিছু রং নাও তুমি
 তারই কিছু রঙ নাও তুমি

শহরে জোনাকি জ্বলে না নয়তো
 কুড়োতাম সে আগুন নীল হয়তো
 যা কিছু নেই
 নাই বা হল সব পাওয়া
 না পাওয়ার রঙ নাও তুমি
 না পাওয়ার রঙ নাও তুমি

বড় বেরঙীন আজকাল
 কাছাকাছি
 কোন রঙ পাইনা,
 তাই দিতে পারি না কিছু
 কিছুই রাঙানো হল না নয়তো
 আগামীর রঙে ছোপাতাম হয়তো
 এই মলিন আর এ ধুসর পথ চাওয়া
 এ চাওয়ার রঙ নাও তুমি
 আগামীর রঙ নাও তুমি';'কবির সুমন';'কবীর সুমন';'0'
'জাতিস্মর';'অমরত্মের প্রত্যাশা নেই নেই কোন দাবি দাওয়া
 এই নস্সর জীবনের মানে শুধু তোমাকে চাওয়া
 মুহূর্ত যায় জন্মের মতো অন্ধ জাতিস্মর
 গত জন্মের ভুলে যাওয়া স্মৃতি বিস্মৃত অক্ষর
 ছেড়া তাল পাতা পুঁথির পাতায় নিঃস্বাস ফেলে হাওয়া
 এই নস্সর জীবনের মানে শুধু তোমাকেই চাওয়া

কাল-কেউটের ফনায় নাচছে লখিন্দরের স্মৃতি
 বেহুলা কখনো বিধবা হয় না এটা বাংলার রীতি
 ভেসে যায় ভেলা এবেলা ওবেলা একই সব দেহ নিয়ে
 আগেও মরেছি আবার মরবো প্রেমের দিব্যি দিয়ে

জন্মেছি আমি আগেও অনেক মরেছি তোমারই কোলে
 মুক্তি পাইনি শুধু তোমাকে আবার দেখবো বলে ।।
 বার বার ফিরে এসেছি আমরা এই পৃথিবীর টানে
 কখনো গাঙড় কখনো কো পাই কপোতাক্ষর গানে
 গাঙড় হয়েছে কখনো কাবেরী কখনো বা মিসিসিপি
 কখনো রাইন কখনো কঙ্গো নদীদের স্বরলিপি
 স্বরলিপি আমি আগেও লিখিনি এখনও লিখিনা তাই
 মুখে মুখে ফেরা মানুষের গানে শুধু তোমাকেই চাই

তোমাকে চেয়েছি ছিলাম যখন অনেক জন্ম আগে
 তথাগততার নিঃস্বংগতা দিলেম অস্তরাগে
 তারই করুনায় ভিখারিনি তুমি হয়েছিলে একা একা
 আমিও কাঙাল হলাম আরেক কাঙালের পেয়ে দেখা
 নতজানু হয়ে ছিলাম তখনো এখনো যেমন আছি
 মাধুকরী হও নয়নমোহিনী স্বপ্নের কাছাকাছি

ঠোঁটে ঠোঁট রেখে ব্যারিকেড কর প্রেমের পদ্যটাই
 বিদ্রোহ আর চুমুর দিব্যি শুধু তোমাকেই চাই

আমার স্বপ্নে বিভোর হয়েই জন্মেছ বহুবার
 আমি ছিলাম তোমার কামনা বিদ্রোহ চি্তকার
 দুঃখ পেয়েছ যতবার জেনো আমায় পেয়েছ তুমি
 আমি তোমার পুরুষ আমি তোমার জন্মভূমি
 যতবার তুমি জননী হয়েছ ততবার আমি পিতা ।।
 কতো সন্তান জ্বালালো প্রেয়সি তোমার আমার চিতা

বার বার আসি আমরা দুজন ।।
 বার বার ফিরে যাই
 আবার আসবো আবার বলবো
 শুধু তোমাকে চাই';'কবির সুমন';'কবীর সুমন';'0'
'ছুটল ছুটিতে দূরপাল্লার ট্রেন';'ছুটল ছুটিতে দূরপাল্লার ট্রেন
 ছুটতে ছুটতে এসে গেল আশ্বিন
 আগে আর পরে ছোটাছুটি ছোটাছুটি
 মাঝখানে কিছু ছুটি কাটানোর দিন

ছুটির ঘুড়িটা ছুটির আকাশে ওড়ে
 ঘুড়িতে ঘুড়িতে ছুটির লড়াই লাগে
 ছুটির মাঞ্জা পাঞ্জা লড়তে এলো
 দেখি কার ঘুড়ি ছুটি পেয়ে যায় আগে৷

ছুটির পাখীটা ছটফট করে রোজ
 খাঁচায় বন্দী পালাতে পারে না তাই
 দানাপানি তাকে যতই দাওনা তুমি
 পাখীর কিন্তু ছুটির আকাশ চাই৷

ভোরের মাটিতে শিউলিফুলের ছুটি
 মেটে রং ডাকে সবুজকে আয় আয়
 রংগুলো হয় একাকার ছুটি পেলে
 ঘাসের সবুজ রোদ্দুরে মিশে যায়

রোদ্দুরে ছুটি পেয়ে গেল প্রজাপতি –
 যেখানে ইচ্ছে, যতবার খুশি ঘোরে
 ডানায় ডানায় ছুটির দিগ্বিজয় দিগ্বিজয়
 রঙে আর রঙে ছুটির নিশান ওড়ে৷

বছর ত্রিশেক চাকরি বাকরি করে
 কামালেন জেঠু নিয়েছেন অবসর
 দূরদর্শনে দেখছেন ছুটি ছুটি
 পেয়েছেন ছুটি অনেক বছর পর

মনে পড়ে তাঁর আরেক জনের কথা
 ধিতাং ধিতাং বোলের ছন্দে সুরে
 ছোটালেন তিনি গানের অজস্রতা
 কাটা ছিল তাঁর টিকিট অনেক দূরে

ছুটির পাখীটা …';'পায়েল কর';'রীমা রায় এবং আরো অনেকে)';'0'
'কতটা পথ পেরোলে তবে পথিক বলা যায়';'কতটা পথ পেরোলে তবে পথিক বলা যায়
 কতটা পথ পেরোলে পাখি জিরোবে তার দায়
 কতটা অপচয়ের পর মানুষ চেনা যায়
 প্রশ্নগুলো সহজ, আর উত্তরও তো জানা।।

কত বছর পাহাড় বাঁচে ভেঙে যাবার আগে
 কত বছর মানুষ বাঁচে পায়ে শিকল পড়ে ।।
 ক’বার তুমি অন্ধ সেজে থাকার অনুরাগে ।।
 বলবে তুমি দেখছিলে না তেমন ভালো করে।

কত হাজার বারের পর আকাশ দেখা যাবে
 কতটা কান পাতলে তবে কান্না শোনা যাবে ।।
 কত হাজার মরলে তবে মানবে তুমি শেষে ।।
 বড্ড বেশী মানুষ গেছে বানের জলে ভেসে ।';'কবির সুমন';'জীবনমুখী গান';'0'
'অ্যাম্বিশন';'কেউ হতে চায় ডাক্তার, কেউ বা ইঞ্জিনিয়ার
 কেউ হতে চায় ব্যবসায়ী কেউ বা ব্যারিস্টার
 কেউ চায় বেচতে রূপোয় রূপের বাহার চুলের ফ্যাশান।

আমি ভবঘুরেই হব, এটাই আমার অ্যাম্বিশন।

ঠকানোই মূল মন্ত্র, আজকের সব পেশাতে,
 পিছপা নয় বিধাতাও, তেলেতে জল মেশাতে।
 ডাক্তার ভুলছে শপথ, ঘুশ খায় ইঞ্জিনিয়ার
 আইনের ব্যবচ্ছেদে, ডাক্তার সাজে মোক্তার।

যদি চাও সফলতা, মেনে নাও এই সিস্টেম,
 ফেলে দাও শ্রোতের মুখে, আদর্শ বিবেক ও প্রেম।
 এ সমাজ মানবে তোমায়, গাইবে তোমারই জয়গান।

আমি কোনে বাউল হব, এটাই আমার অ্যাম্বিশন।

বড় যদি চাইবে হতে, সেখানেও লোক ঠকানো।
 সতভাবে বাঁচো বাঁচাও, একথা লোক ঠকানো।
 সতভাবে যাবে বাঁচা, বড় হওয়া যাবে নাকো।
 শুধু কথা না শুনে, বড়দের দেখেই শেখ।
 এ সবই থাক তোমাদের, আমি বড় চাই না হতে,
 ধুলো মাখা পথই আমার, তুমি চোড়ো জয়োরথে।
 শত লাঞ্ছণা দিও, কোরো আমায় অসম্মান।

তবু আমি বোকাই হব, এটাই আমার অ্যাম্বিশন।

কেউ হতে চায় ডাক্তার, কেউ বা ইঞ্জিনিয়ার,
 কেউ হতে চায় ব্যবসায়ী, কেউ বা ব্যারিস্টার,
 কেউ চায় বেচতে রূপোয়, রূপের বাহার চুলের ফ্যাশান।

আমি ভবঘুরেই হব, এটাই আমার অ্যাম্বিশন।
 আমি কোনে বাউল হব, এটাই আমার অ্যাম্বিশন।
 তবু আমি বোকাই হব, এটাই আমার অ্যাম্বিশন।';'নচিকেতা';'অ্যাম্বিশন';'0'
'দুটো মানুষ';'দু’টো মানুষ
 এসাথে কত পথ চলা
 হাতে হাত রেখে কথা বলা
 কেন সব করে অবহেলা
 কেন শেষ-মেষে এসে বিদায়

ফুলদানি
 আছড়ে ভেঙ্গে চুড়মার
 ফুল জল সব একাকার
 নেমে আসে অন্ধকার
 জানালার বাইরে নেমে আসে রাত

দু’টো বালিশ
 কত স্বপ্ন ভালোবাসা বোঝাই
 দেখে যায় এই কুৎসিত লড়াই
 আশা আকাংখা সব পুড়ে ছাই
 কেউ মুখ ফুটে কিছু বলে না

টেবিল ল্যাম্পের আধো অন্ধকারে
 ভাঙ্গাচোড়া মন দুটো গুমড়ে গুমড়ে মরে
 দুজনেই বসে থাকে হাত ধরবে বলে
 কেউ মুখ ফুটে কিছুই বলে না
 ভগবান তাই নেমে আসে না

আসে সকাল
 চোখ মুছে চিঠি লেখা
 ব্রিফকেস হাতে ট্যাক্সি ডাকা
 ফিরে না তাকিয়ে দেখা
 ইশ…
 এইভাবে কেউ চলে যায়';'অঞ্জন দত্ত';'জীবনমুখী গান';'0'
'আমার রাস্তা আমার বাড়ি';'আমার রাস্তা আমার বাড়ি
 আমার ফাটা দেয়াল
 আমার পোড়া মনের অজস্র জঞ্জাল

ভাঙছে কেবল ভাঙছে
 শুধু যাচ্ছে ক্ষয়ে ক্ষয়ে
 আমার রাত্রি আমারই সকাল

একই ভাবে ঘামতে ঘামতে
 মনের ভেতর নামতে নামতে
 কোনমতে করছি দিনটা পার

চলছে চলবে
 চলছে চলবে এই ভাঙাচোরা
 গল্পটা আমার

নাকে আমার পোড়া পিঠের গন্ধ
 বুকে কালো ধোঁয়া
 হাতে-পায়ে শুধুই অবক্ষয়
 তবু কাশতে কাশতে
 এখনও যে হাসতে
 পাড়ি ভালোবাসতে
 নিজের কাছে
 নিজেরই বিস্ময়

করবো যে আর কত ঘেন্না
 নিজেই নিজের ছায়াটাকে
 করবো যে আর কত অপমান
 আবার তো সেই আষ্টেপিষ্টে
 জড়িয়ে নিজের নরকটাকে
 গাইবো আমি ভালোবাসার গান

এসো আমার ঘরে একবার
 তুমি এসো আমার ঘরে একবার
 পারো যদি দেখে যেও
 বেঁচে থাকা কারে বলে
 এসো আমার শহরে একবার';'অঞ্জন দত্ত';'জীবনমুখী গান';'0'
'আকাশ ভরা সূর্য তারা';'আকাশ ভরা সূর্য তারা
 আকাশমুখী সারি সারি
 কালো ধোঁয়ায় ঢেকে যাওয়া ঠাসাঠাসি বাক্স বাড়ি
 এখান থেকেই চলার শুরু এখান থেকেই হামাগুড়ি
 এখানটাতেই আমার বাসা
 আমার বাড়ি ….

বারোতলার ওপর থেকে
 বারো বছর কেটে গেছে
 ইস্কুলটা যাওয়া ছাড়া নামা হয়না মাটির কাছে
 শোবার ঘরের দেওয়ালটাময় হাঁস মুর্গী অনেক নাচে
 তবু ওর লাল (?) চোখের ভেতর কোথাও যেন কান্না ভাসে৷

সেখান থেকে একটু দূরে
 একটুখানি এগিয়ে গেলে
 একলা থাকেন নন্দীবাবু বন্দী সেও যে বয়সকালে
 সংসারটার হাল ধরেছে বখাটে তার ছোট ছেলে
 এক কাপ চা দিয়ে গেছে কখন জানি সাত সকালে

রেডিওটার ব্যাটারিটা হঠাত্ কবে গেল ক্ষয়ে
 খাটের থেকে নামতে মানা
 বুকের ব্যাথা গেছে সয়ে
 নীলিমার মা তাই তো যে আর ভাবেনা আর সংসারটা নিয়ে
 এঁদো গলির সেঁদো ঘরে সবই কেমন বয়ে গেছে
 এখান থেকেই আটকে পরা এখানটাতেই ঘুরোঘুরি
 এখানটাতেই আমার বাসা
 আমার বাড়ি ….

চৌধুরীদের একুশ তলায় মদের নেশায় উঁচু গলায়
 ঝগড়া চলে গভীর রাতে
 লাজলজ্জার বাঁধ ভেঙ্গে যায়
 কোর্ট কাছারি অনেক হল
 হলনা যে ছাড়াছাড়ি
 সম্পত্তি আঁকড়ে ধরে গভীর রাতের মারামারি৷

সেখান থেকে একটু দূরে পাড়ার মোড়টা একটু ঘুরে
 অলিগলি পাকস্থলীর ভেতর কারা গুমড়ে মরে
 বলি হল আরেকটা প্রাণ
 মস্তানদের ছোরাছুরির
