'এক হারিয়ে যাওয়া বন্ধু';'“এক হারিয়ে যাওয়া বন্ধু”— সায়ান_____.
 এখানটাতেই আমার বাসা
 আমার বাড়ি সারি সারি ….

চিলেকোঠার বারান্দাটা বন্ধ কেন জানো কি তা?
 এখান থেকেই লাফিয়ে পরে
 লাহাবাড়ির অনিন্দিতা
 গভীর রাতে তাইতো কেউ আর ওঠে না যে ওদের ছাদে
 অন্ধকারের বন্ধ ঘরে কারা যেন ডুকরে কাঁদে
 সেখান থেকে একটু দূরে ছদের পাঁচিলটা ঘুরে
 এক চিলতে রোদ্দুরেতে ছোট্ট মেয়ে নামতা পড়ে
 তাই তো কালো ইঁটের ফাঁকে বট পাতাটা জিভ ভ্যাংচায়
 পাড়ার নেড়ি, বাচ্চাটাকে বুকে করে হাঁটতে শেখায়৷
 এখানটাতেই আটকে পরা
 এখানটাতেই ঘুরোঘুরি
 এখানটাতেই আমার বাসা
 আমার বাড়ি ….

আকাশ ভরা সূর্য তারা
 আকাশমুখী সারি সারি
 কালো ধোঁয়ায় ঢেকে যাওয়া
 ঠাসাঠাসি বাক্স বাড়ি
 এখান থেকে চলার শুরু এখানটাতেই হামাগুড়ি
 এখানটাতেই আমার বাসা
 তোমার ভালোবাসার বাড়ি৷';'অঞ্জন দত্ত';'জীবনমুখী গান';'0'
'শেষ বলে কিছু নেই';'যখন মনের ভেতর সূর্যটা হটাত্ ডুবে যায়,
 যখন আশা ভরসা সব রাস্তা হারায়।
 যখন ভর দুপুরে পথের ধারে একলা করে ভয়,
 যখন বাসের ভিড়ে গলার ভিতর কান্না চাপতে হয়।
 জেনো তোমার মতই আমি ঠাকরে বেড়াই
 জেনো তোমার মতই আমার বন্ধু একটা চাই।
 যেমন মাঝ দরিয়ার নৌকো ফিরে আসে কিনারায়,
 ওরে মানুষ যথন আছে তখন হাত জুটে যায়।
 শেষ বলে কিছু নেই।
 শেষ বলে কিছু নেই।
 শেষ যেখানে, জেনো শুরু সেখানে';'অঞ্জন দত্ত';'জীবনমুখী গান';'0'
'শুনতে কি চাও';'শুনতে কি চাও তুমি সেই অদ্ভুত বে-সুরো সুর
 ফিরে পেতে চাও কি সেই আনচান করা দুপুর
 দেখতে কি চাও তুমি সেই খেলনাওয়ালাটা কে
 তার খেলনা দোতারা সে বাজাচ্ছে কবে থেকে

স্কুলের টিফিনের পয়সা বাঁচিয়ে কেনা
 সেই অদ্ভুত ফাটা বাঁশ আর মাটির সুর টানা টানা
 দু’দিনের সম্পদ দু’টাকার বাজনার বিষ্ময়
 তারপর কখন হঠাৎ সুখের মানে পাল্টে যায়

তারপর টিফিনের পয়সা দিয়ে সিগারেট
 কলেজ কেটে সিনেমা বান্ধবীর সাথে কাটলেট
 আসে দশটা পাঁচটা সেই একরুটের বাসটা তারপর
 সবার মতই পড়তে হয় যে কাগজের টোপর

এখন মাসের শেষে মাঝে মধ্যে কান্না পায়
 মিনিবাসে দাড়িয়ে অফিস যাবার সময়
 এখন বুঝেছি সেই অদ্ভুত সুরের কি মানে
 ফিরে তো যাওয়া যায় না যে আর সেখানে

যেতে হবে যে তোমাকে আমাকে চলে
 লুকোনো টেক্কা সংসারের এক্কা দোক্কা ফেলে
 প্রথমে যাবে ঘর-দোর দোকানপাট তারপর হৃদয়
 কিছুই হলো না বাজানো গেল না সময়

ইদানিং সে সুরটা শুনতে যে খুব ইচ্ছে হয়
 কিন্তু সেই খেলনাওয়ালা আর আসেনা পাড়ায়
 হয়তো কোন অন্য অলি-গলি ঘুরে
 অন্য কোন কাউকে টানছে সেই অদ্ভুত সুরে';'অঞ্জন দত্ত';'জীবনমুখী গান';'0'
'২৪৪১১৩৯';'চাকরিটা আমি পেয়ে গেছি বেলা শুনছো
 এখন আর কেউ আটকাতে পারবেনা
 সম্বন্ধটা এই বার তুমি ভেস্তে দিতে পারো
 মা-কে বলে দাও বিয়ে তুমি করছো না
 চাকরিটা আমি পেয়ে গেছি বেলা সত্যি
 আর মাত্র কয়েকটা মাস ব্যাস
 স্টার্টিংয়েই ওরা ১১০০ দেবে তিন মাস পরে কনফার্ম
 চুপ করে কেন বেলা কিছু বলছো না

এটা কি ২৪৪১১৩৯
 বেলা বোস তুমি পারছো কি শুনতে
 ১০-১২ বার রং নাম্বার পেরিয়ে তোমাকে পেয়েছি
 দেবো না কিছুতেই আর হারাতে
 হ্যালো ২৪৪১১৩৯
 দিন না দেকে বেলাকে একটিবার
 মিটারে যাচ্ছে বেড়ে পাবলিক টেলিফোনে
 জরু্রি খুব জরুরি দরকার

স্বপ্ন এবার হয়ে যাবে বেলা সত্যি
 এতোদিন ধরে এতো অপেক্ষা
 রাস্তার কতো সস্তা হোটেলে
 ব্যস্ত ক্যাবিনে বন্দী দুজনে
 রুদ্ধশ্বাস কতো প্রতীক্ষা
 আর কিছু দিন তারপর বেলা মুক্তি
 কসবার ঐ নীল দেয়ালের ঘর
 সাদা-কালো এই জঞ্জালে ভরা মিথ্যে কথার শহরে
 তোমার আমার নাল-নীল সংসার

চুপ করে কেন একি বেলা তুমি কাঁদছো
 চাকরিটা আমি পেয়ে গেছি সত্যি
 কান্নাকাটির হল্লাহাটির সময় গেছে পেরিয়ে
 হ্যালো তুমি শুনতে পাচ্ছো কি

এটা কি ২৪৪১১৩৯
 বেলা বোস তুমি পারছো কি শুনতে
 ১০-১২ বার রং নাম্বার পেরিয়ে তোমাকে পেয়েছি
 দেবো না কিছুতেই আর হারাতে
 হ্যালো ২৪৪১১৩৯
 দিন না দেকে বেলাকে একটিবার
 মিটারে যাচ্ছে বেড়ে পাবলিক টেলিফোনে
 জরু্রি খুব জরুরি দরকার

হ্যালো ২৪৪১১৩৯
 হ্যালো ধুর ছাই হ্যালো';'অঞ্জন দত্ত';'জীবনমুখী গান';'0'
'অন্তবিহীন পথ চলাই জীবন';'অন্তবিহীন পথ চলাই জীবন
 শুধু জীবনের কথা বলাই জীবন।
 জীবন প্রসব করে চলাই জীবন,
 শুধু যোগ বিয়োগের খেলাই জীবন।

শুধু সূর্যের পানে দেখাই জীবন,
 জীবনকে ভোগ করে একাই জীবন ।।
 একই কক্ষ্যপথে ঘোরাই জীবন,
 স্বপনের সমাধি খোড়াই জীবন,
 মনের গোপন ঘরে, যে শ্বাপদ ঘর করে,
 তাকেই লালন করে চলাই জীবন।

ফুটপাথে বেওয়ারিশ শিশুরা জীবন,
 রাম, ইসলাম আর যিশুরা জীবন ।।
 অষুধের বিষপান করাই জীবন,
 চিকিত্ সাহীন হয়ে মরাই জীবন।
 যে মেয়েটা রোজ রাতে, বদলায় হাতে হাতে,
 তার অভিশাপ নিয়ে চলাই জীবন।

প্রতিবাদ প্রতিরোধে নামাই জীবন,
 লক্ষ্যে পৌঁছে তবে থামাই জীবন ।।
 স্বপ্নের বেচা কেনা করাই জীবন,
 দেয়ালে ঠেকলে পিঠ লড়া ই জীবন,
 প্রতিদিন ঘরে ফিরে, অনেক হিসেব করে,
 ‘এ জীবন চাই না’, তা বলাই জীবন।';'নচিকেতা';'এই বেশ ভাল আছি';'0'
'একলা চলতে হয়';'যদি তোর ডাক শুনে কেউ না আসে,
 তবেই নাকি একলা চলতে হয়!

একলা মানুষ মাতৃগর্ভে একলা মানুষ চিতায়
 একলা পুরুষ কর্তব্যে একলা পুরুষ পিতায়
 আর মধ্যিখানের বাকিটা সময়
 একলা না থাকার অভিনয়

যদি তোর ডাক শুনে কেউ না আসে,
 তবেই নাকি একলা চলতে হয়!

এক পায়েতে দাড়িয়ে তাল গাছটাও একা
 দিনের শেষে ঘুমের দেশে একলা সে দেশ দেখা
 যদি কেউ কথা না কয়
 ওরে ও রে ও অভাগা কেউ কথা না কয়
 তাতেও কিছু যায় না এসে,
 তাতেও কিছু যায় না এসে বোঝে যদি তোর মনেরই কথা
 মনের কথা বোঝাবারে একলা বলতে হয়

যদি তোর ডাক শুনে কেউ না আসে,
 তবেই নাকি একলা চলতে হয়!

একলা তুমি ভাবাদর্শে একলা চিন্তায়
 তোমার ভাবনা সূর্য হয়ে ডুববে যে সন্ধ্যায়
 যদি সবাই ফিরে যায়
 ওরে ও রে ও অভাগা সবাই ফিরে যায়
 ফিরবে না যে জানবি সে তোর,
 ফিরবে না যে জানবি সে তোর ভাবনার মোড়কে আছে ডুবে
 ছিড়বে মোড়ক ফিরবে সে তার অপনও কুলায়

যদি তোর ডাক শুনে কেউ না আসে,
 তবেই নাকি একলা চলতে হয়!

একলা মানুষ মাতৃগর্ভে একলা মানুষ চিতায়
 একলা পুরুষ কর্তব্যে একলা পুরুষ পিতায়
 আর মধ্যিখানের বাকিটা সময়
 একলা না থাকার অভিনয়

যদি তোর ডাক শুনে কেউ না আসে,
 তবেই নাকি একলা চলতে হয়!';'নচিকেতা';'একলা চলতে হয়';'0'
'ফাইসা গেছি';'আমি ফাইসা গেছি, আমি ফাইসা গেছি,
 আমি ফাইসা গেছি, মাইনকার চিপায়।

আমারও দিলের চোট বোঝে না কোনো হালায়।।

কোন্‌ পাগলে পাইছিল করছি শখের শাদী
 ক্ষমতার যিমুন তিমুন, ভাবে শাহজাদী।

সকাল-বিকাল, রাইত-দুপুর বউয়ে দেয় ঠেলা
 কয় ‘বউ পুষার মুরাদ নয়, তয় বিয়া করছস কেলা।

আমি ইধারকা মাল ওধার করি, সারাদিন পেজকি মারি
 দিনের বেলায় আরতদারী, রাইতে চোরাকারবাড়ি।
 দিন-দুনিয়া সবই গেল, জীবন ভেস্তে যায়।।

মাইয়া আমার চিজ একখান, যেমুন ফিল্মের নায়িকা
 মাধুরী, ঐশ্বরিয়া, কাজলরে, কয় অফ যা।

পোলায় আমার শিক্ষিত, পড়ে দশ কেলাশের উপরে।
 হাত খরচা না দিলে, ইংলিশে গাইল পাড়ে।

মনে মনে কই আমি, গাইলের আর হুনছস কি
 আমগো গাইল হুনলে পড়ে, খাড়াইব মুরদাবি।

আমি হালায় কলুর বলদ ফাইটা জীবন যায়।।';'হায়দার হোসেন';'ফাইসা গেছি';'0'
'মানুষ মানুষের জন্য';'মানুষ মানুষের জন্য
 জীবন জীবনের জন্য
 একটু সহানুভূতি কি মানুষ পেতে পারে না
 ও বন্ধু….

মানুষ মানুষকে পণ্য করে
 মানুষ মানুষকে জীবিকা করে
 পুরনো ইতিহাস ফিরে এলে লজ্জা কি তুমি পাবে না?
 ও বন্ধু………..

বল কি তোমার ক্ষতি
 জীবনের অথৈ নদী
 পার হয় তোমাকে ধরে দূর্বল মানুষ যদি
 মানুষ যদি সে না হয় মানুষ
 দানব কখনো হয় না মানুষ
 যদি দানব কখনো বা হয় মানুষ লজ্জা কি তুমি পাবে না?
 ও বন্ধু……….';'ভূপেন হাজারিকা';'ভুপেন হাজারিকা';'0'
