'মাগো ধন্য হল জীবন আমার তোমায় ভালবেসে';'মাগো ধন্য হল জীবন আমার তোমায় ভালবেসে
 রূপের যে তার নেইকো শেষ, বাংলাদেশ।.

‘জয় বাংলা’ বলতে মনরে আমার এখনো কেন ভাবো,
 আমার হারানো বাংলাকে আবার তো ফিরে পাবো,
 অন্ধকারে পুবাকাশে উঠবে আবার দিনমণি।।

শোনো, একটি মুজিবরের থেকে
 লক্ষ মুজিবরের কন্ঠস্বরের ধ্বনি, প্রতিধ্বনি
 আকাশে বাতাসে ওঠে রণি।
 বাংলাদেশ আমার বাংলাদেশ।।';'অংশুমান রায়';'অংশুমান রায়';'0'
'রক্ত দিয়ে নাম লিখেছি';'রক্ত দিয়ে নাম লিখেছি বাংলাদেশের নাম ।।
 মুক্তি ছাড়া তুচ্ছ মোদের ।।
 এই জীবনের দাম।।
 রক্ত দিয়ে নাম লিখেছি বাংলাদেশের নাম ।।

সংকটে আর সংঘাতে,
 আমরা চলি সব একসাথে।।
 জীবন মরণ পন করে সব
 লড়ছি অবিরাম।।
 বাংলাদেশের নাম
 রক্ত দিয়ে নাম লিখেছি বাংলাদেশের নাম ।।

রক্ত যখন দিয়েছি আরও রক্ত দেব,
 রক্তের প্রতিশোধ মোরা নেবই নেব,
 ঘরে ঘরে আজ দূর্গ গড়েছি বাংলার সন্তান,
 সইবনা মোরা, সইবনা আর জীবনের অপমান।।

জীবন জয়ের গৌরবে,
 নতুন দিনের সৌরভে ।।
 মুক্ত স্বাধীন জীবন গড়া
 মোদের মনস্কাম ।।
 বাংলাদেশের নাম
 রক্ত দিয়ে নাম লিখেছি বাংলাদেশের নাম ।।';'সমবেত কন্ঠে';'স্বাধীন বাংলা বেতার কেন্দ্রের গান';'0'
'ভয় কি মরণে রাখিতে সন্তানে';'ভয় কি মরণে রাখিতে সন্তানে
 মাতঙ্গী মেতেছে আজ সমর রঙ্গে

তা থৈ তা থৈ থৈ দিমি দিমি দ্রম দ্রম ।।
 ভূত পিশাচ নাচে যোগিনী সঙ্গে ।।
 ভয় কি মরণে রাখিতে সন্তানে
 মাতঙ্গী মেতেছে আজ সমর রঙ্গে।।

দানব দলনী হয়ে উন্মাদিনী
 আর কি দানব থাকিবে বঙ্গে ।।
 সাজ রে সন্তান হিন্দু-মুসলমান
 থাকে থাকিবে প্রাণ, না হয় যাইবে প্রাণ ।।
 ভয় কি মরণে রাখিতে সন্তানে
 মাতঙ্গী মেতেছে আজ সমর রঙ্গে

লইয়ে বিপদ হওরে আগোয়ান
 নিতে হয় মুকুন্দেরে নিও রে সঙ্গে।।
 ভয় কি মরণে রাখিতে সন্তানে
 মাতঙ্গী মেতেছে আজ সমর রঙ্গে';'সমবেত কন্ঠে';'স্বাধীন বাংলা বেতার কেন্দ্রের গান';'0'
'বিচারপতি তোমার বিচার করবে যারা';'বিচারপতি তোমার বিচার করবে যারা
 আজ জেগেছে এই জনতা, এই জনতা।।
 তোমার গুলির, তোমার ফাঁসির,
 তোমার কারাগারের পেষণ শুধবে তারা
 ও জনতা এই জনতা এই জনতা।।

তোমার সভায় আমীর যারা,
 ফাঁসির কাঠে ঝুলবে তারা।।
 তোমার রাজা মহারাজা,
 করজোরে মাগবে বিচার।।
 ঠিক যেন তা এই জনতা।

তারা নতুন প্রাতে প্রাণ পেয়েছে, প্রাণ পেয়েছে।
 তারা ক্ষুদিরামের রক্তে ভিজে প্রাণ পেয়েছে।।
 তারা জালিয়ানের রক্তস্নানে প্রাণ পেয়েছে।।
 তারা ফাঁসির কাঠে জীবন দিয়ে
 প্রাণ পেয়েছে, প্রাণ পেয়েছে।।
 গুলির ঘায়ে কলজে ছিঁড়ে প্রাণ পেয়েছে,
 প্রাণ পেয়েছে এই জনতা।

নিঃস্ব যারা সর্বহারা তোমার বিচারে।
 সেই নিপীড়িত জনগণের পায়ের ধারে।।
 ক্ষমা তোমায় চাইতে হবে
 নামিয়ে মাথা হে বিধাতা।।
 রক্ত দিয়ে শুধতে হবে।
 নামিয়ে মাথা হে বিধাতা।।
 ঠিক যেন তা এই জনতা।
 বিচারপতি তোমার বিচার করবে যারা
 আজ জেগেছে এই জনতা, এই জনতা।।';'সমবেত কন্ঠে';'স্বাধীন বাংলা বেতার কেন্দ্রের গান';'0'
'পূর্ব দিগন্তে সূর্য উঠেছে';'পূর্ব দিগন্তে সূর্য উঠেছে
 রক্ত লাল, রক্ত লাল, রক্ত লাল
 জোয়ার এসেছে জন-সমুদ্রে
 রক্ত লাল, রক্ত লাল, রক্ত লাল।।
 বাঁধন ছেঁড়ার হয়েছে কাল,
 হয়েছে কাল, হয়েছে কাল।।

শোষণের দিন শেষ হয়ে আসে
 অত্যাচারীরা কাঁপে আজ ত্রাসে ।।
 রক্তে আগুন প্রতিরোধ গড়ে
 নয়া বাংলার নয়া সকাল,নয়া সকাল।

আর দেরি নয় উড়াও নিশান
 রক্তে বাজুক প্রলয় বিষাণ
 বিদ্যুৎ গতি হউক অভিযান
 ছিঁড়ে ফেলো সব শত্রু জাল, শত্রু জাল।';'সমবেত কন্ঠে';'স্বাধীন বাংলা বেতার কেন্দ্রের গান';'0'
'জয় বাংলা বাংলার জয়';'জয় বাংলা বাংলার জয়
 জয় বাংলা বাংলার জয়।।
 হবে হবে হবে, হবে নিশ্চয়
 কোটি প্রাণ এক সাথে জেগেছে অন্ধরাতে
 নতুন সূর্য ওঠার এই তো সময়।।
 জয় বাংলা বাংলার জয়
 জয় বাংলা বাংলার জয়।।

বাংলার প্রতি ঘর ভরে দিতে চাই মোরা অন্নে।।
 আমাদের রক্ত টগবগ দুলছে মুক্তির দীপ্ত তারুণ্যে।।

নেই ― ভয়
 জয় হউক রক্তের প্রচ্ছদ পট।
 তবু করি না করি না করি না ভয়।
 জয় বাংলা বাংলার জয়
 জয় বাংলা বাংলার জয়।।

অশোকের ছায় যেন রাখালের বাঁশরী হয়ে গেছে একেবারে স্তব্ধ।।
 চারিদিকে শুনি আজ নিদারুণ হাহাকার আর ঐ কান্নার শব্দ।।

শাসনের নামে চলে শোষণের সুকঠিন যন্ত্র।।
 বজ্রের হুঙ্কারে শৃঙ্খল ভাঙতে সংগ্রামী জনতা অতন্দ্র।

আর ― নয়।
 তিলেতিলে বাংগালীর এই পরাজয়।।
 আর করি না করি না করি না ভয়।
 জয় বাংলা বাংলার জয়।।

ক্ষুধা আর বেকারের মিছিলটা যেন ঐ দিন দিন শুধু বেড়ে যাচ্ছে
 রোদে পুড়ে জলে ভিজে অসহায় হয়ে আজ ফুটপাতে তারা তাই কাঁদছে ।।
 বার বার ঘুঘু এসে খেয়ে যেতে দেবো নাতো আর ধান,
 বাংলার দুশমন তোষামদি চাটুকার সাবধান, সাবধান, সাবধান ।।

এই দি—ন ।
 সৃষ্টির উল্লাসে হবে রংগীন ।।
 আর মানি না মানি না কোন সংশয়
 জয় বাংলা বাংলার জয়।।
 হবে হবে হবে, হবে নিশ্চয়
 কোটি প্রাণ এক সাথে জেগেছে অন্ধরাতে
 নতুন সূর্য ওঠার এই তো সময়।।
 জয় বাংলা বাংলার জয়
 জয় বাংলা বাংলার জয়।।';'সমবেত কন্ঠে';'স্বাধীন বাংলা বেতার কেন্দ্রের গান';'0'
'আমার এ দেশ সব মানুষের';'আমার এ দেশ সব মানুষের, সব মানুষের।।
 চাষাদের, মুটেদের, মজুরের ।।
 গরিবের নিঃস্বের ফকিরের
 আমার এ দেশ সব মানুষের, সব মানুষের।।

নেই ভেদাভেদ হেথা চাষা আর চামারে,
 নেই ভেদাভেদ হেথা কুলি আর কামারে।।
 হিন্দু, মুসলিম, বৌদ্ধ, খ্রিস্টান ।।
 দেশ মাতা এক সকলের।

লাঙলের সাথে আজ চাকা ঘোরে এক তালে
 এক হয়ে মিশে গেছি আমারা সে যে কোন কালে।।
 মন্দির, মসজিদ, গীর্জার আবাহনে।।
 বাণী শুনি একই সুরের।

ছোটদের বড়দের সকলের…।।
 গরিবের নিঃস্বের ফকিরের
 আমার এ দেশ সব মানুষের, সব মানুষের।।
 সব মানুষের, সব মানুষের।
 সব মানুষের,
 সব মানুষের।

চাষাদের, মুটেদের, মজুরের ।।
 গরিবের নিঃস্বের ফকিরের
 আমার এ দেশ সব মানুষের, সব মানুষের।।
 সব মানুষের, সব মানুষের।';'রথীন্দ্র নাথ রায়';'স্বাধীন বাংলা বেতার কেন্দ্রের গান';'0'
'ও ভাই খাঁটি সোনার চেয়ে খাঁটি';'ও ভাই খাঁটি সোনার চেয়ে খাঁটি
 আমার দেশের মাটি।।

এই দেশেরই কাদা জলে,
 এই দেশেরই ফুলে-ফলে ।।
 তৃষ্ণা মিটাই, মিটাই ক্ষুধা ।।
 পিয়ে এরই দুধের বাটি।।

ও ভাই খাঁটি সোনার চেয়ে খাঁটি
 আমার দেশের মাটি।।

এই মাটি এই কাদা মেখে,
 এই দেশেরই আচার দেখে,
 সভ্য হলো নিখিল ভুবন, দিব্য পরিপাটি।।

এই দেশেরই ধুলায় পড়ি
 মানিক যায়রে গড়াগড়ি ।।
 বিশ্বে সবার ঘুম ভাঙা ।।
 এই দেশেরই জীয়ন কাঠি।।

ও ভাই খাঁটি সোনার চেয়ে খাঁটি
 আমার দেশের মাটি।।';'রথীন্দ্র নাথ রায়';'কাজী নজরুল ইসলাম';'0'
'একটি বাংলাদেশ তুমি জাগ্রত জনতার';'একটি বাংলাদেশ তুমি জাগ্রত জনতার
 সারা বিশ্বের বিস্ময় তুমি আমার অহংকার।

তোমার স্বাধীনতা গৌরব সৌরভে
 এনেছে আমার প্রানের সূর্যে রৌদ্রেরও সজীবতা
 দিয়েছে সোনালী সুখী জীবনের দৃপ্ত অঙ্গীকার।

সারা বিশ্বের বিস্ময় তুমি আমার অহংকার।

তোমার ছায়া ঢাকা রৌদ্রেরেরও প্রান্তরে
 রেখেছি অতল অমর বর্নে মুক্তির স্নেহ মাখা
 জেনেছি তুমি জীবন মরণে বিমুগ্ধ চেতনার।

সারা বিশ্বের বিস্ময় তুমি আমার অহংকার।স';'সাবিনা ইয়াসমিন';'অজিত রায়';'0'
'সেই রেল লাইনের ধারে মেঠো পথটার পাড়ে দাড়িয়ে';'সেই রেল লাইনের ধারে মেঠো পথটার পাড়ে দাড়িয়ে
 এক মধ্যবয়সী নারী এখনো রয়েছে হাত বাড়িয়ে
 খোকা ফিরবে,ঘরে ফিরবে
 কবে ফিরবে,নাকি ফিরবে না ।

দৃষ্টি থেকে তার বৃষ্টি গেছে কবে শুকিয়ে
 সে তো অশ্রু মুছেনা আর গোপনে আঁচলে মুখ লুকিয়ে
 শুধু শূণ্যে চেয়ে থাকে যেন আকাশের সীমা ছাড়িয়ে
 খোকা ফিরবে,ঘরে ফিরবে
 কবে ফিরবে,নাকি ফিরবে না ।

দস্যি ছেলে সেই যুদ্ধে গেল ফিরলো না আর
 আজো শূণ্য হৃদয়ে তার গুমড়ে গুমড়ে যায় হাহাকার
 খোকা আসবে,ঘরে আসবে যেন মরণের সীমা ছাড়িয়ে
 খোকা ফিরবে,ঘরে ফিরবে
 কবে ফিরবে,নাকি ফিরবে না ।';'সাবিনা ইয়াসমিন';'দেশাত্মবোধক গান';'0'
'সুন্দর সুবর্ণ তারুন্য লাবন্য';'সুন্দর সুবর্ণ তারুন্য লাবন্য
 অপূর্ব রূপসী রূপেতে অনন্য।

আমার দু’চোখ ভরা স্বপ্ন
 ও দেশ তোমারই জন্য।।

থাকবে নাতো দুঃখ দারিদ্র
 বিভেদ-বেদনা-ক্রন্দন।।

প্রতিটি ঘরে একই প্রশান্তি
 একই সুখের স্পন্দন।।

তোমার জন্য হবো দুরন্ত
 তোমার জন্য শান্ত
 প্রহরী হয়ে দেব পাহারা
 যেথায় তোমার সীমান্ত।।';'সাবিনা ইয়াসমিন';'আহমেদ ইমতিয়াজ বুলবুল';'0'
'আমার সোনার বাংলা আমি তোমায় ভালবাসি';'আমার সোনার বাংলা
 আমি তোমায় ভালবাসি

চিরদিন তোমার আকাশ ।।
 তোমার বাতাস
 আমার প্রানে
 ওমা আমার প্রানে বাজায় বাঁশী

ওমা ফাগুনে তোর আমার বনে ঘ্রানে পাগল করে
 মরি হায়
 হায় রে ওমা
 ফাগুনে তোর আমার বনে ঘ্রানে পাগল করে ।
 ওমা অগ্রানে তোর ভরা খেতে
 কি দেখেছি
 আমি কি দেখেছি মধুর হাসি
 সোনার বাংলা
 আমি তোমায় ভালবভাসি

কি শোভা কি ছায়া গো
 কি স্নেহ কি মায়া গো
 কি আঁচল বিছায়েছ বটের মুলে
 নদীর কূলে কূলে 

মা তোর মুখের বানী
 আমার কানে লাগে সুধার মতো
 মরি হায় , হায় রে মা তোর
 মুখের বানী
 আমার কানে লাগে সুধার মতো 

মা তোর বদন খানি মলিন হলে
 আমি নয়ন
 ওমা আমি নয়ন জ্বলে ভাসি 

সোনার বাংলা আমি তোমায় ভালবাসি ।';'ছায়ানটের শিল্পী বৃন্দ';'জাতীয় সংগীত';'0'
'সূর্যদয়ে তুমি, সূর্যাস্তেও তুমি';'সূর্যদয়ে তুমি, সূর্যাস্তেও তুমি
 ও আমার বাংলাদেশ, প্রিয় জন্মভূমি।।

জলসিঁড়ি নদীর তীরে,
 তোর খুশির কাঁকন যেন বাজে
 ও—কাশবনে ফুলে ফুলে,
 তোর মধুর বাসর যেন সাজে
 তোর একতারা হায়,
 করে বাউল আমায় সুরে সুরে।।

আঁকাবাঁকা মেঠো পথে
 তোর রাখাল হৃদয় যেন হাসে
 ও—পদ্ম পাতা, দীঘির ঝিলে
 তোর সোনার স্বপন যেন ভাসে
 তোর এই আঙিনায়
 ধরে রাখিস আমায় চিরতরে।।';'সৈয়দ আব্দুল হাদী';'মনিরুজ্জামান মনির';'0'
'সালাম সালাম হাজার সালাম';'সালাম সালাম হাজার সালাম
 সকল শহীদ স্মরণে,
 আমার হৃদয় রেখে যেতে চাই
 তাদের স্মৃতির চরণে।।

মায়ের ভাষায় কথা বলাতে
 স্বাধীন আশায় পথ চলাতে
 হাসিমুখে যারা দিয়ে গেল প্রাণ
 সেই স্মৃতি নিয়ে গেয়ে যাই গান
 তাদের বিজয় মরণে,
 আমার হৃদয় রেখে যেতে চাই
 তাদের স্মৃতির চরণে।।

ভাইয়ের বুকের রক্তে আজিকে
 রক্ত মশাল জ্বলে দিকে দিকে
 সংগ্রামী আজ মহাজনতা
 কন্ঠে তাদের নব বারতা
 শহীদ ভাইয়ের স্মরণে,
 আমার হৃদয় রেখে যেতে চাই
 তাদের স্মৃতির চরণে।।

বাংলাদেশের লাখো বাঙালি
 জয়ের নেশায় আনে ফুলের ডালি
 আলোর দেয়ালি ঘরে ঘরে জ্বালি
 ঘুচিয়ে মনের আঁধার কালি।
 শহীদ স্মৃতি বরণে,
 আমার হৃদয় রেখে যেতে চাই
 তাদের স্মৃতির চরণে।।';'মোঃ আব্দুল জব্বার';'মোহাম্মদ আবদুল জব্বার';'0'
'সবকটা জানালা খুলে দাওনা';'সবকটা জানালা খুলে দাওনা
 আমি গাইব গাইব বিজয়েরই গান
 ওরা আসবে চুপি চুপি যারা এই দেশটাকে
 ভালোবেসে দিয়ে গেছে প্রাণ।।

চোখ থেকে মুছে ফেল অশ্রুটুকু
 এমন খুশির দিনে কাঁদতে নেই
 হারানো স্মৃতি বেদনাতে
 একাকার করে মন ডাক দিলে
 ওরা আসবে চুপি চুপি যারা এই দেশটাকে
 কেউ যেন ভুল করে গেয়নাক
 মন ভাঙা গান।।

আজ আমি সারানিশি থাকব জেগে
 ঘরের আলো সব আঁধার করে।
 তৈরি রাখব আতর গোলাপ
 এদেশের প্রতিটি ঘরে ঘরে
 ওরা আসবে চুপি চুপি যারা এই দেশটাকে
 কেউ যেন ভুল করে গেয়নাক
 মন ভাঙা গান।।';'সাবিনা ইয়াসমিন';'আহমেদ ইমতিয়াজ বুলবুল';'0'
'মোরা একটি ফুলকে বাঁচাবো বলে যুদ্ধ করি';'মোরা একটি ফুলকে বাঁচাবো বলে যুদ্ধ করি
 মোরা একটি মুখের হাসির জন্য অস্ত্র ধরি।।

যে মাটির চির মমতা আমার অঙ্গে মাখা
 যার নদী জল ফুলে ফুলে মোর স্বপ্ন আঁকা।
 যে দেশের নীল অম্বরে মন মেলছে পাখা
 সারাটি জনম সে মাটির টানে অস্ত্র ধরি।।

মোরা নতুন একটি কবিতা লিখতে যুদ্ধ করি―
 মোরা নতুন একটি গানের জন্য যুদ্ধ করি
 মোরা একখানা ভালো ছবির জন্য যুদ্ধ করি
 মোরা সারা বিশ্বের শান্তি বাঁচাতে আজকে লড়ি।।

যে নারীর মধু প্রেমেতে আমার রক্ত দোলে
 যে শিশুর মায়া হাসিতে আমার বিশ্ব ভোলে
 যে গৃহ কপোত সুখ স্বর্গের দুয়ার খোলে
 সেই শান্তির শিবির বাঁচাতে শপথ করি।।

মোরা একটি ফুলকে বাঁচাবো বলে যুদ্ধ করি
 মোরা একটি মুখের হাসির জন্য অস্ত্র ধরি।।';'আপেল মাহমুদ';'গোবিন্দ হালদার';'0'
'মুক্তির মন্দির সোপানতলে';'মুক্তির মন্দির সোপানতলে
 কত প্রাণ হল বলিদান,
 লেখা আছে অশ্রুজলে ।।

কত বিপ্লবী বন্ধুর রক্তে রাঙা,
 বন্দীশালার ওই শিকল ভাঙ্গা
 তাঁরা কি ফিরিবে আজ সু-প্রভাতে,
 যত তরুণ অরুণ গেছে অস্তাচলে।।

যাঁরা স্বর্গগত তাঁরা এখনও জানেন
 স্বর্গের চেয়ে প্রিয় জন্মভুমি
 এসো স্বদেশ ব্রতের মহা দীক্ষা লভি
 সেই মৃত্যুঞ্জয়ীদের চরণ চুমি।

যাঁরা জীর্ণ জাতির বুকে জাগালো আশা,
 মৌন মলিন মুখে জোগালো ভাষা
 আজি রক্ত কমলে গাঁথা মাল্যখানি
 বিজয় লক্ষ্মী দেবে তাঁদেরই গলে।';'সাদী মোহাম্মদ';'সমর দাস';'0'
