'কুসুমে কুসুমে চরণ চিহ্ন দিয়ে যাও';'কুসুমে কুসুমে চরণ চিহ্ন';'কাদেরী কিবরিয়া';'রবীন্দ্র নাথ ঠাকুর';'0'
 বলে সে, ‘যা ই যা ই যাই গো।।';'স্বাগতা লক্ষী দাশগুপ্ত';'রবীন্দ্রনাথ ঠাকুর';'0'
'শ্রাবণের ধারার মতো পড়ুক ঝরে';'শ্রাবণের ধারার মতো পড়ুক ঝরে, পড়ুক ঝরে

তোমারি সুরটি আমার মুখের ‘পরে, বুকের ‘পরে।।

পুরবের আলোর সাথে পড়ুক প্রাতে দুই নয়ানে–

নিশীথের অন্ধকারে গভীর ধারে পড়ুক প্রাণে।

নিশিদিন এই জীবনের সুখের ‘পরে দুখের ‘পরে

শ্রাবণের ধারার মতো পড়ুক ঝরে, পড়ুক ঝরে।

যে শাখায় ফুল ফোটে না, ফল ধরে না একেবারে,

তোমার ওই বাদল-বায়ে দিক জাগায়ে সেই শাখারে।

যা-কিছু জীর্ণ আমার, দীর্ণ আমার, জীবনহারা,

তাহারি স্তরে স্তরে পড়ুক ঝরে সুরের ধারা।

নিশিদিন এই জীবনের তৃষার ‘পরে, ভুখের ‘পরে

শ্রাবণের ধারার মতো পড়ুক ঝরে, পড়ুক ঝরে।।';'অরুন্ধতী হোম চৌধুরী';'রবীন্দ্রনাথ ঠাকুর';'0'
'মেঘের কোলে রোদ হেসেছে,';'মেঘের কোলে রোদ হেসেছে,
 বাদল গেছে টুটি। আহা, হাহা, হা।
 আজ আমাদের ছুটি ও ভাই,
 আজ আমাদের ছুটি। আহা, হাহা, হা ॥

কী করি আজ ভেবে না পাই,
 পথ হারিয়ে কোন্‌ বনে যাই,
 কোন্‌ মাঠে যে ছুটে বেড়াই সকল ছেলে জুটি।
 আহা, হাহা, হা ॥

কেয়া-পাতার নৌকো গড়ে সাজিয়ে দেব ফুলে–
 তালদিঘিতে ভাসিয়ে দেব, চলবে দুলে দুলে।
 রাখাল ছেলের সঙ্গে ধেনু চরাব আজ বাজিয়ে বেণু,
 মাখব গায়ে ফুলের রেণু চাঁপার বনে লুটি।
 আহা, হাহা, হা ॥';'ঈশিতা গাংগুলী';'কবি গুরু রবীন্দ্রনাথ ঠাকুর';'0'
'কখন দিলে পরায়ে স্বপনে বরণমালা';'কখন দিলে পরায়ে স্বপনে বরণমালা,

ব্যথার মালা ॥

প্রভাতে দেখি জেগে অরুণ মেঘে

বিদায়বাঁশরি বাজে অশ্রু-গালা

গোপনে এসে গেলে, দেখি নাই আঁখি মেলে

আঁধারে দুঃখডোরে বাঁধিলে মোরে,

ভূষণ পরালে বিরহবেদন-ঢালা।';'সুপ্রতীক দাস';'কবি গুরু রবীন্দ্রনাথ ঠাকুর';'0'
'যে রাতে মোর দুয়ারগুলি ভাঙল ঝড়ে';'যে রাতে মোর দুয়ারগুলি ভাঙল ঝড়ে

জানি নাই তো তুমি এলে আমার ঘরে ॥

সব যে হয়ে গেল কালো, নিবে গেল দীপের আলো,

আকাশ-পানে হাত বাড়ালেম কাহার তরে?।

অন্ধকারে রইনু পড়ে স্বপন মানি।

ঝড় যে তোমার জয়ধ্বজা তাই কি জানি!

সকালবেলা চেয়ে দেখি, দাঁড়িয়ে আছ তুমি এ কি,

ঘর-ভরা মোর শূন্যতারই বুকের ‘পরে ॥';'ইন্দ্রানী সেন';'কবি গুরু রবীন্দ্রনাথ ঠাকুর';'0'
'এই উদাসী হাওয়ার পথে পথে মুকুলগুলি ঝরে;';'এই উদাসী হাওয়ার পথে পথে মুকুলগুলি ঝরে;

আমি কুড়িয়ে নিয়েছি, তোমার চরণে দিয়েছি–

লহো লহো করুণ করে॥

যখন যাব চলে ওরা ফুটবে তোমার কোলে,

তোমার মালা গাঁথার আঙুলগুলি মধুর বেদনভরে

যেন আমায় স্মরণ করে॥

বউকথাকও তন্দ্রাহারা বিফল ব্যথায় ডাক দিয়ে হয় সারা

আজি বিভোর রাতে।

দুজনের কানাকানি কথা দুজনের মিলনবিহ্বলতা,

জ্যোৎস্নাধারায় যায় ভেসে যায় দোলের পূর্ণিমাতে।

এই আভাসগুলি পড়বে মালায় গাঁথা কালকে দিনের তরে

তোমার অলস দ্বিপ্রহরে॥';'শ্রাবণী সেন';'কবি গুরু রবীন্দ্রনাথ ঠাকুর';'0'
'তোমরা যা বলো তাই বলো,';'তোমরা যা বলো তাই বলো, আমার লাগে না মনে।

আমার যায় বেলা, বয়ে যায় বেলা কেমন বিনা কারণে॥

এই পাগল হাওয়া কী গান-গাওয়া

ছড়িয়ে দিয়ে গেল আজি সুনীল গগনে॥

সে গান আমার লাগল যে গো লাগল মনে,

আমি কিসের মধু খুঁজে বেড়াই ভ্রমরগুঞ্জনে।

ওই আকাশ-ছাওয়া কাহার চাওয়া

এমন ক’রে লাগে আজি আমার নয়নে॥';'লোপামুদ্রা মিত্র';'কবি গুরু রবীন্দ্রনাথ ঠাকুর';'0'
'গভীর রজনী নামিল হৃদয়ে';'গভীর রজনী নামিল হৃদয়ে, আর কোলাহল নাই।
 রহি রহি শুধু সুদূর সিন্ধুর ধ্বনি শুনিবারে পাই ॥

সকল বাসনা চিত্তে এল ফিরে, নিবিড় আঁধার ঘনালো বাহিরে–
 প্রদীপ একটি নিভৃত অন্তরে জ্বলিতেছে এক ঠাঁই ॥

অসীম মঙ্গলে মিলিল মাধুরী, খেলা হল সমাধান।
 চপল চঞ্চল লহরীলীলা পারাবারে অবসান।
 নীরব মন্ত্রে হৃদয়মাঝে শান্তি শান্তি শান্তি বাজে,
 অরূপকান্তি নিরখি অন্তরে মুদিতলোচনে চাই ॥';'শ্রীকান্ত আচার্য্য';'কবি গুরু রবীন্দ্রনাথ ঠাকুর';'0'
'ফাগুন, হাওয়ায় হাওয়ায় করেছি যে দান';'ফাগুন, হাওয়ায় হাওয়ায় করেছি যে দান–
 তোমার হাওয়ায় হাওয়ায় করেছি যে দান–
 আমার আপনহারা প্রাণ আমার বাঁধন-ছেড়া প্রাণ॥

তোমার অশোকে কিংশুকে
 অলক্ষ্য রঙ লাগল আমার অকারণের সুখে,
 তোমার ঝাউয়ের দোলে
 মর্মরিয়া ওঠে আমার দুঃখরাতের গান॥

পূর্ণিমাসন্ধ্যায় তোমার রজনীগন্ধায়
 রূপসাগরের পারের পানে উদাসী মন ধায়।
 তোমার প্রজাপতির পাখা
 আমার আকাশ-চাওয়া মুগ্ধ চোখের রঙিন-স্বপন-মাখা।
 তোমার চাঁদের আলোয়
 মিলায় আমার দুঃখসুখের সকল অবসান॥';'জয়তি চক্রবর্তী';'কবি গুরু রবীন্দ্রনাথ ঠাকুর';'0'
'সার্থক জনম আমার জন্মেছি এই দেশে।';'সার্থক জনম আমার জন্মেছি এই দেশে।

সার্থক জনম, মা গো, তোমায় ভালোবেসে ॥

জানি নে তোর ধনরতন আছে কি না রানীর মতন,

শুধু জানি আমার অঙ্গ জুড়ায় তোমার ছায়ায় এসে ॥

কোন্‌ বনেতে জানি নে ফুল গন্ধে এমন করে আকুল,

কোন্‌ গগনে ওঠে রে চাঁদ এমন হাসি হেসে।

আঁখি মেলে তোমার আলো প্রথম আমার চোখ জুড়ালো,

ওই আলোতেই নয়ন রেখে মুদব নয়ন শেষে ॥';'শ্রীকান্ত আচার্য্য';'কবি গুরু রবীন্দ্রনাথ ঠাকুর';'0'
'চরণ ধরিতে দিয়ো গো আমারে';'চরণ ধরিতে দিয়ো গো আমারে, নিয়ো না, নিয়ো না সরায়ে

জীবন মরণ সুখ দুখ দিয়ে বক্ষে ধরিব জড়ায়ে।।

স্খলিত শিথিল কামনার ভার বহিয়া বহিয়া ফিরি কত আর

নিজ হাতে তুমি গেঁথে নিয়ো হার, ফেলো না আমারে ছড়ায়ে।।

চিরপিপাসিত বাসনা বেদনা বাঁচাও তাহারে মারিয়া।

শেষ জয়ে যেন হয় সে বিজয়ী তোমারি কাছেতে হারিয়া।

বিকায়ে বিকায়ে দীন আপনারে পারি না ফিরিতে দুয়ারে দুয়ারে

তোমারি করিয়া নিয়ো গো আমারে বরণের মালা পরায়ে।।';'কলিম শরাফী';'কবি গুরু রবীন্দ্রনাথ ঠাকুর';'0'
'ও যে মানে না মানা।';'ও যে মানে না মানা।

আঁখি ফিরাইলে বলে, ‘না, না, না।’

যত বলি ‘নাই রাতি– মলিন হয়েছে বাতি’

মুখপানে চেয়ে বলে, ‘না, না, না।’

বিধুর বিকল হয়ে খেপা পবনে

ফাগুন করিছে হাহা ফুলের বনে।

আমি যত বলি ‘তবে এবার যে যেতে হবে’

দুয়ারে দাঁড়ায়ে বলে, ‘না, না, না।’';'শ্রাবণী সেন';'কবি গুরু রবীন্দ্রনাথ ঠাকুর';'0'
'বিপদে মোরে রক্ষা করো এ নহে মোর প্রার্থনা';'বিপদে মোরে রক্ষা করো এ নহে মোর প্রার্থনা

বিপদে আমি না যেন করি ভয়।

দুঃখতাপে ব্যথিত চিতে নাই-বা দিলে সান্ত্বনা

দুঃখে যেন করিতে পারি জয়।।

সহায় মোর না যদি জুটে নিজের বল না যেন টুটে

সংসারেতে ঘটিলে ক্ষতি, লভিলে শুধু বঞ্চনা

নিজের মনে না যেন মানি ক্ষয়।

আমারে তুমি করিবে ত্রাণ এ নহে মোর প্রার্থনা

তরিতে পারি শকতি যেন রয়।

আমার ভার লাঘব করি নাই-বা দিলে সান্ত্বনা,

বহিতে পারি এমনি যেন হয়।

নম্রশিরে সুখের দিনে তোমারি মুখ লইব চিনে

দুখের রাতে নিখিল ধরা যেদিন করে বঞ্চনা

তোমারে যেন না করি সংশয়।';'স্বাগতা লক্ষী দাশগুপ্ত';'রবীন্দ্রনাথ ঠাকুর';'0'
'প্রাণ ভরিয়ে তৃষা হরিয়ে';'প্রাণ ভরিয়ে তৃষা হরিয়ে

মোরে আরো আরো আরো দাও প্রাণ।

তব ভুবনে তব ভবনে

মোরে আরো আরো আরো দাও স্থান।।

আরো আলো আরো আলো

এই নয়নে, প্রভু, ঢালো।

সুরে সুরে বাঁশি পুরে

তুমি আরো আরো আরো দাও তান।।

আরো বেদনা আরো বেদনা,

প্রভু, দাও মোরে আরো চেতনা।

দ্বার ছুটায়ে বাধা টুটায়ে

মোরে করো ত্রাণ মোরে করো ত্রাণ।

আরো প্রেমে আরো প্রেমে

মোর আমি ডুবে যাক নেমে।

সুধাধারে আপনারে

তুমি আরো আরো আরো করো দান।।';'দেবব্রত বিশ্বাস';'রবীন্দ্রনাথ ঠাকুর';'0'
'পাখি আমার নীড়ের পাখি অধীর হল কেন জানি';'পাখি আমার নীড়ের পাখি অধীর হল কেন জানি–

আকাশ-কোণে যায় শোনা কি ভোরের আলোর কানাকানি।।

ডাক উঠেছে মেঘে মেঘে অলস পাখা উঠল জেগে–

লাগল তারে উদাসী ওই নীল গগনের পরশখানি।।

আমার নীড়ের পাখি এবার উধাও হল আকাশ-মাঝে

যায় নি কারো সন্ধানে সে, যায় নি যে সে কোনো কাজে।

গানের ভরা উঠল ভরে, চায় দিতে তাই উজাড় করে–

নীরব গানের সাগর-মাঝে আপন প্রাণের সকল বাণী।।';'জয়তি চক্রবর্তী';'রবীন্দ্রনাথ ঠাকুর';'0'
'কিছু বলব ব’লে এসেছিলেম,';'কিছু বলব ব’লে এসেছিলেম,

রইনু চেয়ে না ব’লে॥

দেখিলাম খোলা বাতায়নে মালা গাঁথো আপন-মনে,

গাও গুন্‌-গুন্‌ গুঞ্জরিয়া যূথীকুঁড়ি নিয়ে কোলে॥

সারা আকাশ তোমার দিকে

চেয়ে ছিল অনিমিখে।

মেঘ-ছেঁড়া আলো এসে পড়েছিল কালো কেশে,

বাদল-মেঘে মৃদুল হাওয়ায় অলক দোলে॥';'কবির সুমন';'কবি গুরু রবীন্দ্রনাথ ঠাকুর';'0'
'ওরা অকারণে চঞ্চল।';'ওরা অকারণে চঞ্চল।

ডালে ডালে দোলে বায়ুহিল্লোলে নব পল্লবদল॥

ছড়ায়ে ছড়ায়ে ঝিকিমিকি আলো

দিকে দিকে ওরা কী খেলা খেলালো,

মর্মরতানে প্রাণে ওরা আনে কৈশোরকোলাহাল॥

ওরা কান পেতে শোনে গগনে গগনে

নীরবের কানাকানি,

নীলিমার কোন্‌ বাণী।

ওরা প্রাণঝরনার উচ্ছল ধার, ঝরিয়া ঝরিয়া বহে অনিবার,

চির তাপসিনী ধরণীর ওরা শ্যামশিখা হোমানল॥

চনাকাল (খৃষ্টাব্দ): মার্চ, ১৯৩১';'মিতা হক';'কবি গুরু রবীন্দ্রনাথ ঠাকুর';'0'
'আমি ভয় করব না ভয় করব না।';'আমি ভয় করব না ভয় করব না।

দু বেলা মরার আগে মরব না, ভাই, মরব না।।

তরীখানা বাইতে গেলে মাঝে মাঝে তুফান মেলে

তাই ব’লে হাল ছেড়ে দিয়ে ধরব না, কান্নাকাটি ধরব না।।

শক্ত যা তাই সাধতে হবে, মাথা তুলে রইব ভবে

সহজ পথে চলব ভেবে পড়ব না, পাঁকের ‘পরে পড়ব না।

ধর্ম আমার মাথায় রেখে চলব সিধে রাস্তা দেখে

বিপদ যদি এসে পড়ে সরব না, ঘরের কোণে সরব না।।';'স্বাগতা লক্ষী দাশগুপ্ত';'রবীন্দ্রনাথ ঠাকুর';'0'
'এবার তোর মরা গাঙে বান এসেছে';'এবার তোর মরা গাঙে বান এসেছে,
 ‘জয় মা’ ব’লে ভাসা তরী ॥
 ওরে রে ওরে মাঝি, কোথায় মাঝি,
 প্রাণপণে, ভাই, ডাক দে আজি
 তোরা সবাই মিলে বৈঠা নে রে,
 খুলে ফেল্‌ সব দড়াদড়ি ॥

দিনে দিনে বাড়ল দেনা,
 ও ভাই, করলি নে কেউ বেচা কেনা
 হাতে নাই রে কড়া কড়ি।
 ঘাটে বাঁধা দিন গেল রে,
 মুখ দেখাবি কেমন ক’রে

ওরে, দে খুলে দে, পাল তুলে দে,
 যা হয় হবে বাঁচি মরি ॥';'শ্রীকান্ত আচার্য্য';'কবি গুরু রবীন্দ্রনাথ ঠাকুর';'0'
'বাংলার মাটি বাংলার জল';'বাংলার মাটি, বাংলার জল
 বাংলার বায়ু, বাংলার ফল
 পুণ্য হউক, পুণ্য হউক
 পুণ্য হউক হে ভগবান।।

বাংলার ঘর, বাংলার হাট,
 বাংলার বন, বাংলার মাঠ–

পূর্ণ হউক, পূর্ণ হউক
 পূর্ণ হউক হে ভগবান।।

বাঙালির পণ, বাঙালির আশা
 বাঙালির কাজ, বাঙালির ভাষা

সত্য হউক, সত্য হউক
 সত্য হউক হে ভগবান।।

বাঙালির প্রাণ, বাঙালির মন
 বাঙালির ঘরে যত ভাই বোন

এক হউক, এক হউক
 এক হউক হে ভগবান।।';'স্বাগতা লক্ষী দাশগুপ্ত';'রবীন্দ্র নাথ ঠাকুর';'0'
'আমার মল্লিকাবনে যখন প্রথম ধরেছে কলি';'আমার মল্লিকাবনে যখন প্রথম ধরেছে কলি

তোমার লাগিয়া তখনি, বন্ধু, বেঁধেছিনু অঞ্জলি॥

তখনো কুহেলীজালে,

সখা, তরুণী উষার ভালে

শিশিরে শিশিরে অরুণমালিকা উঠিতেছে ছলোছলি॥

এখনো বনের গান, বন্ধু হয় নি তো অবসান–

তবু এখনি যাবে কি চলি।

ও মোর করুণ বল্লিকা,

ও তোর শ্রান্ত মল্লিকা

ঝরো-ঝরো হল, এই বেলা তোর শেষ কথা দিস বলি॥';'শ্রাবণী সেন';'কবি গুরু রবীন্দ্রনাথ ঠাকুর';'0'
'ন্যায় অন্যায় জানি নে, জানি নে, জানি নে,';'ন্যায় অন্যায় জানি নে, জানি নে, জানি নে,
 শুধু তোমারে জানি
 ওগো সুন্দরী।
 চাও কি প্রেমের চরম মূল্য– দেব আনি,
 দেব আনি ওগো সুন্দরী।
 প্রিয় যে তোমার, বাঁচাবে যারে,
 নেবে মোর প্রাণঋণ–
 তাহারি সঙ্গে তোমারি বক্ষে
 বাঁধা রব চিরদিন
 মরণডোরে।
 কেমনে ছাড়িবে মোরে,
 ওগো সুন্দরী॥';'চিন্ময় চট্টোপাধ্যায়';'রবীন্দ্রণাথ ঠাকুর';'0'
'অচেনাকে ভয় কী আমার ওরে?';'অচেনাকে ভয় কী আমার ওরে?

অচেনাকেই চিনে চিনে উঠবে জীবন ভরে ॥

জানি জানি আমার চেনা কোনো কালেই ফুরাবে না,

চিহ্নহারা পথে আমায় টানবে অচিন ডোরে ॥

ছিল আমার মা অচেনা, নিল আমায় কোলে।

সকল প্রেমই অচেনা গো, তাই তো হৃদয় দোলে।

অচেনা এই ভুবন মাঝে কত সুরেই হৃদয় বাজে–

অচেনা এই জীবন আমার,

বেড়াই তারি ঘোরে ॥';'শ্রীকান্ত আচার্য্য';'অজানা';'0'
'আমার বেলা যে যায় সাঁঝ-বেলাতে';'আমার বেলা যে যায় সাঁঝ-বেলাতে

তোমার সুরে সুরে সুর মেলাতে ॥

একতারাটির একটি তারে গানের বেদন বইতে নারে,

তোমার সাথে বারে বারে হার মেনেছি এই খেলাতে

তোমার সুরে সুরে সুর মেলাতে ॥

আমার এ তার বাঁধা কাছের সুরে,

ওই বাঁশি যে বাজে দূরে।

গানের লীলার সেই কিনারে যোগ দিতে কি সবাই পারে

বিশ্বহৃদয়পারাবারে রাগরাগিণীর জাল ফেলাতে–

তোমার সুরে সুরে সুর মেলাতে?।';'রেজওয়ানা চৌধুরী বন্যা';'কবি গুরু রবীন্দ্রনাথ ঠাকুর';'0'
'বন্ধু, রহো রহো সাথে';'বন্ধু, রহো রহো সাথে

আজি এ সঘন শ্রাবণপ্রাতে।

ছিলে কি মোর স্বপনে সাথিহারা রাতে॥

বন্ধু, বেলা বৃথা যায় রে

আজি এ বাদলে আকুল হাওয়ায় রে–

কথা কও মোর হৃদয়ে, হাত রাখো হাতে॥';'অশোকতরু বন্দোপাধ্যায়';'কবি গুরু রবীন্দ্রনাথ ঠাকুর';'0'
'দোষী করিব না';'দোষী করিব না, করিব না তোমারে

আমি নিজেরে নিজে করি ছলনা।

মনে মনে ভাবি ভালোবাসো

মনে মনে বুঝি তুমি হাসো

