'কুসুমে কুসুমে চরণ চিহ্ন দিয়ে যাও';'কুসুমে কুসুমে চরণ চিহ্ন';'কাদেরী কিবরিয়া';'রবীন্দ্র নাথ ঠাকুর';'0'
 তোমার রূপে মরুক ডুবে আমার দুটি আঁখিতারা।।

হারিয়ে-যাওয়া মনটি আমার
 ফিরিয়ে তুমি আনলে আবার।।

ছড়িয়ে-পড়া আশাগুলি কুড়িয়ে তুমি লও গো তুলি
 গলার হারে দোলাও তারে গাঁথা তোমার ক’রে সারা।।';'হেমন্ত মুখোপাধ্যায়';'দিনেন্দ্রনাথ ঠাকুর';'0'
'আমার অভিমানের বদলে আজ নেব তোমার মালা';'আমার অভিমানের বদলে আজ নেব তোমার মালা।
 আজ নিশিশেষে শেষ করে দিই চোখের জলের পালা।।

আমার কঠিন হৃদয়টারে ফেলে দিলেম পথের ধারে
 তোমার চরণ দেবে তারে মধুর পরশ পাষাণ-গালা।।

ছিল আমার আঁধারখানি, তারে তুমিই নিলে টানি
 তোমার প্রেম এল যে আগুন হয়ে– করল তারে আলা।

সেই-যে আমার কাছে আমি ছিল সবার চেয়ে দামি
 তারে উজাড় করে সাজিয়ে দিলেম তোমার বরণডালা।।';'দ্বিজেন মুখোপাধ্যায়';'অনাদিকুমার দস্তিদার';'0'
'তোমায় কিছু দেব বলে চায় যে আমার মন';'তোমায় কিছু দেব ব’লে চায় যে আমার মন
 নাই-বা তোমার থাকল প্রয়োজন।।

যখন তোমার পেলেম দেখা, অন্ধকারে একা একা
 ফিরতেছিলে বিজন গভীর বন।
 ইচ্ছা ছিল একটি বাতি জ্বালাই তোমার পথে
 নাই-বা তোমার থাকল প্রয়োজন।।

দেখেছিলেম হাটের লোকে তোমারে দেয় গালি
 গায়ে তোমার ছড়ায় ধুলাবালি।

অপমানের পথের মাঝে তোমার বীণা নিত্য বাজে
 আপন-সুরে-আপনি-নিমগন।

ইচ্ছা ছিল বরণমালা পরাই তোমার গলে
 নাই-বা তোমার থাকল প্রয়োজন।।

দলে দলে আসে লোকে, রচে তোমার স্তব
 নানা ভাষায় নানান কলরব।

ভিক্ষা লাগি তোমার দ্বারে আঘাত করে বারে বারে
 কত-যে শাপ, কত-যে ক্রন্দন।

ইচ্ছা ছিল বিনা পণে আপনাকে দিই পায়ে,
 নাই-বা তোমার থাকল প্রয়োজন।।';'শ্রীরাধা বন্দোপাধ্যায়';'রবীন্দ্রনাথ ঠাকুর';'0'
'আমার হৃদয় তোমার আপন হাতের দোলে';'আমার হৃদয় তোমার আপন হাতের দোলে দোলাও,
 কে আমারে কী-যে বলে ভোলাও ভোলাও।।

ওরা কেবল কথার পাকে নিত্য আমায় বেঁধে রাখে,
 বাঁশির ডাকে সকল বাঁধন খোলাও।।

মনে পড়ে, কত-না দিন রাতি
 আমি ছিলেম তোমার খেলার সাথী।
 আজকে তুমি তেমনি ক’রে সামনে তোমার রাখো ধরে,
 আমার প্রাণে খেলার সে ঢেউ তোলাও।।';'হেমন্ত মুখোপাধ্যায়';'দিনেন্দ্রনাথ ঠাকুর';'0'
'প্রভু, বলো বলো কবে';'প্রভু, বলো বলো কবে
 তোমার পথের ধুলার রঙে রঙে আঁচল রঙিন হবে।

তোমার বনের রাঙা ধূলি ফুটায় পূজার কুসুমগুলি
 সেই ধূলি হায় কখন আমায় আপন করি’ লবে?

প্রণাম দিতে চরণতলে ধুলার কাঙাল যাত্রীদলে
 চলে যারা, আপন ব’লে চিনবে আমায় সবে।।';'নীলিমা সেন';'শৈলজারঞ্জন মজুমদার';'0'
'আমারে তুমি অশেষ করেছ';'আমারে তুমি অশেষ করেছ, এমনি লীলা তব
 ফুরায়ে ফেলে আবার ভরেছ জীবন নব নব।।

কত-যে গিরি কত-যে নদী -তীরে
 বেড়ালে বহি ছোটো এ বাঁশিটিরে
 কত-যে তান বাজালে ফিরে ফিরে
 কাহারে তাহা কব।।

তোমারি ওই অমৃতপরশে আমার হিয়াখানি
 হারালো সীমা বিপুল হরষে, উথলি উঠে বাণী।

আমার শুধু একটি মুঠি ভরি
 দিতেছ দান দিবস-বিভাবরী
 হল না সারা, কত-না যুগ ধরি
 কেবলই আমি লব।।';'পূর্বা দাম';'সঙ্ঘমিত্রা গুপ্ত';'0'
'ওদের সাথে মেলাও যারা চরায় তোমার ধেনু,';'ওদের সাথে মেলাও যারা চরায় তোমার ধেনু,
 তোমার নামে বাজায় যারা বেণু ॥
 পাষাণ দিয়ে বাঁধা ঘাটে এই-যে কোলাহলের হাটে
 কেন আমি কিসের লোভে এনু ॥
 কী ডাক ডাকে বনের পাতাগুলি, কার ইশারা-তৃণের অঙ্গুলি!
 প্রাণেশ আমার লীলাভরে খেলেন প্রাণের খেলাঘরে,
 পাখির মুখে এই-যে খবর পেনু ॥

রাগ: ভৈরবী-বাউল
 তাল: কাহারবা
 রচনাকাল (বঙ্গাব্দ): ২৩ চৈত্র, ১৩২০
 রচনাকাল (খৃষ্টাব্দ): 1914
 রচনাস্থান: শান্তিনিকেতন';'সুবিনয় রায়';'ইন্দিরা দেবী';'0'
'আমায় বাঁধবে যদি কাজের ডোরে';'আমায় বাঁধবে যদি কাজের ডোরে
 কেন পাগল কর এমন ক’রে ?।
 বাতাস আনে কেন জানি কোন্‌ গগনের গোপন বাণী,
 পরানখানি দেয় যে ভ’রে ॥
 সোনার আলো কেমনে হে, রক্তে নাচে সকল দেহে।
 কারে পাঠাও ক্ষণে ক্ষণে আমার খোলা বাতায়নে,
 সকল হৃদয় লয় যে হ’রে ॥

রাগ: দেশ-বাউল
 তাল: কাহারবা
 রচনাকাল (বঙ্গাব্দ): ২৪ চৈত্র, ১৩২০
 রচনাকাল (খৃষ্টাব্দ): 1914
 রচনাস্থান: শান্তিনিকেতন';'হেমন্ত মুখোপাধ্যায় ও সুমিত্রা বসু';'দিনেন্দ্রনাথ ঠাকুর';'0'
'সে দিনে আপদ আমার যাবে কেটে';'সে দিনে আপদ আমার যাবে কেটে
 পুলকে হৃদয় যেদিন পড়বে ফেটে ॥
 তখন তোমার গন্ধ তোমার মধু আপনি বাহির হবে বঁধু হে,
 তারে আমার ব’লে ছলে বলে কে বলো আর রাখবে এঁটে ॥
 আমারে নিখিল ভুবন দেখছে চেয়ে রাত্রিদিবা।
 আমি কি জানি নে তার অর্থ কিবা!
 তারা যে জানে আমার চিত্তকোষে অমৃতরূপ আছে বসে গো–
 তারেই প্রকাশ করি, আপনি মরি, তবে আমার দুঃখ মেটে ॥

রাগ: বাউল
 তাল: দাদরা
 রচনাকাল (বঙ্গাব্দ): ২৭ চৈত্র, ১৩২০
 রচনাকাল (খৃষ্টাব্দ): 1914
 রচনাস্থান: কলকাতা';'স্বাগতা লক্ষী দাশগুপ্ত';'দিনেন্দ্রনাথ ঠাকুর';'0'
'দুঃখের বরষায় চক্ষের জল যেই নামল';'দুঃখের বরষায় চক্ষের জল যেই নামল
 বক্ষের দরজায় বন্ধুর রথ সেই থামল ॥
 মিলনের পাত্রটি পূর্ণ যে বিচ্ছেদ -বেদনায়;
 অর্পিনু হাতে তার, খেদ নাই আর মোর খেদ নাই ॥
 বহুদিনবঞ্চিত অন্তরে সঞ্চিত কী আশা,
 চক্ষের নিমেষেই মিটল সে পরশের তিয়াষা।
 এত দিনে জানলেম যে কাঁদন কাঁদলেম সে কাহার জন্য।
 ধন্য এ জাগরণ, ধন্য এ ক্রন্দন, ধন্য রে ধন্য ॥
 রাগ: ভৈরব
 তাল: কাহারবা
 রচনাকাল (বঙ্গাব্দ): শ্রাবণ, ১৩২১
 রচনাকাল (খৃষ্টাব্দ): 1914
 রচনাস্থান: শান্তিনিকেতন';'সুমিত্রা সেন';'দিনেন্দ্রনাথ ঠাকুর';'0'
'এবার আমায় ডাকলে দূরে';'এবার আমায় ডাকলে দূরে
 সাগর-পারের গোপন পুরে।।

বোঝা আমার নামিয়েছি যে,
 সঙ্গে আমায় নাও গো নিজে,
 স্তব্ধ রাতের স্নিগ্ধ সুধা পান করাবে তৃষ্ণাতুরে।।

আমার সন্ধ্যাফুলের মধু
 এবার যে ভোগ করবে বঁধু।

তারার আলোর প্রদীপখানি
 প্রাণে আমার জ্বালবে আনি,
 আমার যত কথা ছিল ভেসে যাবে তোমার সুরে।।';'দেবব্রত বিশ্বাস';'শ্রীরাধা বন্দোপাধ্যায়';'0'
'ধীরে বন্ধু ধীরে ধীরে চলো তোমার বিজন মন্দিরে';'ধীরে বন্ধু ধীরে ধীরে
 চলো তোমার বিজন মন্দিরে।
 জানি নে পথ, নাই যে আলো,
 ভিতর বাহির কালোয় কালো,
 তোমার চরণশব্দ বরণ করেছি
 আজ এই অরণ্যগভীরে।

 ধীরে বন্ধু ধীরে ধীরে।
 চলো অন্ধকারের তীরে তীরে।
 চলব আমি নিশীথরাতে
 তোমার হাওয়ার ইশারাতে,
 তোমার বসনগন্ধ বরণ করেছি
 আজ এই বসন্তসমীরে॥

রাগ: পিলু
 তাল: দাদরা
 রচনাকাল (বঙ্গাব্দ): 1321
 রচনাকাল (খৃষ্টাব্দ): 1915';'ঋতু গুহ';'সুচিত্রা মিত্র';'0'
'বল তো এইবারের মতো';'বল তো এইবারের মতো
 প্রভু, তোমার আঙিনাতে তুলি আমার ফসল যত ॥
 কিছু-বা ফল গেছে ঝরে, কিছু-বা ফল আছে ধরে,
 বছর হয়ে এল গত–
 রোদের দিনে ছায়ায় বসে বাজায় বাঁশি রাখাল যত ॥
 হুকুম তুমি কর যদি
 চৈত্র-হাওয়ায় পাল তুলে দিই– ওই-যে মেতে ওঠে নদী।
 পার ক’রে নিই ভরা তরী, মাঠের যা কাজ সারা করি,
 ঘরের কাজে হই গো রত–
 এবার আমার মাথার বোঝা পায়ে তোমার করি নত ॥

রাগ: ইমন
 তাল: কাহারবা
 রচনাকাল (বঙ্গাব্দ): 1320
 রচনাকাল (খৃষ্টাব্দ): 1914
 রচনাস্থান: শান্তিনিকেতন';'দ্বিজেন মুখোপাধ্যায়';'অনাদিকুমার দস্তিদার';'0'
'কার হাতে এই মালা তোমার পাঠালে';'কার হাতে এই মালা তোমার পাঠালে
 আজ ফাগুন দিনের সকালে।
 তার বর্ণে তোমার নামের রেখা,
 গন্ধে তোমার ছন্দ লেখা,
 সেই মালাটি বেঁধেছি মোর কপালে
 আজ ফাগুন দিনের সকালে
 গানটি তোমার চলে এল আকাশে
 আজ ফাগুন দিনের বাতাসে।
 ওগো আমার নামটি তোমার সুরে
 কেমন করে দিলে জুড়ে
 লুকিয়ে তুমি ওই গানেরি আড়ালে,
 আজ ফাগুন দিনের সকালে।

রাগ: ভৈরব
 তাল: কাহারবা
 রচনাকাল (বঙ্গাব্দ): 1320
 রচনাকাল (খৃষ্টাব্দ): 1914
 রচনাস্থান: শান্তিনিকেতন';'কুমকুম চট্টোপাধ্যায়';'দিনেন্দ্রনাথ ঠাকুর';'0'
'এত আলো জ্বালিয়েছ এই গগনে';'এত আলো জ্বালিয়েছ এই গগনে
 কী উৎসবের লগনে॥
 সব আলোটি কেমন ক’রে ফেল আমার মুখের ‘পরে,
 তুমি আপনি থাকো আলোর পিছনে ॥
 প্রেমটি যেদিন জ্বালি হৃদয়-গগনে
 কী উৎসবের লগনে
 সব আলো তার কেমন ক’রে পড়ে তোমার মুখের ‘পরে,
 আমি আপনি পড়ি আলোর পিছনে ॥

রাগ: ভৈরবী-বাউল
 তাল: কাহারবা
 রচনাকাল (বঙ্গাব্দ): 1320
 রচনাকাল (খৃষ্টাব্দ): 1914
 রচনাস্থান: শান্তিনিকেতন';'দ্বিজেন মুখোপাধ্যায়';'দিনেন্দ্রনাথ ঠাকুর';'0'
'মালা হতে খসে-পড়া ফুলের একটি দল';'মালা হতে খসে-পড়া ফুলের একটি দল
 মাথায় আমার ধরতে দাও গো ধরতে দাও।
 ওই মাধুরী-সরোবরের নাই যে কোথাও তল–
 হোথায় আমায় ডুবতে দাও গো, মরতে দাও॥
 দাও গো মুছে আমার ভালে অপমানের লিখা,
 নিভৃতে আজ বন্ধু, তোমার আপন হাতের টিকা
 ললাটে মোর পরতে দাও গো পরতে দাও॥
 বহুক তোমার ঝড়ের হাওয়া আমার ফুলবনে,
 শুকনো পাতা মলিন কুসুম ঝরতে দাও।
 পথ জুড়ে যা পড়ে আছে আমার এ জীবনে
 দাও গো তাদের সরতে দাও গো, সরতে দাও।
 তোমার মহাভান্ডারেতে আছে অনেক ধন,
 কুড়িয়ে বেড়াই মুঠা ভ’রে, ভরে না তায় মন–
 অন্তরেতে জীবন আমার ভরতে দাও॥

রাগ: ভৈরবী
 তাল: দাদরা
 রচনাকাল (বঙ্গাব্দ): 1321
 রচনাকাল (খৃষ্টাব্দ): 1914
 রচনাস্থান: সুরুল';'প্রমিতা মুখোপাধ্যায়';'স্বাগতা লক্ষী দাশগুপ্ত';'0'
'মোর প্রভাতের এই প্রথম খনের কুসুমখানি';'মোর প্রভাতের এই প্রথম খনের কুসুমখানি
 তুমি জাগাও তারে ওই নয়নের আলোক হানি ॥
 সে যে দিনের বেলায় করবে খেলা হাওয়ায় দুলে,
 রাতের অন্ধকারে নেবে তারে বক্ষে তুলে–
 ওগো তখনি তো গন্ধে তাহার ফুটবে বাণী ॥
 আমার বীণাখানি পড়ছে আজি সবার চোখে,
 হেরো তারগুলি তার দেখছে গুনে সকল লোকে।
 ওগো কখন সে যে সভা ত্যেজে আড়াল হবে,
 শুধু সুরটুকু তার উঠবে বেজে করুণ রবে–
 যখন তুমি তারে বুকের ‘পরে লবে টানি ॥

রাগ: রামকেলী
 তাল: দাদরা
 রচনাকাল (বঙ্গাব্দ): 1321
 রচনাকাল (খৃষ্টাব্দ): 1914
 রচনাস্থান: শান্তিনিকেতন';'অদিতি মহসিন';'কণিকা বন্দ্যোপাধ্যায়';'0'
'মোর হৃদয়ের গোপন বিজন ঘরে';'মোর হৃদয়ের গোপন বিজন ঘরে
 একেলা রয়েছ নীরব শয়ন-‘পরে–
 প্রিয়তম হে, জাগো জাগো জাগো।।

রুদ্ধ দ্বারের বাহিরে দাঁড়ায়ে আমি
 আর কতকাল এমনে কাটিবে স্বামী–
 প্রিয়তম হে, জাগো জাগো জাগো।।

রজনীর তারা উঠেছে গগন ছেয়ে,
 আছে সবে মোর বাতায়ন পানে চেয়ে–
 প্রিয়তম হে, জাগো জাগো জাগো।

জীবনে আমার সঙ্গীত দাও আনি,
 নীরব রেখো না তোমার বীণার বাণী–
 প্রিয়তম হে, জাগো জাগো জাগো।।

মিলাব নয়ন তব নয়নের সাথে,
 মিলাব এ হাত তব দক্ষিণহাতে–
 প্রিয়তম হে, জাগো জাগো জাগো।

হৃদয়পাত্র সুধায় পূর্ণ হবে,
 তিমির কাঁপিবে গভীর আলোর রবে–
 প্রিয়তম হে, জাগো জাগো জাগো।।';'চিন্ময় চট্টোপাধ্যায়';'ইন্দিরা দেবী';'0'
'শুধু তোমার বাণী নয় গো, হে বন্ধু, হে প্রিয়,';'শুধু তোমার বাণী নয় গো, হে বন্ধু, হে প্রিয়,
 মাঝে মাঝে প্রাণে তোমার পরশখানি দিয়ো ॥
 সারা পথের ক্লান্তি আমার সারা দিনের তৃষা
 কেমন করে মেটাব যে খুঁজে না পাই দিশা–
 এ আধার যে পূর্ণ তোমায় সেই কথা বলিয়ো ॥
 হৃদয় আমার চায় যে দিতে, কেবল নিতে নয়,
 বয়ে বয়ে বেড়ায় সে তার যা-কিছু সঞ্চয়।
 হাতখানি ওই বাড়িয়ে আনো, দাও গো আমার হাতে–
 ধরব তারে, ভরব তারে, রাখব তারে সাথে,
 একলা পথের চলা আমার করব রমণীয় ॥

রাগ: সাহানা
 তাল: ঝাঁপতাল
 রচনাকাল (বঙ্গাব্দ): ১৮ ভাদ্র, ১৩২১
 রচনাকাল (খৃষ্টাব্দ): 1914
 রচনাস্থান: শান্তিনিকেতন';'কলিম শরাফী';'দেবব্রত বিশ্বাস';'0'
'তুমি একলা ঘরে বসে বসে কী সুর বাজালে';'তুমি একলা ঘরে বসে বসে কী সুর বাজালে
 প্রভু, আমার জীবনে!
 তোমার পরশরতন গেঁথে গেঁথে আমায় সাজালে
 প্রভু, গভীর গোপনে ॥
 দিনের আলোর আড়াল টানি কোথায় ছিলে নাহি জানি,
 অস্তরবির তোরণ হতে চরণ বাড়ালে
 আমার রাতের স্বপনে ॥
 আমার হিয়ায় হিয়ায় বাজে আকুল আঁধার যামিনী,
 সে যে তোমার বাঁশরি।
 আমি শুনি তোমার আকাশপারের তারার রাগিণী,
 আমার সকল পাশরি।
 কানে আসে আশার বাণী– খোলা পাব দুয়ারখানি
 রাতের শেষে শিশির-ধোওয়া প্রথম সকালে
 তোমার করুণ কিরণে ॥

রাগ: মিশ্র কেদারা
 তাল: ত্রিতাল
 রচনাকাল (বঙ্গাব্দ): 1325
 রচনাকাল (খৃষ্টাব্দ): 1918';'দেবব্রত বিশ্বাস';'সুমিত্রা সেন';'0'
'প্রভু, তোমার বীণা যেমনি বাজে';'প্রভু, তোমার বীণা যেমনি বাজে
 আঁধার-মাঝে
 অমনি ফোটে তারা।
 যেন সেই বীণাটি গভীর তানে
 আমার প্রাণে
 বাজে তেমনিধারা ॥
 তখন নূতন সৃষ্টি প্রকাশ হবে
 কী গৌরবে
 হৃদয়-অন্ধকারে।
 তখন স্তরে স্তরে আলোকরাশি
 উঠবে ভাসি
 চিত্তগগনপারে ॥
 তখন তোমারি সৌন্দর্যছবি,
 ওগো কবি,
 আমায় পড়বে আঁকা–
 তখন বিস্ময়ের রবে না সীমা,
 ওই মহিমা
 আর যাবে না ঢাকা।
 তখন তোমারি প্রসন্ন হাসি
 পড়বে আসি
 নবজীবন-‘পরে।
 তখন আনন্দ-অমৃতে তব
 ধন্য হব
 চিরদিনের তরে ॥

রাগ: কানাড়া
 তাল: তেওরা
 রচনাকাল (বঙ্গাব্দ): 1320
 রচনাকাল (খৃষ্টাব্দ): 1913
 রচনাস্থান: শান্তিনিকেতন';'সুচিত্রা মিত্র';'স্বাগতা লক্ষী দাশগুপ্ত';'0'
'তোমায় আমায় মিলন হবে ব’লে';'তোমায় আমায় মিলন হবে ব’লে আলোয় আকাশ ভরা।
 তোমায় আমায় মিলন হবে ব’লে ফুল্ল শ্যামল ধরা।।

তোমায় আমায় মিলন হবে ব’লে
 রাত্রি জাগে জগৎ লয়ে কোলে,
