'কুসুমে কুসুমে চরণ চিহ্ন দিয়ে যাও';'কুসুমে কুসুমে চরণ চিহ্ন';'কাদেরী কিবরিয়া';'রবীন্দ্র নাথ ঠাকুর';'0'
'আমার এ পথ তোমার পথের থেকে';'আমার এ পথ তোমার পথের থেকে অনেক দূরে গেছে বেঁকে।।
 আমার ফুলে আর কি কবে তোমার মালা গাঁথা হবে,
 তোমার বাঁশি দূরের হাওয়ায় কেঁদে বাজে কারে ডেকে।।
 শ্রান্তি লাগে পায়ে পায়ে বসি পথের তরুচ্ছায়ে।
 সাথিহারার গোপন ব্যথা বলব যারে সেজন কোথা-
 পথিকরা যায় আপন-মনে, আমারে যায় পিছে রেখে।।';'অমিতাভ বন্দ্যোপাধ্যায়';'রবীন্দ্রনাথ ঠাকুর';'0'
'আমার এ পথ তোমার পথের থেকে অনেক দূরে';'আমার এ পথ তোমার পথের থেকে অনেক দূরে গেছে বেঁকে।।
 আমার ফুলে আর কি কবে তোমার মালা গাঁথা হবে,
 তোমার বাঁশি দূরের হাওয়ায় কেঁদে বাজে কারে ডেকে।।
 শ্রান্তি লাগে পায়ে পায়ে বসি পথের তরুচ্ছায়ে।
 সাথিহারার গোপন ব্যথা বলব যারে সেজন কোথা-
 পথিকরা যায় আপন-মনে, আমারে যায় পিছে রেখে।।';'অমিতাভ বন্দ্যোপাধ্যায়';'রবীন্দ্রনাথ ঠাকুর';'0'
'শুনাও তোমার অমৃত বাণী';'শুনাও তোমার অমৃত বাণী,
 অধমে ডাকি, চরণে আনি।
 সতত নিষ্ফল শত কোলাহলে,
 ক্লিষ্ট শ্রুতি যুগ কত হলাহলে
 শুনাও হে-
 শুনাও শীতল মনোরসায়ন
 প্রেম-সুমধুর মন্ত্রখানি।
 হউক সে ধ্বনি দিক প্রসারিত
 মিশ্র কলরব ছাপিয়া,
 উঠুক সে ধবনি শিহরি’ পুলকে
 কাঁপিয়া, সুখে কাঁপিয়া,
 বিতরি’এ ভবে শুভ বরাভয় ;
 রুগ্মে করি’;হরি চির নিরাময়,
 শুনাও হে-
 শুনাও দুর্বল চিত্ত, হে হরি!
 তোমারি শ্রীপদ নিকটে টানি।।';'কৃষ্ণা চট্টোপাধ্যায়';'রজনীকান্ত সেন';'0'
'এ জগতে আমি বড়ই একা, আমি বড়ই দীনা।';'এ জগতে আমি বড়ই একা, আমি বড়ই দীনা।
 বিদেশিনী আমি হেথা, তোমা বৈ কারেও চিনি না।।

দীর্ঘ দিবা অবসানে
 ক্লান্ত দেহে শ্রান্ত প্রাণ,
 তোমার কাছে ছুটে আসি, কে আছে আর তোমা বিনা।।
 ল’য়ে শত প্রাণের ক্ষত তোয়াম্র কাছে ছুটে আসি,
 তোমার বুকে রাখ্‌তে মাথা, তোমার মুখে দেখ্‌তে হাসি।

শুষ্ক ধরা শূন্য ধরা
 অসীম তাচ্ছিল্য ভরা,
 তুমিও মুখ ফিরায়ো না, তুমিও কোরো না ঘৃণা।।';'কৃষ্ণা চট্টোপাধ্যায়';'রবীন্দ্র সংগীত';'0'
'বড় আশা করে এসেছি';'বড় আশা করে এসেছি গো
 কাছে ডেকে লও
 ফিরাইও না জননী। 

দিনহীনে কেহ চাহে না
 তুমি তারে রাখিবে জানি গো।
 আর আমি যে কিছু চাহিনে
 চরণও তলে বসে থাকিব,
 আর আমি যে কিছু চাহিনে
 জননী বলে শুধু ডাকিব। 

তুমি না রাখিলে গৃহ আর পাইব কোথায়
 কেঁদে কেঁদে কোথা বেড়াব
 ঐ যে হেরী
 তমশ ঘন ঘরা
 গহন রজনী।';'জনি এবং আনিসা';'রবীন্দ্র সংগীত';'0'
'আর নাই যে দেরি, নাই যে দেরি';'আর নাই যে দেরি, নাই যে দেরি।

 সামনে সবার পড়ল ধরা তুমি যে, ভাই, আমাদেরই॥

 হিমের বাহু-বাঁধন টুটি পাগ্‌লা-ঝোরা পাবে ছুটি,

 উত্তরে এই হাওয়া তোমার বইবে উজান কুঞ্জ ঘেরি॥

 নাই যে দেরি নাই যে দেরি।

 শুনছ না কি জলে স্থলে জাদুকরের বাজল ভেরী।

 দেখছ না কি এই আলোকে খেলছে হাসি রবির চোখে–

 সাদা তোমার শ্যামল হবে, ফিরব মোরা তাই যে হেরি॥';'প্রমিতা মল্লিক';'রবীন্দ্র সংগীত';'0'
'আমরা নূতন প্রাণের চর হা হা';'আমরা নূতন প্রাণের চর হা হা।

 আমরা থাকি পথে ঘাটে, নাই আমাদের ঘর হা হা॥

 নিয়ে পক্ক পাতার পুঁজি পালাবে শীত, ভাবছ বুঝি গো?

ও-সব কেড়ে নেব, উড়িয়ে দেব দখিন হাওয়ার ‘পর হা হা॥

 তোমায় বাঁধব নূতন ফুলের মালায়

 বসন্তের এই বন্দীশালায়।

 জীর্ণ জরার ছদ্মরূপে এড়িয়ে যাবে চুপে চুপে?

তোমার সকল ভূষণ ঢাকা আছে, নাই যে অগোচর গো॥';'শ্রীকান্ত আচার্য';'রবীন্দ্র সংগীত';'0'
'ছাড়্‌ গো তোরা ছাড়্‌ গো,';'ছাড়্‌ গো তোরা ছাড়্‌ গো,

 আমি চলব সাগর-পার গো॥

 বিদায়-বেলায় একি হাসি, ধরলি আগমনীর বাঁশি–

 যাবার সুরে আসার সুরে করলি একাকার গো।

সবাই আপন-পানে আমায় আবার কেন টানে।

 পুরানো শীত পাতা-ঝরা, তারে এমন নূতন-করা?

 মাঘ মরিল ফাগুন হয়ে খেয়ে ফুলের মার গো॥

রঙের খেলার ভাই রে, আমার সময় হাতে নাই রে।

 তোমাদের ওই সবুজ ফাগে চক্ষে আমার ধাঁদা লাগে–

আমায় তোদের প্রাণের দাগে দাগিস নে, ভাই, আর গো॥';'রুমা গুহঠাকুরতা';'রবীন্দ্র সংগীত';'0'
'পৌষ তোদের ডাক দিয়েছে, আয় রে চলে, আ য় আ য় আয়';'পৌষ তোদের ডাক দিয়েছে, আয় রে চলে, আ য় আ য় আয়।

ডালা যে তার ভরেছে আজ পাকা ফসলে, মরি হায় হায় হায়॥

 হাওয়ার নেশায় উঠল মেতে দিগ্‌বধূরা ধানের ক্ষেতে–

রোদের সোনা ছড়িয়ে পড়ে মাটির আঁচলে, মরি হা য় হা য় হায়॥

 মাঠের বাঁশি শুনে শুনে আকাশ খুশি হল।

 ঘরেতে আজ কে রবে গো, খোলো খোলো দুয়ার খোলো।

 আলোর হাসি উঠল জেগে ধানের শিষে শিশির লেগে–

ধরার খুশি ধরে না গো, ওই-যে উথলে, মরি হা য় হা য় হায়॥';'অর্ঘ্য সেন ও রুমা গুহঠাকুরতা';'রবীন্দ্র সংগীত';'0'
'এল যে শীতের বেলা বরষ-পরে।';'এল যে শীতের বেলা বরষ-পরে।

এবার ফসল কাটো, লও গো ঘরে॥

 করো ত্বরা, করো ত্বরা, কাজ আছে মাঠ-ভরা–

 দেখিতে দেখিতে দিন আঁধার করে॥

বাহিরে কাজের পালা হইবে সারা

আকাশে উঠিবে যবে সন্ধ্যাতারা–

 আসন আপন হাতে পেতে রেখো আঙিনাতে

 যে সাথি আসিবে রাতে তাহারি তরে॥';'ইন্দ্রানী সেন';'রবীন্দ্র সংগীত';'0'
'শিউলি-ফোটা ফুরোল যেই ফুরোল শীতের বনে';'শিউলি-ফোটা ফুরোল যেই ফুরোল শীতের বনে

 এলে যে–

আমার শীতের বনে এলে যে সেই শূন্যক্ষণে॥

তাই গোপনে সাজিয়ে ডালা দুখের সুরে বরণমালা

 গাঁথি মনে মনে শূন্যক্ষণে॥

 দিনের কোলাহলে

 ঢাকা সে যে রইবে হৃদয়তলে–

আমার বরণমালা রইবে হৃদয়তলে॥

রাতের তারা উঠবে যবে সুরের মালা বদল হবে

 তখন তোমার সনে মনে মনে॥';'দেবব্রত বিশ্বাস';'রবীন্দ্র সংগীত';'0'
'শীতের হাওয়ার লাগল নাচন আম্‌লকির এই ডালে ডালে।';'শীতের হাওয়ার লাগল নাচন আম্‌লকির এই ডালে ডালে।

পাতাগুলি শির্‌শিরিয়ে ঝরিয়ে দিল তালে তালে॥

 উড়িয়ে দেবার মাতন এসে কাঙাল তারে করল শেষে,

 তখন তাহার ফলের বাহার রইল না আর অন্তরালে॥

 শূন্য করে ভরে দেওয়া যাহার খেলা

 তারি লাগি রইনু বসে সকল বেলা।

শীতের পরশ থেকে থেকে যায় বুঝি ওই ডেকে ডেকে,

সব খোওয়াবার সময় আমার হবে কখন কোন্‌ সকালে॥';'দেবব্রত বিশ্বাস';'রবীন্দ্র সংগীত';'0'
'নমো, নমো, নমো';'নমো, নমো, নমো।

 নমো, নমো, নমো।

 তুমি ক্ষুধার্তজনশরণ্য,

 অমৃত-অন্ন-ভোগধন্য করো অন্তর মম॥';'সুচিত্রা মিত্র';'রবীন্দ্র সংগীত';'0'
'সে দিন আমায় বলেছিলে আমার সময় হয় নাই–';'সে দিন আমায় বলেছিলে আমার সময় হয় নাই–

ফিরে ফিরে চলে গেলে তাই॥

 তখনো খেলার বেলা– বনে মল্লিকার মেলা,

 পল্লবে পল্লবে বায়ু উতলা সদাই॥

আজি এল হেমন্তের দিন

কুহেলীবিলীন, ভূষণবিহীন।

 বেলা আর নাই বাকি, সময় হয়েছে নাকি–

 দিনশেষে দ্বারে বসে পথপানে চাই।';'দেবব্রত বিশ্বাস';'রবীন্দ্র সংগীত';'0'
'হেমন্তে কোন্‌ বসন্তেরই বাণী পূর্ণশশী ওই-যে দিল আনি';'হেমন্তে কোন্‌ বসন্তেরই বাণী পূর্ণশশী ওই-যে দিল আনি॥

বকুল ডালের আগায় জ্যোৎস্না যেন ফুলের স্বপন লাগায়।

কোন্‌ গোপন কানাকানি পূর্ণশশী ওই-যে দিল আনি॥

আবেশ লাগে বনে শ্বেতকরবীর অকাল জাগরণে।

ডাকছে থাকি থাকি ঘুমহারা কোন্‌ নাম-না-জানা পাখি।

কার মধুর স্মরণখানি পূর্ণশশী ওই-যে দিল আনি॥';'সুবীর সেন';'রবীন্দ্র সংগীত';'0'
'হায় হেমন্তলক্ষ্মী, তোমার নয়ন কেন ঢাকা–';'হায় হেমন্তলক্ষ্মী, তোমার নয়ন কেন ঢাকা–

হিমের ঘন ঘোমটাখানি ধুমল রঙে আঁকা ॥

 সন্ধ্যাপ্রদীপ তোমার হাতে মলিন হেরি কুয়াশাতে,

 কণ্ঠে তোমার বাণী যেন করুণ বাষ্পে মাখা ॥

ধরার আঁচল ভরে দিলে প্রচুর সোনার ধানে।

দিগঙ্গনার অঙ্গন আজ পূর্ণ তোমার দানে।

 আপন দানের আড়ালেতে রইলে কেন আসন পেতে,

 আপনাকে এই কেমন তোমার গোপন ক’রে রাখা ॥';'শ্রীকান্ত আচার্য';'রবীন্দ্র সংগীত';'0'
'নব কুন্দধবলদলসুশীতলা,';'নব কুন্দধবলদলসুশীতলা,

 অতি সুনির্মলা, সুখসমুজ্জ্বলা,

 শুভ সুবর্ণ-আসনে অচঞ্চলা ॥

 স্মিত-উদয়ারুণ-কিরণ-বিলাসিনী,

 পূর্ণসিতাংশুবিভাসবিকাশিনী,

 নন্দনলক্ষ্ণীসুমঙ্গলা ॥';'পূরবী মুখোপাধ্যায়';'রবীন্দ্র সংগীত';'0'
'পোহালো পোহালো বিভাবরী';'পোহালো পোহালো বিভাবরী,

 পূর্বতোরণে শুনি বাঁশরি॥

 নাচে তরঙ্গ, তরী অতি চঞ্চল, কম্পিত অংশুককেতন-অঞ্চল,

 পল্লবে পল্লবে পাগল জাগল আলসলালস পাসরি॥

উদয়-অচলতল সাজিল নন্দন, গগনে গগনে বনে জাগিল বন্দন,

 কনককিরণঘন শোভন স্যন্দন– নামিছে শারদসুন্দরী।

দশদিক-অঙ্গনে দিগঙ্গনাদল ধ্বনির শূন্য ভরি শঙ্খ সুমঙ্গল–

 চলো রে চলো চলো তরুণযাত্রীদল তুলি নব মালতীমঞ্জরী॥';'সাগর সেন';'রবীন্দ্র সংগীত';'0'
'সেই তো তোমার পথের বঁধু সেই তো।';'সেই তো তোমার পথের বঁধু সেই তো।

দূর কুসুমের গন্ধ এনে খোঁজায় মধু সেই তো ॥

 সেই তো তোমার পথের বঁধু সেই তো।

এই আলো তার এই তো আঁধার, এই আছে এই নেই তো ॥';'জয়তি ভট্টাচার্য';'রবীন্দ্র সংগীত';'0'
'আলোর অমল কমলখানি কে ফুটালে';'আলোর অমল কমলখানি কে ফুটালে,

নীল আকাশের ঘুম ছুটালে॥

 আমার মনের ভাব্‌নাগুলি বাহির হল পাখা তুলি,

 ওই কমলের পথে তাদের সেই জুটালে॥

শরতবাণীর বীণা বাজে কমলদলে।

ললিত রাগের সুর ঝরে তাই শিউলিতলে।

 তাই তো বাতাস বেড়ায় মেতে কচি ধানের সবুজ ক্ষেতে,

 বনের প্রাণে মর্‌মরানির ঢেউ উঠালে॥';'চিন্ময় চট্টোপাধ্যায়';'রবীন্দ্র সংগীত';'0'
'নির্মল কান্ত, নমো';'নির্মল কান্ত, নমো হে নমো, নমো হে, নমো হে।

 স্নিগ্ধ সুশান্ত, নমো হে নমো, নমো হে, নমো হে।

 বন-অঙ্গন-ময় রবিকররেখা

 লেপিল আলিম্পনলিপি-লেখা,

 আঁকিব তাহে প্রণতি মম।

নমো হে নমো, নমো হে নমো, নমো হে নমো ॥';'কনক দাস';'রবীন্দ্র সংগীত';'0'
'মন মোর মেঘের';'মন মোর মেঘের সঙ্গী,

উড়ে চলে দিগ্‌দিগন্তের পানে

নিঃসীম শূন্যে শ্রাবণবর্ষণসঙ্গীতে

রিমিঝিম রিমিঝিম রিমিঝিম॥

 মন মোর হংসবলাকার পাখায় যায় উড়ে

 ক্বচিৎ ক্বচিৎ চকিত তড়িত-আলোকে।

 ঝঞ্জনমঞ্জীর বাজায় ঝঞ্ঝা রুদ্র আনন্দে।

 কলো-কলো কলমন্দ্রে নির্ঝরিণী

 ডাক দেয় প্রলয়-আহ্বানে॥

বায়ু বহে পূর্বসমুদ্র হতে

উচ্ছল ছলো-ছলো তটিনীতরঙ্গে।

 মন মোর ধায় তারি মত্ত প্রবাহে

 তাল-তমাল-অরণ্যে

 ক্ষুব্ধ শাখার আন্দোলনে॥';'শাওনী মিত্র';'রবীন্দ্র সংগীত';'0'
'ওগো সাঁওতালি ছেলে';'ওগো সাঁওতালি ছেলে,

শ্যামল সঘন নববরষার কিশোর দূত কি এলে॥

ধানের ক্ষেতের পারে শালের ছায়ার ধারে

বাঁশির সুরেতে সুদূর দূরেতে চলেছ হৃদয় মেলে॥

 পুবদিগন্ত দিল তব দেহে নীলিমলেখা,

 পীত ধড়াটিতে অরুণরেখা,

 কেয়াফুলখানি কবে তুলে আনি

 দ্বারে মোর রেখে গেলে॥

আমার গানের হংসবলাকাপাঁতি

বাদল-দিনের তোমার মনের সাথি।

 ঝড়ে চঞ্চল তমালবনের প্রাণে

 তোমাতে আমাতে মিলিয়াছি একখানে,

 মেঘের ছায়ায় চলিয়াছি ছায়া ফেলে॥';'রেজওয়ানা চৌধুরী বন্যা';'রবীন্দ্র সংগীত';'0'
'চরণধ্বনি শুনি তব, নাথ, জীবনতীরে';'চরণধ্বনি শুনি তব, নাথ, জীবনতীরে

কত নীরব নির্জনে কত মধুসমীরে ॥

গগনে গ্রহতারাচয় অনিমেষে চাহি রয়,

ভাবনাস্রোত হৃদয়ে বয় ধীরে একান্তে ধীরে ॥

চাহিয়া রহে আঁখি মম তৃষ্ঞাতুর পাখিসম,

শ্রবণ রয়েছি মেলি চিত্তগভীরে–

কোন্‌ শুভপ্রাতে দাঁড়াবে হৃদিমাঝে,

ভুলিব সব দুঃখ সুখ ডুবিয়া আনন্দনীরে ॥';'আখতার জাহান';'রবীন্দ্র সংগীত';'0'
'কেন বাণী তব নাহি শুনি নাথ হে?';'কেন বাণী তব নাহি শুনি নাথ হে?

অন্ধজনে নয়ন দিয়ে অন্ধকারে ফেলিলে, বিরহে তব কাটে দিনরাত হে ॥

 স্বপনসম মিলাবে যদি কেন গো দিলে চেতনা–

 চকিতে শুধু দেখা দিয়ে চিরমরমবেদনা,

 আপনা-পানে চাহি শুধু নয়নজলপাত হে ॥

 পরশে তব জীবন নব সহসা যদি জাগিল

 কেন জীবন বিফল কর– মরণশরঘাত হে।

 অহঙ্কার চূর্ণ করো, প্রেমে মন পূর্ণ করো,

 হৃদয় মন হরণ করি রাখো তব সাথ হে ॥';'সাগর সেন';'রবীন্দ্র সংগীত';'0'
'অকারণে অকালে মোর পড়ল যখন ডাক';'অকারণে অকালে মোর পড়ল যখন ডাক

 তখন আমি ছিলেম শয়ন পাতি।

বিশ্ব তখন তারার আলোয় দাঁড়ায়ে নির্বাক,

 ধরায় তখন তিমিরগহন রাতি।

 ঘরের লোকে কেঁদে কইল মোরে,

 “আঁধারে পথ চিনবে কেমন ক’রে?’

আমি কইনু, “চলব আমি নিজের আলো ধরে,

 হাতে আমার এই-যে আছে বাতি।’

বাতি যতই উচ্চ শিখায় জ্বলে আপন তেজে

 চোখে ততই লাগে আলোর বাধা,

ছায়ায় মিশে চারি দিকে মায়া ছড়ায় সে-যে–

 আধেক দেখা করে আমায় আঁধা।

 গর্বভরে যতই চলি বেগে

 আকাশ তত ঢাকে ধুলার মেঘে,

শিখা আমার কেঁপে ওঠে অধীর হাওয়া লেগে–

 পায়ে পায়ে সৃজন করে ধাঁধা ॥

হঠাৎ শিরে লাগল আঘাত বনের শাখাজালে,

 হঠাৎ হাতে নিবল আমার বাতি।

চেয়ে দেখি পথ হারিয়ে ফেলেছি কোন্‌ কালে–

 চেয়ে দেখি তিমিরগহন রাতি।

 কেঁদে বলি মাথা করে নিচু,

 “শক্তি আমার রইল না আর কিছু!’

সেই নিমেষে হঠাৎ দেখি কখন পিছু পিছু

 এসেছ মোর চিরপথের সাথি ॥

বাতি যতই উচ্চ শিখায় জ্বলে আপন তেজে

 চোখে ততই লাগে আলোর বাধা,

ছায়ায় মিশে চারি দিকে মায়া ছড়ায় সে-যে–

 আধেক দেখা করে আমায় আঁধা।

 গর্বভরে যতই চলি বেগে

 আকাশ তত ঢাকে ধুলার মেঘে,

শিখা আমার কেঁপে ওঠে অধীর হাওয়া লেগে–

 পায়ে পায়ে সৃজন করে ধাঁধা ॥

হঠাৎ শিরে লাগল আঘাত বনের শাখাজালে,

 হঠাৎ হাতে নিবল আমার বাতি।

চেয়ে দেখি পথ হারিয়ে ফেলেছি কোন্‌ কালে–

